12:29:37.424991 IP 192.168.1.143.43700 > 54.88.234.6.80: tcp 0
12:29:37.452850 IP 54.88.234.6.80 > 192.168.1.143.43700: tcp 0
12:29:37.452873 IP 192.168.1.143.43700 > 54.88.234.6.80: tcp 0
12:29:38.454656 IP 192.168.1.143.43732 > 54.88.234.6.80: tcp 0
12:29:38.478558 IP 54.88.234.6.80 > 192.168.1.143.43732: tcp 0
12:29:38.478589 IP 192.168.1.143.43732 > 54.88.234.6.80: tcp 0
12:29:47.434252 IP 192.168.1.143.43732 > 54.88.234.6.80: tcp 636
12:29:47.456678 IP 54.88.234.6.80 > 192.168.1.143.43732: tcp 0
12:29:47.505437 IP 54.88.234.6.80 > 192.168.1.143.43732: tcp 1448
12:29:47.505457 IP 192.168.1.143.43732 > 54.88.234.6.80: tcp 0
12:29:47.505774 IP 54.88.234.6.80 > 192.168.1.143.43732: tcp 1448
12:29:47.505782 IP 192.168.1.143.43732 > 54.88.234.6.80: tcp 0
12:29:47.505827 IP 54.88.234.6.80 > 192.168.1.143.43732: tcp 1448
12:29:47.505836 IP 192.168.1.143.43732 > 54.88.234.6.80: tcp 0
12:29:47.506458 IP 54.88.234.6.80 > 192.168.1.143.43732: tcp 1448
12:29:47.506465 IP 192.168.1.143.43732 > 54.88.234.6.80: tcp 0
12:29:47.506509 IP 54.88.234.6.80 > 192.168.1.143.43732: tcp 1448
12:29:47.506515 IP 192.168.1.143.43732 > 54.88.234.6.80: tcp 0
12:29:47.507177 IP 54.88.234.6.80 > 192.168.1.143.43732: tcp 1448
12:29:47.507183 IP 192.168.1.143.43732 > 54.88.234.6.80: tcp 0
12:29:47.507230 IP 54.88.234.6.80 > 192.168.1.143.43732: tcp 1448
12:29:47.507236 IP 192.168.1.143.43732 > 54.88.234.6.80: tcp 0
12:29:47.507821 IP 54.88.234.6.80 > 192.168.1.143.43732: tcp 1448
12:29:47.507828 IP 192.168.1.143.43732 > 54.88.234.6.80: tcp 0
12:29:47.507872 IP 54.88.234.6.80 > 192.168.1.143.43732: tcp 1448
12:29:47.507887 IP 192.168.1.143.43732 > 54.88.234.6.80: tcp 0
12:29:47.508509 IP 54.88.234.6.80 > 192.168.1.143.43732: tcp 1448
12:29:47.508519 IP 192.168.1.143.43732 > 54.88.234.6.80: tcp 0
12:29:47.527006 IP 54.88.234.6.80 > 192.168.1.143.43732: tcp 1448
12:29:47.527038 IP 192.168.1.143.43732 > 54.88.234.6.80: tcp 0
12:29:47.527325 IP 54.88.234.6.80 > 192.168.1.143.43732: tcp 1448
12:29:47.527338 IP 192.168.1.143.43732 > 54.88.234.6.80: tcp 0
12:29:47.527383 IP 54.88.234.6.80 > 192.168.1.143.43732: tcp 1448
12:29:47.527391 IP 192.168.1.143.43732 > 54.88.234.6.80: tcp 0
12:29:47.527970 IP 54.88.234.6.80 > 192.168.1.143.43732: tcp 1448
12:29:47.527991 IP 192.168.1.143.43732 > 54.88.234.6.80: tcp 0
12:29:47.528028 IP 54.88.234.6.80 > 192.168.1.143.43732: tcp 1366
12:29:47.528038 IP 192.168.1.143.43732 > 54.88.234.6.80: tcp 0
12:30:08.183709 IP 192.168.1.143.43732 > 54.88.234.6.80: tcp 854
12:30:08.209637 IP 54.88.234.6.80 > 192.168.1.143.43732: tcp 0
12:30:08.227912 IP 54.88.234.6.80 > 192.168.1.143.43732: tcp 441
12:30:08.227940 IP 192.168.1.143.43732 > 54.88.234.6.80: tcp 0

