16:14:58.541695 IP 10.253.69.88.54694 > 182.92.218.51.80: tcp 0
16:14:58.888318 IP 182.92.218.51.80 > 10.253.69.88.54671: tcp 1386
16:14:58.888417 IP 10.253.69.88.54671 > 182.92.218.51.80: tcp 0
16:14:58.902235 IP 182.92.218.51.80 > 10.253.69.88.54694: tcp 0
16:14:59.270697 IP 10.253.69.88.54697 > 182.92.218.51.80: tcp 0
16:14:59.628799 IP 182.92.218.51.80 > 10.253.69.88.54697: tcp 0
16:14:59.628981 IP 10.253.69.88.54697 > 182.92.218.51.80: tcp 0
16:14:59.631019 IP 10.253.69.88.54697 > 182.92.218.51.80: tcp 941
16:14:59.982042 IP 182.92.218.51.80 > 10.253.69.88.54697: tcp 0
16:15:00.557773 IP 182.92.218.51.80 > 10.253.69.88.54697: tcp 1386
16:15:00.559224 IP 182.92.218.51.80 > 10.253.69.88.54697: tcp 1386
16:15:00.559306 IP 10.253.69.88.54697 > 182.92.218.51.80: tcp 0
16:15:00.911784 IP 182.92.218.51.80 > 10.253.69.88.54697: tcp 1386
16:15:00.911958 IP 182.92.218.51.80 > 10.253.69.88.54697: tcp 1386
16:15:00.912020 IP 10.253.69.88.54697 > 182.92.218.51.80: tcp 0
16:15:00.915768 IP 182.92.218.51.80 > 10.253.69.88.54697: tcp 1386
16:15:00.921747 IP 10.253.69.88.54684 > 182.92.218.51.80: tcp 0
16:15:01.117722 IP 10.253.69.88.54697 > 182.92.218.51.80: tcp 0
16:15:01.259716 IP 182.92.218.51.80 > 10.253.69.88.54697: tcp 1386
16:15:01.259837 IP 10.253.69.88.54697 > 182.92.218.51.80: tcp 0
16:15:01.261534 IP 182.92.218.51.80 > 10.253.69.88.54697: tcp 436
16:15:01.261596 IP 10.253.69.88.54697 > 182.92.218.51.80: tcp 0
16:15:01.282514 IP 182.92.218.51.80 > 10.253.69.88.54684: tcp 0
16:15:02.536688 IP 182.92.218.51.80 > 10.253.69.88.54697: tcp 1386
16:15:02.536853 IP 10.253.69.88.54697 > 182.92.218.51.80: tcp 0
16:15:02.544820 IP 10.253.69.88.54697 > 182.92.218.51.80: tcp 932
16:15:02.892508 IP 182.92.218.51.80 > 10.253.69.88.54697: tcp 0
16:15:03.395898 IP 10.253.69.88.54701 > 182.92.218.51.80: tcp 0
16:15:03.414079 IP 10.253.69.88.54702 > 182.92.218.51.80: tcp 0
16:15:03.415667 IP 10.253.69.88.54703 > 182.92.218.51.80: tcp 0
16:15:03.423374 IP 10.253.69.88.54704 > 182.92.218.51.80: tcp 0
16:15:03.762288 IP 182.92.218.51.80 > 10.253.69.88.54703: tcp 0
16:15:03.762479 IP 10.253.69.88.54703 > 182.92.218.51.80: tcp 0
16:15:03.764875 IP 10.253.69.88.54703 > 182.92.218.51.80: tcp 985
16:15:03.825637 IP 182.92.218.51.80 > 10.253.69.88.54704: tcp 0
16:15:03.825833 IP 10.253.69.88.54704 > 182.92.218.51.80: tcp 0
16:15:03.828106 IP 10.253.69.88.54704 > 182.92.218.51.80: tcp 972
16:15:03.853704 IP 182.92.218.51.80 > 10.253.69.88.54701: tcp 0
16:15:03.853835 IP 10.253.69.88.54701 > 182.92.218.51.80: tcp 0
16:15:03.855808 IP 10.253.69.88.54701 > 182.92.218.51.80: tcp 973
16:15:04.112957 IP 182.92.218.51.80 > 10.253.69.88.54703: tcp 0
16:15:04.207624 IP 182.92.218.51.80 > 10.253.69.88.54704: tcp 0
16:15:04.301405 IP 182.92.218.51.80 > 10.253.69.88.54704: tcp 792
16:15:04.305575 IP 10.253.69.88.54704 > 182.92.218.51.80: tcp 1284
16:15:04.309107 IP 182.92.218.51.80 > 10.253.69.88.54701: tcp 0
16:15:04.457886 IP 182.92.218.51.80 > 10.253.69.88.54701: tcp 699
16:15:04.462321 IP 182.92.218.51.80 > 10.253.69.88.54703: tcp 789
16:15:04.657802 IP 10.253.69.88.54701 > 182.92.218.51.80: tcp 0
16:15:04.661777 IP 10.253.69.88.54703 > 182.92.218.51.80: tcp 0
16:15:04.675641 IP 182.92.218.51.80 > 10.253.69.88.54704: tcp 0
16:15:04.941525 IP 182.92.218.51.80 > 10.253.69.88.54704: tcp 1386
16:15:04.941812 IP 182.92.218.51.80 > 10.253.69.88.54704: tcp 281
16:15:04.941897 IP 10.253.69.88.54704 > 182.92.218.51.80: tcp 0
16:15:05.032976 IP 182.92.218.51.80 > 10.253.69.88.54697: tcp 269
16:15:05.232852 IP 10.253.69.88.54697 > 182.92.218.51.80: tcp 0
16:15:06.414923 IP 10.253.69.88.54702 > 182.92.218.51.80: tcp 0
16:15:06.761957 IP 182.92.218.51.80 > 10.253.69.88.54702: tcp 0
16:15:06.762122 IP 10.253.69.88.54702 > 182.92.218.51.80: tcp 0
16:15:07.893194 IP 182.92.218.51.80 > 10.253.69.88.54697: tcp 0
16:15:07.893329 IP 10.253.69.88.54697 > 182.92.218.51.80: tcp 0
16:15:08.542097 IP 10.253.69.88.54697 > 182.92.218.51.80: tcp 0
16:15:08.910647 IP 182.92.218.51.80 > 10.253.69.88.54697: tcp 0
16:15:09.449093 IP 182.92.218.51.80 > 10.253.69.88.54701: tcp 0
16:15:09.449212 IP 10.253.69.88.54701 > 182.92.218.51.80: tcp 0
16:15:09.461969 IP 182.92.218.51.80 > 10.253.69.88.54703: tcp 0
16:15:09.462056 IP 10.253.69.88.54703 > 182.92.218.51.80: tcp 0
16:15:09.940215 IP 182.92.218.51.80 > 10.253.69.88.54704: tcp 0
16:15:09.940346 IP 10.253.69.88.54704 > 182.92.218.51.80: tcp 0
16:15:10.766966 IP 10.253.69.88.54701 > 182.92.218.51.80: tcp 0
16:15:10.767233 IP 10.253.69.88.54703 > 182.92.218.51.80: tcp 0
16:15:10.767433 IP 10.253.69.88.54704 > 182.92.218.51.80: tcp 0
16:15:10.769199 IP 10.253.69.88.54702 > 182.92.218.51.80: tcp 937
16:15:11.117318 IP 182.92.218.51.80 > 10.253.69.88.54703: tcp 0
16:15:11.140225 IP 182.92.218.51.80 > 10.253.69.88.54704: tcp 0
16:15:11.214827 IP 182.92.218.51.80 > 10.253.69.88.54701: tcp 0
16:15:11.919361 IP 182.92.218.51.80 > 10.253.69.88.54702: tcp 1386
16:15:11.919531 IP 182.92.218.51.80 > 10.253.69.88.54702: tcp 1386
16:15:11.919585 IP 10.253.69.88.54702 > 182.92.218.51.80: tcp 0
16:15:12.272553 IP 182.92.218.51.80 > 10.253.69.88.54702: tcp 1386
16:15:12.478993 IP 10.253.69.88.54702 > 182.92.218.51.80: tcp 0
16:15:12.548179 IP 182.92.218.51.80 > 10.253.69.88.54684: tcp 331
16:15:12.548328 IP 10.253.69.88.54684 > 182.92.218.51.80: tcp 0
16:15:12.827372 IP 182.92.218.51.80 > 10.253.69.88.54702: tcp 1386
16:15:12.827449 IP 10.253.69.88.54702 > 182.92.218.51.80: tcp 0
16:15:13.175276 IP 182.92.218.51.80 > 10.253.69.88.54702: tcp 1386
16:15:13.175395 IP 10.253.69.88.54702 > 182.92.218.51.80: tcp 0
16:15:13.523243 IP 182.92.218.51.80 > 10.253.69.88.54702: tcp 1386
16:15:13.523389 IP 10.253.69.88.54702 > 182.92.218.51.80: tcp 0
16:15:15.002691 IP 182.92.218.51.80 > 10.253.69.88.54702: tcp 1386
16:15:15.002839 IP 10.253.69.88.54702 > 182.92.218.51.80: tcp 0
16:15:15.372884 IP 182.92.218.51.80 > 10.253.69.88.54702: tcp 1386
16:15:15.373053 IP 10.253.69.88.54702 > 182.92.218.51.80: tcp 0
16:15:15.373238 IP 182.92.218.51.80 > 10.253.69.88.54702: tcp 1386
16:15:15.485464 IP 10.253.69.88.54712 > 182.92.218.51.80: tcp 0
16:15:15.485953 IP 10.253.69.88.54713 > 182.92.218.51.80: tcp 0
16:15:15.579057 IP 10.253.69.88.54702 > 182.92.218.51.80: tcp 0
16:15:15.723263 IP 182.92.218.51.80 > 10.253.69.88.54702: tcp 855
16:15:15.726483 IP 10.253.69.88.54702 > 182.92.218.51.80: tcp 913
16:15:15.833870 IP 182.92.218.51.80 > 10.253.69.88.54712: tcp 0
16:15:15.834045 IP 10.253.69.88.54712 > 182.92.218.51.80: tcp 0
16:15:15.836311 IP 10.253.69.88.54712 > 182.92.218.51.80: tcp 925
16:15:16.074842 IP 182.92.218.51.80 > 10.253.69.88.54702: tcp 0
16:15:16.075905 IP 182.92.218.51.80 > 10.253.69.88.54702: tcp 269
16:15:16.233289 IP 182.92.218.51.80 > 10.253.69.88.54712: tcp 0
16:15:16.275130 IP 10.253.69.88.54702 > 182.92.218.51.80: tcp 0
16:15:16.703737 IP 10.253.69.88.54702 > 182.92.218.51.80: tcp 965
16:15:16.705425 IP 10.253.69.88.54715 > 182.92.218.51.80: tcp 0
16:15:16.711559 IP 10.253.69.88.54716 > 182.92.218.51.80: tcp 0
16:15:17.058993 IP 182.92.218.51.80 > 10.253.69.88.54716: tcp 0
16:15:17.059180 IP 10.253.69.88.54716 > 182.92.218.51.80: tcp 0
16:15:17.060814 IP 10.253.69.88.54716 > 182.92.218.51.80: tcp 966
16:15:17.127204 IP 182.92.218.51.80 > 10.253.69.88.54702: tcp 791
16:15:17.129668 IP 10.253.69.88.54702 > 182.92.218.51.80: tcp 1055
16:15:17.477814 IP 182.92.218.51.80 > 10.253.69.88.54702: tcp 0
16:15:17.548268 IP 182.92.218.51.80 > 10.253.69.88.54716: tcp 699
16:15:17.739361 IP 182.92.218.51.80 > 10.253.69.88.54702: tcp 1386
16:15:17.742310 IP 182.92.218.51.80 > 10.253.69.88.54702: tcp 78
16:15:17.742377 IP 10.253.69.88.54702 > 182.92.218.51.80: tcp 0
16:15:17.748085 IP 10.253.69.88.54716 > 182.92.218.51.80: tcp 0
16:15:18.485247 IP 10.253.69.88.54713 > 182.92.218.51.80: tcp 0
16:15:18.846604 IP 182.92.218.51.80 > 10.253.69.88.54713: tcp 0
16:15:18.846783 IP 10.253.69.88.54713 > 182.92.218.51.80: tcp 0
16:15:19.030092 IP 10.253.69.88.54702 > 182.92.218.51.80: tcp 938
16:15:19.380554 IP 182.92.218.51.80 > 10.253.69.88.54713: tcp 0
16:15:19.380664 IP 10.253.69.88.54713 > 182.92.218.51.80: tcp 0
16:15:19.387455 IP 182.92.218.51.80 > 10.253.69.88.54702: tcp 0
16:15:19.707209 IP 10.253.69.88.54715 > 182.92.218.51.80: tcp 0
16:15:19.814454 IP 182.92.218.51.80 > 10.253.69.88.54702: tcp 1386
16:15:19.816163 IP 182.92.218.51.80 > 10.253.69.88.54702: tcp 1386
16:15:19.816231 IP 10.253.69.88.54702 > 182.92.218.51.80: tcp 0
16:15:19.816382 IP 182.92.218.51.80 > 10.253.69.88.54702: tcp 1386
16:15:19.825932 IP 10.253.69.88.54712 > 182.92.218.51.80: tcp 0
16:15:20.011210 IP 10.253.69.88.54702 > 182.92.218.51.80: tcp 0
16:15:20.055976 IP 182.92.218.51.80 > 10.253.69.88.54715: tcp 0
16:15:20.056138 IP 10.253.69.88.54715 > 182.92.218.51.80: tcp 0
16:15:20.372686 IP 182.92.218.51.80 > 10.253.69.88.54715: tcp 0
16:15:20.372777 IP 10.253.69.88.54715 > 182.92.218.51.80: tcp 0
16:15:20.372931 IP 182.92.218.51.80 > 10.253.69.88.54702: tcp 1386
16:15:20.372992 IP 10.253.69.88.54702 > 182.92.218.51.80: tcp 0
16:15:20.721527 IP 182.92.218.51.80 > 10.253.69.88.54702: tcp 196
16:15:20.721660 IP 10.253.69.88.54702 > 182.92.218.51.80: tcp 0
16:15:20.757254 IP 10.253.69.88.54712 > 182.92.218.51.80: tcp 0
16:15:21.070706 IP 182.92.218.51.80 > 10.253.69.88.54702: tcp 1386
16:15:21.070852 IP 10.253.69.88.54702 > 182.92.218.51.80: tcp 0
16:15:21.103745 IP 182.92.218.51.80 > 10.253.69.88.54712: tcp 0
16:15:21.421212 IP 182.92.218.51.80 > 10.253.69.88.54702: tcp 1386
16:15:21.421376 IP 10.253.69.88.54702 > 182.92.218.51.80: tcp 0
16:15:21.429621 IP 10.253.69.88.54702 > 182.92.218.51.80: tcp 883
16:15:21.779357 IP 182.92.218.51.80 > 10.253.69.88.54702: tcp 1386
16:15:21.917692 IP 10.253.69.88.54716 > 182.92.218.51.80: tcp 986
16:15:21.935535 IP 10.253.69.88.54713 > 182.92.218.51.80: tcp 973
16:15:21.937464 IP 10.253.69.88.54715 > 182.92.218.51.80: tcp 974
16:15:21.979217 IP 10.253.69.88.54702 > 182.92.218.51.80: tcp 0
16:15:22.289949 IP 182.92.218.51.80 > 10.253.69.88.54715: tcp 0
16:15:22.296451 IP 182.92.218.51.80 > 10.253.69.88.54713: tcp 0
16:15:22.328790 IP 182.92.218.51.80 > 10.253.69.88.54702: tcp 1386
16:15:22.380780 IP 182.92.218.51.80 > 10.253.69.88.54713: tcp 792
16:15:22.423105 IP 182.92.218.51.80 > 10.253.69.88.54715: tcp 699
16:15:22.529298 IP 10.253.69.88.54702 > 182.92.218.51.80: tcp 0
16:15:22.580301 IP 10.253.69.88.54713 > 182.92.218.51.80: tcp 0
16:15:22.622277 IP 10.253.69.88.54715 > 182.92.218.51.80: tcp 0
16:15:22.683122 IP 182.92.218.51.80 > 10.253.69.88.54716: tcp 787
16:15:22.877330 IP 182.92.218.51.80 > 10.253.69.88.54702: tcp 1146
16:15:22.877444 IP 10.253.69.88.54702 > 182.92.218.51.80: tcp 0
16:15:22.889335 IP 10.253.69.88.54716 > 182.92.218.51.80: tcp 0
16:15:23.843489 IP 182.92.218.51.80 > 10.253.69.88.54702: tcp 1386
16:15:23.843647 IP 10.253.69.88.54702 > 182.92.218.51.80: tcp 0
16:15:25.184868 IP 182.92.218.51.80 > 10.253.69.88.54712: tcp 270
16:15:25.185014 IP 10.253.69.88.54712 > 182.92.218.51.80: tcp 0
16:15:25.632092 IP 10.253.69.88.54702 > 182.92.218.51.80: tcp 942
16:15:26.019636 IP 182.92.218.51.80 > 10.253.69.88.54702: tcp 0
16:15:26.340641 IP 182.92.218.51.80 > 10.253.69.88.54702: tcp 1386
16:15:26.340769 IP 10.253.69.88.54702 > 182.92.218.51.80: tcp 0
16:15:26.689559 IP 182.92.218.51.80 > 10.253.69.88.54702: tcp 1386
16:15:26.689669 IP 10.253.69.88.54702 > 182.92.218.51.80: tcp 0
16:15:27.039462 IP 182.92.218.51.80 > 10.253.69.88.54702: tcp 1386
16:15:27.039582 IP 10.253.69.88.54702 > 182.92.218.51.80: tcp 0
16:15:27.387979 IP 182.92.218.51.80 > 10.253.69.88.54702: tcp 1386
16:15:27.388150 IP 10.253.69.88.54702 > 182.92.218.51.80: tcp 0
16:15:27.628074 IP 182.92.218.51.80 > 10.253.69.88.54716: tcp 0
16:15:27.628214 IP 10.253.69.88.54716 > 182.92.218.51.80: tcp 0
16:15:27.751404 IP 182.92.218.51.80 > 10.253.69.88.54702: tcp 1386
16:15:27.957438 IP 10.253.69.88.54702 > 182.92.218.51.80: tcp 0
16:15:28.323904 IP 182.92.218.51.80 > 10.253.69.88.54702: tcp 1386
16:15:28.324966 IP 182.92.218.51.80 > 10.253.69.88.54702: tcp 1386
16:15:28.325015 IP 10.253.69.88.54702 > 182.92.218.51.80: tcp 0
16:15:28.542574 IP 10.253.69.88.54716 > 182.92.218.51.80: tcp 0
16:15:28.682330 IP 182.92.218.51.80 > 10.253.69.88.54702: tcp 1299
16:15:28.688229 IP 10.253.69.88.54702 > 182.92.218.51.80: tcp 917
16:15:28.689602 IP 10.253.69.88.54715 > 182.92.218.51.80: tcp 929
16:15:28.895041 IP 182.92.218.51.80 > 10.253.69.88.54716: tcp 0
16:15:29.037148 IP 182.92.218.51.80 > 10.253.69.88.54702: tcp 0
16:15:29.038255 IP 182.92.218.51.80 > 10.253.69.88.54702: tcp 269
16:15:29.038361 IP 182.92.218.51.80 > 10.253.69.88.54715: tcp 0
16:15:29.074305 IP 182.92.218.51.80 > 10.253.69.88.54713: tcp 0
16:15:29.074425 IP 10.253.69.88.54713 > 182.92.218.51.80: tcp 0
16:15:29.237413 IP 10.253.69.88.54702 > 182.92.218.51.80: tcp 0
16:15:29.255525 IP 182.92.218.51.80 > 10.253.69.88.54715: tcp 0
16:15:29.255638 IP 10.253.69.88.54715 > 182.92.218.51.80: tcp 0
16:15:29.255808 IP 10.253.69.88.54715 > 182.92.218.51.80: tcp 0
16:15:29.256176 IP 10.253.69.88.54713 > 182.92.218.51.80: tcp 0
16:15:29.257847 IP 10.253.69.88.54702 > 182.92.218.51.80: tcp 929
16:15:29.614417 IP 182.92.218.51.80 > 10.253.69.88.54713: tcp 0
16:15:29.614571 IP 182.92.218.51.80 > 10.253.69.88.54715: tcp 0
16:15:29.700893 IP 10.253.69.88.54727 > 182.92.218.51.80: tcp 0
16:15:30.064472 IP 182.92.218.51.80 > 10.253.69.88.54727: tcp 0
16:15:30.064603 IP 10.253.69.88.54727 > 182.92.218.51.80: tcp 0
16:15:30.066457 IP 10.253.69.88.54727 > 182.92.218.51.80: tcp 935
16:15:30.438941 IP 182.92.218.51.80 > 10.253.69.88.54727: tcp 0
16:15:30.527828 IP 182.92.218.51.80 > 10.253.69.88.54702: tcp 269
16:15:30.727543 IP 10.253.69.88.54702 > 182.92.218.51.80: tcp 0
16:15:30.827784 IP 182.92.218.51.80 > 10.253.69.88.54727: tcp 1386
16:15:31.027477 IP 10.253.69.88.54727 > 182.92.218.51.80: tcp 0
16:15:31.078144 IP 10.253.69.88.54702 > 182.92.218.51.80: tcp 969
16:15:31.079856 IP 10.253.69.88.54728 > 182.92.218.51.80: tcp 0
16:15:31.085011 IP 10.253.69.88.54729 > 182.92.218.51.80: tcp 0
16:15:31.400573 IP 182.92.218.51.80 > 10.253.69.88.54727: tcp 1386
16:15:31.400676 IP 10.253.69.88.54727 > 182.92.218.51.80: tcp 0
16:15:31.436273 IP 182.92.218.51.80 > 10.253.69.88.54728: tcp 0
16:15:31.436413 IP 10.253.69.88.54728 > 182.92.218.51.80: tcp 0
16:15:31.438382 IP 10.253.69.88.54728 > 182.92.218.51.80: tcp 970
16:15:31.440016 IP 182.92.218.51.80 > 10.253.69.88.54729: tcp 0
16:15:31.440155 IP 10.253.69.88.54729 > 182.92.218.51.80: tcp 0
16:15:31.441593 IP 10.253.69.88.54729 > 182.92.218.51.80: tcp 1053
16:15:31.478670 IP 182.92.218.51.80 > 10.253.69.88.54702: tcp 0
16:15:31.792948 IP 182.92.218.51.80 > 10.253.69.88.54728: tcp 0
16:15:31.794163 IP 182.92.218.51.80 > 10.253.69.88.54729: tcp 0
16:15:31.933803 IP 182.92.218.51.80 > 10.253.69.88.54728: tcp 699
16:15:32.055737 IP 182.92.218.51.80 > 10.253.69.88.54729: tcp 1386
16:15:32.056782 IP 182.92.218.51.80 > 10.253.69.88.54729: tcp 79
16:15:32.056864 IP 10.253.69.88.54729 > 182.92.218.51.80: tcp 0
16:15:32.133559 IP 10.253.69.88.54728 > 182.92.218.51.80: tcp 0
16:15:33.068521 IP 182.92.218.51.80 > 10.253.69.88.54727: tcp 1386
16:15:33.068670 IP 10.253.69.88.54727 > 182.92.218.51.80: tcp 0
16:15:33.342469 IP 182.92.218.51.80 > 10.253.69.88.54702: tcp 791
16:15:33.442169 IP 182.92.218.51.80 > 10.253.69.88.54727: tcp 1386
16:15:33.483761 IP 10.253.69.88.54702 > 182.92.218.51.80: tcp 914
16:15:33.645572 IP 10.253.69.88.54727 > 182.92.218.51.80: tcp 0
16:15:33.831966 IP 182.92.218.51.80 > 10.253.69.88.54702: tcp 0
16:15:33.833181 IP 182.92.218.51.80 > 10.253.69.88.54702: tcp 269
16:15:33.950972 IP 10.253.69.88.54702 > 182.92.218.51.80: tcp 926
16:15:34.049818 IP 182.92.218.51.80 > 10.253.69.88.54727: tcp 475
16:15:34.049933 IP 10.253.69.88.54727 > 182.92.218.51.80: tcp 0
16:15:34.307516 IP 182.92.218.51.80 > 10.253.69.88.54702: tcp 269
16:15:34.507612 IP 10.253.69.88.54702 > 182.92.218.51.80: tcp 0
16:15:35.869590 IP 182.92.218.51.80 > 10.253.69.88.54727: tcp 0
16:15:35.869662 IP 10.253.69.88.54727 > 182.92.218.51.80: tcp 0
16:15:37.003029 IP 10.253.69.88.54702 > 182.92.218.51.80: tcp 939
16:15:37.056123 IP 182.92.218.51.80 > 10.253.69.88.54729: tcp 0
16:15:37.056263 IP 10.253.69.88.54729 > 182.92.218.51.80: tcp 0
16:15:37.431267 IP 182.92.218.51.80 > 10.253.69.88.54702: tcp 0
16:15:37.431395 IP 182.92.218.51.80 > 10.253.69.88.54727: tcp 1386
16:15:37.431496 IP 10.253.69.88.54727 > 182.92.218.51.80: tcp 0
16:15:37.432327 IP 10.253.69.88.54727 > 182.92.218.51.80: tcp 0
16:15:37.811010 IP 182.92.218.51.80 > 10.253.69.88.54727: tcp 0
16:15:38.542827 IP 10.253.69.88.54729 > 182.92.218.51.80: tcp 0
16:15:38.598765 IP 182.92.218.51.80 > 10.253.69.88.54702: tcp 1386
16:15:38.798696 IP 10.253.69.88.54702 > 182.92.218.51.80: tcp 0
16:15:38.892216 IP 182.92.218.51.80 > 10.253.69.88.54729: tcp 0
16:15:39.147989 IP 182.92.218.51.80 > 10.253.69.88.54702: tcp 1386
16:15:39.348716 IP 10.253.69.88.54702 > 182.92.218.51.80: tcp 0
16:15:39.696723 IP 182.92.218.51.80 > 10.253.69.88.54702: tcp 1386
16:15:39.696801 IP 10.253.69.88.54702 > 182.92.218.51.80: tcp 0
16:15:40.044149 IP 182.92.218.51.80 > 10.253.69.88.54702: tcp 292
16:15:40.044265 IP 10.253.69.88.54702 > 182.92.218.51.80: tcp 0
16:15:42.170338 IP 182.92.218.51.80 > 10.253.69.88.54702: tcp 1386
16:15:42.170497 IP 10.253.69.88.54702 > 182.92.218.51.80: tcp 0
16:15:42.545554 IP 182.92.218.51.80 > 10.253.69.88.54702: tcp 1386
16:15:42.545718 IP 10.253.69.88.54702 > 182.92.218.51.80: tcp 0
16:15:42.728256 IP 182.92.218.51.80 > 10.253.69.88.54702: tcp 0
16:15:42.728357 IP 10.253.69.88.54702 > 182.92.218.51.80: tcp 0
16:15:43.664204 IP 10.253.69.88.54702 > 182.92.218.51.80: tcp 0
16:15:43.665371 IP 10.253.69.88.54728 > 182.92.218.51.80: tcp 973
16:15:43.666837 IP 10.253.69.88.54745 > 182.92.218.51.80: tcp 0
16:15:44.019297 IP 182.92.218.51.80 > 10.253.69.88.54702: tcp 0
16:15:44.019395 IP 182.92.218.51.80 > 10.253.69.88.54728: tcp 0
16:15:44.020561 IP 182.92.218.51.80 > 10.253.69.88.54745: tcp 0
16:15:44.020669 IP 10.253.69.88.54745 > 182.92.218.51.80: tcp 0
16:15:44.021227 IP 10.253.69.88.54748 > 182.92.218.51.80: tcp 0
16:15:44.024000 IP 10.253.69.88.54745 > 182.92.218.51.80: tcp 974
16:15:44.382788 IP 182.92.218.51.80 > 10.253.69.88.54748: tcp 0
16:15:44.382869 IP 10.253.69.88.54748 > 182.92.218.51.80: tcp 0
16:15:44.384075 IP 10.253.69.88.54748 > 182.92.218.51.80: tcp 973
16:15:44.384541 IP 182.92.218.51.80 > 10.253.69.88.54745: tcp 0
16:15:44.738829 IP 182.92.218.51.80 > 10.253.69.88.54748: tcp 0
16:15:44.820076 IP 182.92.218.51.80 > 10.253.69.88.54748: tcp 792
16:15:45.019911 IP 10.253.69.88.54748 > 182.92.218.51.80: tcp 0
16:15:46.100219 IP 10.253.69.88.54748 > 182.92.218.51.80: tcp 991
16:15:46.455464 IP 182.92.218.51.80 > 10.253.69.88.54748: tcp 0
16:15:46.535934 IP 182.92.218.51.80 > 10.253.69.88.54748: tcp 693
16:15:46.543062 IP 10.253.69.88.54748 > 182.92.218.51.80: tcp 995
16:15:46.899323 IP 182.92.218.51.80 > 10.253.69.88.54748: tcp 0
16:15:47.521653 IP 182.92.218.51.80 > 10.253.69.88.54745: tcp 699
16:15:47.523431 IP 182.92.218.51.80 > 10.253.69.88.54748: tcp 1386
16:15:47.523509 IP 10.253.69.88.54748 > 182.92.218.51.80: tcp 0
16:15:47.720929 IP 10.253.69.88.54745 > 182.92.218.51.80: tcp 0
16:15:47.872166 IP 182.92.218.51.80 > 10.253.69.88.54748: tcp 1386
16:15:47.872268 IP 10.253.69.88.54748 > 182.92.218.51.80: tcp 0
16:15:48.220845 IP 182.92.218.51.80 > 10.253.69.88.54748: tcp 1386
16:15:48.220954 IP 10.253.69.88.54748 > 182.92.218.51.80: tcp 0
16:15:48.582269 IP 182.92.218.51.80 > 10.253.69.88.54748: tcp 1386
16:15:48.582437 IP 10.253.69.88.54748 > 182.92.218.51.80: tcp 0
16:15:48.638501 IP 10.253.69.88.54745 > 182.92.218.51.80: tcp 1013
16:15:48.639608 IP 10.253.69.88.54775 > 182.92.218.51.80: tcp 0
16:15:48.640201 IP 10.253.69.88.54776 > 182.92.218.51.80: tcp 0
16:15:48.931256 IP 182.92.218.51.80 > 10.253.69.88.54748: tcp 1386
16:15:48.987380 IP 182.92.218.51.80 > 10.253.69.88.54745: tcp 0
16:15:48.990949 IP 182.92.218.51.80 > 10.253.69.88.54776: tcp 0
16:15:48.991079 IP 10.253.69.88.54776 > 182.92.218.51.80: tcp 0
16:15:48.991255 IP 182.92.218.51.80 > 10.253.69.88.54745: tcp 269
16:15:48.992597 IP 182.92.218.51.80 > 10.253.69.88.54775: tcp 0
16:15:48.992699 IP 10.253.69.88.54775 > 182.92.218.51.80: tcp 0
16:15:48.994269 IP 10.253.69.88.54776 > 182.92.218.51.80: tcp 1001
16:15:48.996297 IP 10.253.69.88.54745 > 182.92.218.51.80: tcp 1019
16:15:49.130944 IP 10.253.69.88.54748 > 182.92.218.51.80: tcp 0
16:15:49.345242 IP 182.92.218.51.80 > 10.253.69.88.54776: tcp 0
16:15:49.345369 IP 182.92.218.51.80 > 10.253.69.88.54776: tcp 270
16:15:49.347600 IP 182.92.218.51.80 > 10.253.69.88.54745: tcp 269
16:15:49.442453 IP 10.253.69.88.54745 > 182.92.218.51.80: tcp 1023
16:15:49.444172 IP 10.253.69.88.54777 > 182.92.218.51.80: tcp 0
16:15:49.446372 IP 10.253.69.88.54776 > 182.92.218.51.80: tcp 1015
16:15:49.448263 IP 10.253.69.88.54775 > 182.92.218.51.80: tcp 1019
16:15:49.488786 IP 182.92.218.51.80 > 10.253.69.88.54748: tcp 1386
16:15:49.488894 IP 182.92.218.51.80 > 10.253.69.88.54748: tcp 1254
16:15:49.488942 IP 10.253.69.88.54748 > 182.92.218.51.80: tcp 0
16:15:49.490886 IP 10.253.69.88.54748 > 182.92.218.51.80: tcp 1019
16:15:49.492820 IP 10.253.69.88.54778 > 182.92.218.51.80: tcp 0
16:15:49.811628 IP 182.92.218.51.80 > 10.253.69.88.54745: tcp 269
16:15:49.812333 IP 182.92.218.51.80 > 10.253.69.88.54776: tcp 269
16:15:49.814934 IP 182.92.218.51.80 > 10.253.69.88.54775: tcp 270
16:15:49.816355 IP 10.253.69.88.54745 > 182.92.218.51.80: tcp 1013
16:15:49.819107 IP 182.92.218.51.80 > 10.253.69.88.54777: tcp 0
16:15:49.819253 IP 10.253.69.88.54777 > 182.92.218.51.80: tcp 0
16:15:49.857389 IP 182.92.218.51.80 > 10.253.69.88.54748: tcp 0
16:15:49.858887 IP 182.92.218.51.80 > 10.253.69.88.54748: tcp 269
16:15:49.864555 IP 182.92.218.51.80 > 10.253.69.88.54778: tcp 0
16:15:49.864709 IP 10.253.69.88.54778 > 182.92.218.51.80: tcp 0
16:15:50.011023 IP 10.253.69.88.54776 > 182.92.218.51.80: tcp 0
16:15:50.013993 IP 10.253.69.88.54775 > 182.92.218.51.80: tcp 0
16:15:50.050975 IP 10.253.69.88.54748 > 182.92.218.51.80: tcp 0
16:15:50.182532 IP 182.92.218.51.80 > 10.253.69.88.54745: tcp 269
16:15:50.380970 IP 10.253.69.88.54745 > 182.92.218.51.80: tcp 0
16:15:51.103526 IP 10.253.69.88.54745 > 182.92.218.51.80: tcp 1089
16:15:51.123949 IP 10.253.69.88.54748 > 182.92.218.51.80: tcp 1053
16:15:51.125958 IP 10.253.69.88.54775 > 182.92.218.51.80: tcp 1054
16:15:51.176564 IP 10.253.69.88.54776 > 182.92.218.51.80: tcp 1051
16:15:51.366220 IP 10.253.69.88.54777 > 182.92.218.51.80: tcp 1019
16:15:51.562061 IP 182.92.218.51.80 > 10.253.69.88.54745: tcp 0
16:15:51.566287 IP 182.92.218.51.80 > 10.253.69.88.54775: tcp 0
16:15:51.566362 IP 182.92.218.51.80 > 10.253.69.88.54748: tcp 0
16:15:51.568873 IP 182.92.218.51.80 > 10.253.69.88.54776: tcp 0
16:15:51.740270 IP 182.92.218.51.80 > 10.253.69.88.54777: tcp 0
16:15:51.760561 IP 182.92.218.51.80 > 10.253.69.88.54776: tcp 1386
16:15:51.760685 IP 182.92.218.51.80 > 10.253.69.88.54776: tcp 768
16:15:51.760759 IP 10.253.69.88.54776 > 182.92.218.51.80: tcp 0
16:15:51.802279 IP 182.92.218.51.80 > 10.253.69.88.54745: tcp 788
16:15:52.002052 IP 10.253.69.88.54745 > 182.92.218.51.80: tcp 0
16:15:52.564824 IP 182.92.218.51.80 > 10.253.69.88.54777: tcp 1386
16:15:52.564933 IP 182.92.218.51.80 > 10.253.69.88.54777: tcp 1386
16:15:52.564972 IP 10.253.69.88.54777 > 182.92.218.51.80: tcp 0
16:15:52.909383 IP 182.92.218.51.80 > 10.253.69.88.54778: tcp 0
16:15:52.909493 IP 10.253.69.88.54778 > 182.92.218.51.80: tcp 0
16:15:53.039410 IP 182.92.218.51.80 > 10.253.69.88.54748: tcp 791
16:15:53.076162 IP 10.253.69.88.54775 > 182.92.218.51.80: tcp 0
16:15:53.239091 IP 10.253.69.88.54748 > 182.92.218.51.80: tcp 0
16:15:53.423620 IP 182.92.218.51.80 > 10.253.69.88.54775: tcp 0
16:15:53.423741 IP 10.253.69.88.54775 > 182.92.218.51.80: tcp 0
16:15:56.267275 IP 182.92.218.51.80 > 10.253.69.88.54777: tcp 1386
16:15:56.467136 IP 10.253.69.88.54777 > 182.92.218.51.80: tcp 0
16:15:56.639674 IP 182.92.218.51.80 > 10.253.69.88.54748: tcp 0
16:15:56.639840 IP 10.253.69.88.54748 > 182.92.218.51.80: tcp 0
16:15:56.735404 IP 182.92.218.51.80 > 10.253.69.88.54775: tcp 698
16:15:56.735556 IP 10.253.69.88.54775 > 182.92.218.51.80: tcp 0
16:15:56.780970 IP 182.92.218.51.80 > 10.253.69.88.54776: tcp 0
16:15:56.781100 IP 10.253.69.88.54776 > 182.92.218.51.80: tcp 0
16:15:56.827009 IP 182.92.218.51.80 > 10.253.69.88.54745: tcp 0
16:15:56.827107 IP 10.253.69.88.54745 > 182.92.218.51.80: tcp 0
16:15:56.840434 IP 182.92.218.51.80 > 10.253.69.88.54777: tcp 1386
16:15:57.040182 IP 10.253.69.88.54777 > 182.92.218.51.80: tcp 0
16:15:57.345841 IP 10.253.69.88.54776 > 182.92.218.51.80: tcp 0
16:15:57.346167 IP 10.253.69.88.54745 > 182.92.218.51.80: tcp 0
16:15:57.346375 IP 10.253.69.88.54748 > 182.92.218.51.80: tcp 0
16:15:57.348289 IP 10.253.69.88.54778 > 182.92.218.51.80: tcp 1014
16:15:57.413161 IP 182.92.218.51.80 > 10.253.69.88.54777: tcp 1114
16:15:57.413226 IP 10.253.69.88.54777 > 182.92.218.51.80: tcp 0
16:15:57.566574 IP 182.92.218.51.80 > 10.253.69.88.54777: tcp 0
16:15:57.566686 IP 10.253.69.88.54777 > 182.92.218.51.80: tcp 0
16:15:57.712332 IP 182.92.218.51.80 > 10.253.69.88.54776: tcp 0
16:15:57.712476 IP 182.92.218.51.80 > 10.253.69.88.54745: tcp 0
16:15:57.713833 IP 182.92.218.51.80 > 10.253.69.88.54748: tcp 0
16:15:57.720031 IP 182.92.218.51.80 > 10.253.69.88.54778: tcp 0
16:15:57.721558 IP 182.92.218.51.80 > 10.253.69.88.54778: tcp 270
16:15:57.921212 IP 10.253.69.88.54778 > 182.92.218.51.80: tcp 0
16:16:00.711116 IP 10.253.69.88.54778 > 182.92.218.51.80: tcp 1026
16:16:01.119348 IP 182.92.218.51.80 > 10.253.69.88.54778: tcp 0
16:16:01.681470 IP 182.92.218.51.80 > 10.253.69.88.54778: tcp 1386
16:16:01.681591 IP 10.253.69.88.54778 > 182.92.218.51.80: tcp 0
16:16:01.847847 IP 182.92.218.51.80 > 10.253.69.88.54777: tcp 1386
16:16:01.848017 IP 10.253.69.88.54777 > 182.92.218.51.80: tcp 0
16:16:01.849145 IP 10.253.69.88.54777 > 182.92.218.51.80: tcp 0
16:16:02.075546 IP 182.92.218.51.80 > 10.253.69.88.54778: tcp 1386
16:16:02.075665 IP 10.253.69.88.54778 > 182.92.218.51.80: tcp 0
16:16:02.223308 IP 182.92.218.51.80 > 10.253.69.88.54777: tcp 0
16:16:02.450712 IP 182.92.218.51.80 > 10.253.69.88.54778: tcp 1386
16:16:02.450831 IP 10.253.69.88.54778 > 182.92.218.51.80: tcp 0
16:16:03.082352 IP 10.253.69.88.54778 > 182.92.218.51.80: tcp 0
16:16:03.090697 IP 10.253.69.88.54785 > 182.92.218.51.80: tcp 0
16:16:03.341995 IP 10.253.69.88.54788 > 182.92.218.51.80: tcp 0
16:16:03.436583 IP 182.92.218.51.80 > 10.253.69.88.54785: tcp 0
16:16:03.436756 IP 10.253.69.88.54785 > 182.92.218.51.80: tcp 0
16:16:03.438814 IP 10.253.69.88.54785 > 182.92.218.51.80: tcp 1019
16:16:03.454880 IP 182.92.218.51.80 > 10.253.69.88.54778: tcp 1386
16:16:03.454992 IP 10.253.69.88.54778 > 182.92.218.51.80: tcp 0
16:16:03.455143 IP 182.92.218.51.80 > 10.253.69.88.54778: tcp 1386
16:16:03.455188 IP 10.253.69.88.54778 > 182.92.218.51.80: tcp 0
16:16:03.697525 IP 182.92.218.51.80 > 10.253.69.88.54788: tcp 0
16:16:03.697719 IP 10.253.69.88.54788 > 182.92.218.51.80: tcp 0
16:16:04.452403 IP 10.253.69.88.54785 > 182.92.218.51.80: tcp 1019
16:16:04.593912 IP 182.92.218.51.80 > 10.253.69.88.54785: tcp 1386
16:16:04.595338 IP 182.92.218.51.80 > 10.253.69.88.54785: tcp 1386
16:16:04.595413 IP 10.253.69.88.54785 > 182.92.218.51.80: tcp 0
16:16:04.799933 IP 182.92.218.51.80 > 10.253.69.88.54785: tcp 0
16:16:04.954131 IP 182.92.218.51.80 > 10.253.69.88.54785: tcp 1386
16:16:04.954253 IP 10.253.69.88.54785 > 182.92.218.51.80: tcp 0
16:16:04.954436 IP 182.92.218.51.80 > 10.253.69.88.54785: tcp 1386
16:16:04.954491 IP 10.253.69.88.54785 > 182.92.218.51.80: tcp 0
16:16:05.174888 IP 10.253.69.88.54785 > 182.92.218.51.80: tcp 0
16:16:05.182979 IP 10.253.69.88.54788 > 182.92.218.51.80: tcp 1019
16:16:05.308847 IP 182.92.218.51.80 > 10.253.69.88.54785: tcp 1386
16:16:05.308924 IP 10.253.69.88.54785 > 182.92.218.51.80: tcp 0
16:16:05.309040 IP 182.92.218.51.80 > 10.253.69.88.54785: tcp 1386
16:16:05.309072 IP 10.253.69.88.54785 > 182.92.218.51.80: tcp 0
16:16:05.561173 IP 182.92.218.51.80 > 10.253.69.88.54785: tcp 0
16:16:05.691469 IP 182.92.218.51.80 > 10.253.69.88.54785: tcp 1386
16:16:05.691586 IP 10.253.69.88.54785 > 182.92.218.51.80: tcp 0
16:16:05.691760 IP 182.92.218.51.80 > 10.253.69.88.54785: tcp 1386
16:16:05.691814 IP 10.253.69.88.54785 > 182.92.218.51.80: tcp 0
16:16:05.693321 IP 182.92.218.51.80 > 10.253.69.88.54785: tcp 854
16:16:05.693384 IP 10.253.69.88.54785 > 182.92.218.51.80: tcp 0
16:16:06.231427 IP 10.253.69.88.54788 > 182.92.218.51.80: tcp 1019
16:16:06.350312 IP 182.92.218.51.80 > 10.253.69.88.54788: tcp 1386
16:16:06.350393 IP 10.253.69.88.54788 > 182.92.218.51.80: tcp 0
16:16:06.600178 IP 182.92.218.51.80 > 10.253.69.88.54788: tcp 0
16:16:06.714041 IP 182.92.218.51.80 > 10.253.69.88.54788: tcp 1386
16:16:06.714152 IP 10.253.69.88.54788 > 182.92.218.51.80: tcp 0
16:16:07.207239 IP 10.253.69.88.54788 > 182.92.218.51.80: tcp 0
16:16:07.215232 IP 10.253.69.88.54790 > 182.92.218.51.80: tcp 0
16:16:07.467164 IP 10.253.69.88.54791 > 182.92.218.51.80: tcp 0
16:16:07.563830 IP 182.92.218.51.80 > 10.253.69.88.54790: tcp 0
16:16:07.564002 IP 10.253.69.88.54790 > 182.92.218.51.80: tcp 0
16:16:07.566061 IP 10.253.69.88.54790 > 182.92.218.51.80: tcp 1027
16:16:07.815976 IP 182.92.218.51.80 > 10.253.69.88.54791: tcp 0
16:16:07.816157 IP 10.253.69.88.54791 > 182.92.218.51.80: tcp 0
16:16:07.929936 IP 182.92.218.51.80 > 10.253.69.88.54790: tcp 0
16:16:07.944749 IP 182.92.218.51.80 > 10.253.69.88.54778: tcp 1386
16:16:07.944858 IP 10.253.69.88.54778 > 182.92.218.51.80: tcp 0
16:16:08.346127 IP 182.92.218.51.80 > 10.253.69.88.54790: tcp 1386
16:16:08.346254 IP 10.253.69.88.54790 > 182.92.218.51.80: tcp 0
16:16:08.704267 IP 182.92.218.51.80 > 10.253.69.88.54790: tcp 1386
16:16:08.704392 IP 10.253.69.88.54790 > 182.92.218.51.80: tcp 0
16:16:08.838452 IP 182.92.218.51.80 > 10.253.69.88.54785: tcp 1386
16:16:08.838614 IP 10.253.69.88.54785 > 182.92.218.51.80: tcp 0
16:16:09.354039 IP 182.92.218.51.80 > 10.253.69.88.54788: tcp 1386
16:16:09.354207 IP 10.253.69.88.54788 > 182.92.218.51.80: tcp 0
16:16:10.874485 IP 182.92.218.51.80 > 10.253.69.88.54791: tcp 0
16:16:10.874599 IP 10.253.69.88.54791 > 182.92.218.51.80: tcp 0
16:16:11.357295 IP 182.92.218.51.80 > 10.253.69.88.54790: tcp 1386
16:16:11.357473 IP 10.253.69.88.54790 > 182.92.218.51.80: tcp 0
16:16:11.720431 IP 182.92.218.51.80 > 10.253.69.88.54790: tcp 1386
16:16:11.720586 IP 182.92.218.51.80 > 10.253.69.88.54790: tcp 1386
16:16:11.720642 IP 10.253.69.88.54790 > 182.92.218.51.80: tcp 0
16:16:12.085932 IP 182.92.218.51.80 > 10.253.69.88.54790: tcp 1386
16:16:12.095015 IP 10.253.69.88.54791 > 182.92.218.51.80: tcp 1021
16:16:12.280547 IP 10.253.69.88.54790 > 182.92.218.51.80: tcp 0
16:16:12.443619 IP 182.92.218.51.80 > 10.253.69.88.54791: tcp 0
16:16:12.445157 IP 182.92.218.51.80 > 10.253.69.88.54791: tcp 270
16:16:12.644587 IP 10.253.69.88.54791 > 182.92.218.51.80: tcp 0
16:16:13.346289 IP 182.92.218.51.80 > 10.253.69.88.54790: tcp 0
16:16:13.346403 IP 10.253.69.88.54790 > 182.92.218.51.80: tcp 0
16:16:14.279839 IP 182.92.218.51.80 > 10.253.69.88.54790: tcp 197
16:16:14.280003 IP 10.253.69.88.54790 > 182.92.218.51.80: tcp 0
16:16:14.280763 IP 10.253.69.88.54790 > 182.92.218.51.80: tcp 0
16:16:14.283878 IP 10.253.69.88.54791 > 182.92.218.51.80: tcp 1034
16:16:14.642610 IP 10.253.69.88.54791 > 182.92.218.51.80: tcp 0
16:16:14.651287 IP 10.253.69.88.54794 > 182.92.218.51.80: tcp 0
16:16:14.661898 IP 182.92.218.51.80 > 10.253.69.88.54790: tcp 0
16:16:14.701948 IP 182.92.218.51.80 > 10.253.69.88.54791: tcp 0
16:16:14.903354 IP 10.253.69.88.54797 > 182.92.218.51.80: tcp 0
16:16:15.034191 IP 182.92.218.51.80 > 10.253.69.88.54791: tcp 0
16:16:15.084940 IP 182.92.218.51.80 > 10.253.69.88.54791: tcp 1386
16:16:15.085058 IP 10.253.69.88.54791 > 182.92.218.51.80: tcp 0
16:16:15.087148 IP 182.92.218.51.80 > 10.253.69.88.54791: tcp 1386
16:16:15.087216 IP 10.253.69.88.54791 > 182.92.218.51.80: tcp 0
16:16:15.087344 IP 182.92.218.51.80 > 10.253.69.88.54791: tcp 1386
16:16:15.087397 IP 10.253.69.88.54791 > 182.92.218.51.80: tcp 0
16:16:15.087508 IP 182.92.218.51.80 > 10.253.69.88.54791: tcp 1386
16:16:15.087559 IP 10.253.69.88.54791 > 182.92.218.51.80: tcp 0
16:16:15.087666 IP 182.92.218.51.80 > 10.253.69.88.54791: tcp 196
16:16:15.087712 IP 10.253.69.88.54791 > 182.92.218.51.80: tcp 0
16:16:15.104422 IP 182.92.218.51.80 > 10.253.69.88.54794: tcp 0
16:16:15.104516 IP 10.253.69.88.54794 > 182.92.218.51.80: tcp 0
16:16:15.106699 IP 10.253.69.88.54794 > 182.92.218.51.80: tcp 1030
16:16:15.252837 IP 182.92.218.51.80 > 10.253.69.88.54797: tcp 0
16:16:15.253009 IP 10.253.69.88.54797 > 182.92.218.51.80: tcp 0
16:16:15.440820 IP 182.92.218.51.80 > 10.253.69.88.54791: tcp 1386
16:16:15.440948 IP 10.253.69.88.54791 > 182.92.218.51.80: tcp 0
16:16:15.555903 IP 182.92.218.51.80 > 10.253.69.88.54794: tcp 0
16:16:15.927907 IP 182.92.218.51.80 > 10.253.69.88.54794: tcp 1386
16:16:16.127691 IP 10.253.69.88.54794 > 182.92.218.51.80: tcp 0
16:16:16.582370 IP 182.92.218.51.80 > 10.253.69.88.54794: tcp 1386
16:16:16.582495 IP 10.253.69.88.54794 > 182.92.218.51.80: tcp 0
16:16:16.582720 IP 182.92.218.51.80 > 10.253.69.88.54794: tcp 1386
16:16:16.582778 IP 10.253.69.88.54794 > 182.92.218.51.80: tcp 0
16:16:17.030756 IP 182.92.218.51.80 > 10.253.69.88.54794: tcp 1386
16:16:17.030876 IP 10.253.69.88.54794 > 182.92.218.51.80: tcp 0
16:16:17.032596 IP 182.92.218.51.80 > 10.253.69.88.54794: tcp 1386
16:16:17.032663 IP 10.253.69.88.54794 > 182.92.218.51.80: tcp 0
16:16:17.481720 IP 182.92.218.51.80 > 10.253.69.88.54794: tcp 1386
16:16:17.481896 IP 10.253.69.88.54794 > 182.92.218.51.80: tcp 0
16:16:17.540769 IP 10.253.69.88.54797 > 182.92.218.51.80: tcp 1005
16:16:17.895275 IP 182.92.218.51.80 > 10.253.69.88.54797: tcp 0
16:16:17.896627 IP 182.92.218.51.80 > 10.253.69.88.54797: tcp 270
16:16:17.931662 IP 182.92.218.51.80 > 10.253.69.88.54794: tcp 1300
16:16:17.931773 IP 10.253.69.88.54794 > 182.92.218.51.80: tcp 0
16:16:18.090761 IP 10.253.69.88.54797 > 182.92.218.51.80: tcp 0
16:16:19.957897 IP 10.253.69.88.54797 > 182.92.218.51.80: tcp 1023
16:16:20.359980 IP 182.92.218.51.80 > 10.253.69.88.54797: tcp 0
16:16:20.709537 IP 182.92.218.51.80 > 10.253.69.88.54797: tcp 1386
16:16:20.709701 IP 182.92.218.51.80 > 10.253.69.88.54797: tcp 1386
16:16:20.709764 IP 10.253.69.88.54797 > 182.92.218.51.80: tcp 0
16:16:21.066115 IP 182.92.218.51.80 > 10.253.69.88.54797: tcp 1386
16:16:21.066290 IP 182.92.218.51.80 > 10.253.69.88.54797: tcp 1386
16:16:21.066353 IP 10.253.69.88.54797 > 182.92.218.51.80: tcp 0
16:16:21.068927 IP 182.92.218.51.80 > 10.253.69.88.54797: tcp 1386
16:16:21.075921 IP 10.253.69.88.54794 > 182.92.218.51.80: tcp 0
16:16:21.260781 IP 10.253.69.88.54797 > 182.92.218.51.80: tcp 0
16:16:21.421580 IP 182.92.218.51.80 > 10.253.69.88.54797: tcp 474
16:16:21.429822 IP 10.253.69.88.54799 > 182.92.218.51.80: tcp 0
16:16:21.431496 IP 10.253.69.88.54797 > 182.92.218.51.80: tcp 1002
16:16:21.523847 IP 182.92.218.51.80 > 10.253.69.88.54794: tcp 0
16:16:21.785693 IP 182.92.218.51.80 > 10.253.69.88.54797: tcp 269
16:16:21.789146 IP 182.92.218.51.80 > 10.253.69.88.54799: tcp 0
16:16:21.789284 IP 10.253.69.88.54799 > 182.92.218.51.80: tcp 0
16:16:21.789871 IP 10.253.69.88.54797 > 182.92.218.51.80: tcp 1014
16:16:22.144614 IP 182.92.218.51.80 > 10.253.69.88.54797: tcp 269
16:16:22.345806 IP 10.253.69.88.54797 > 182.92.218.51.80: tcp 0
16:16:23.764778 IP 182.92.218.51.80 > 10.253.69.88.54794: tcp 1386
16:16:23.764942 IP 10.253.69.88.54794 > 182.92.218.51.80: tcp 0
16:16:23.826561 IP 10.253.69.88.54797 > 182.92.218.51.80: tcp 1050
16:16:24.228970 IP 182.92.218.51.80 > 10.253.69.88.54797: tcp 0
16:16:24.547150 IP 182.92.218.51.80 > 10.253.69.88.54797: tcp 1386
16:16:24.547317 IP 182.92.218.51.80 > 10.253.69.88.54797: tcp 1386
16:16:24.547387 IP 10.253.69.88.54797 > 182.92.218.51.80: tcp 0
16:16:24.897690 IP 182.92.218.51.80 > 10.253.69.88.54797: tcp 1386
16:16:24.897805 IP 10.253.69.88.54797 > 182.92.218.51.80: tcp 0
16:16:24.897970 IP 182.92.218.51.80 > 10.253.69.88.54797: tcp 1386
16:16:24.898017 IP 10.253.69.88.54797 > 182.92.218.51.80: tcp 0
16:16:25.246229 IP 182.92.218.51.80 > 10.253.69.88.54797: tcp 1386
16:16:25.246385 IP 10.253.69.88.54797 > 182.92.218.51.80: tcp 0
16:16:25.248496 IP 182.92.218.51.80 > 10.253.69.88.54797: tcp 292
16:16:25.277484 IP 182.92.218.51.80 > 10.253.69.88.54799: tcp 0
16:16:25.277566 IP 10.253.69.88.54799 > 182.92.218.51.80: tcp 0
16:16:25.403907 IP 10.253.69.88.54797 > 182.92.218.51.80: tcp 1061
16:16:25.406020 IP 10.253.69.88.54799 > 182.92.218.51.80: tcp 1062
16:16:25.756814 IP 182.92.218.51.80 > 10.253.69.88.54797: tcp 0
16:16:25.850833 IP 182.92.218.51.80 > 10.253.69.88.54797: tcp 791
16:16:25.904266 IP 182.92.218.51.80 > 10.253.69.88.54799: tcp 699
16:16:26.057869 IP 10.253.69.88.54797 > 182.92.218.51.80: tcp 0
16:16:26.100876 IP 10.253.69.88.54799 > 182.92.218.51.80: tcp 0
16:16:29.839676 IP 10.253.69.88.54799 > 182.92.218.51.80: tcp 1030
16:16:30.201036 IP 182.92.218.51.80 > 10.253.69.88.54799: tcp 0
16:16:30.834788 IP 182.92.218.51.80 > 10.253.69.88.54797: tcp 0
16:16:30.834882 IP 10.253.69.88.54797 > 182.92.218.51.80: tcp 0
16:16:31.071605 IP 182.92.218.51.80 > 10.253.69.88.54799: tcp 1386
16:16:31.071789 IP 182.92.218.51.80 > 10.253.69.88.54799: tcp 1386
16:16:31.071851 IP 10.253.69.88.54799 > 182.92.218.51.80: tcp 0
16:16:31.426199 IP 182.92.218.51.80 > 10.253.69.88.54799: tcp 1386
16:16:31.426373 IP 182.92.218.51.80 > 10.253.69.88.54799: tcp 1386
16:16:31.426433 IP 10.253.69.88.54799 > 182.92.218.51.80: tcp 0
16:16:31.429114 IP 182.92.218.51.80 > 10.253.69.88.54799: tcp 1386
16:16:31.621129 IP 10.253.69.88.54799 > 182.92.218.51.80: tcp 0
16:16:31.779009 IP 182.92.218.51.80 > 10.253.69.88.54799: tcp 1386
16:16:31.780335 IP 182.92.218.51.80 > 10.253.69.88.54799: tcp 1386
16:16:31.780414 IP 10.253.69.88.54799 > 182.92.218.51.80: tcp 0
16:16:31.818064 IP 10.253.69.88.54797 > 182.92.218.51.80: tcp 0
16:16:31.819174 IP 10.253.69.88.54823 > 182.92.218.51.80: tcp 0
16:16:31.972946 IP 182.92.218.51.80 > 10.253.69.88.54799: tcp 330
16:16:31.975804 IP 10.253.69.88.54799 > 182.92.218.51.80: tcp 1005
16:16:32.323761 IP 182.92.218.51.80 > 10.253.69.88.54799: tcp 0
16:16:32.389139 IP 10.253.69.88.54797 > 182.92.218.51.80: tcp 0
16:16:33.529135 IP 10.253.69.88.54797 > 182.92.218.51.80: tcp 0
16:16:33.799808 IP 182.92.218.51.80 > 10.253.69.88.54799: tcp 269
16:16:33.885858 IP 182.92.218.51.80 > 10.253.69.88.54797: tcp 0
16:16:34.009178 IP 10.253.69.88.54799 > 182.92.218.51.80: tcp 0
16:16:34.819238 IP 10.253.69.88.54823 > 182.92.218.51.80: tcp 0
16:16:35.178887 IP 182.92.218.51.80 > 10.253.69.88.54823: tcp 0
16:16:35.179098 IP 10.253.69.88.54823 > 182.92.218.51.80: tcp 0
16:16:35.675817 IP 182.92.218.51.80 > 10.253.69.88.54823: tcp 0
16:16:35.675961 IP 10.253.69.88.54823 > 182.92.218.51.80: tcp 0
16:16:36.345043 IP 10.253.69.88.54799 > 182.92.218.51.80: tcp 1057
16:16:36.347080 IP 10.253.69.88.54823 > 182.92.218.51.80: tcp 1058
16:16:36.700135 IP 182.92.218.51.80 > 10.253.69.88.54823: tcp 0
16:16:36.743209 IP 182.92.218.51.80 > 10.253.69.88.54799: tcp 0
16:16:36.836493 IP 182.92.218.51.80 > 10.253.69.88.54823: tcp 699
16:16:37.036270 IP 10.253.69.88.54823 > 182.92.218.51.80: tcp 0
