12:50:06.922347 IP 10.253.88.173.54784 > 208.85.40.50.80: tcp 819
12:50:07.030366 IP 208.85.40.50.80 > 10.253.88.173.54784: tcp 0
12:50:07.541299 IP 208.85.40.50.80 > 10.253.88.173.54784: tcp 1386
12:50:07.541300 IP 208.85.40.50.80 > 10.253.88.173.54784: tcp 74
12:50:07.541516 IP 10.253.88.173.54784 > 208.85.40.50.80: tcp 0
12:50:07.541782 IP 208.85.40.50.80 > 10.253.88.173.54784: tcp 1386
12:50:07.541782 IP 208.85.40.50.80 > 10.253.88.173.54784: tcp 74
12:50:07.541783 IP 208.85.40.50.80 > 10.253.88.173.54784: tcp 1386
12:50:07.541784 IP 208.85.40.50.80 > 10.253.88.173.54784: tcp 74
12:50:07.541785 IP 208.85.40.50.80 > 10.253.88.173.54784: tcp 1386
12:50:07.541785 IP 208.85.40.50.80 > 10.253.88.173.54784: tcp 74
12:50:07.541786 IP 208.85.40.50.80 > 10.253.88.173.54784: tcp 1386
12:50:07.541787 IP 208.85.40.50.80 > 10.253.88.173.54784: tcp 74
12:50:07.541788 IP 208.85.40.50.80 > 10.253.88.173.54784: tcp 1386
12:50:07.541788 IP 208.85.40.50.80 > 10.253.88.173.54784: tcp 74
12:50:07.541789 IP 208.85.40.50.80 > 10.253.88.173.54784: tcp 62
12:50:07.542322 IP 10.253.88.173.54784 > 208.85.40.50.80: tcp 0
12:50:07.545951 IP 208.85.40.50.80 > 10.253.88.173.54784: tcp 1386
12:50:07.545952 IP 208.85.40.50.80 > 10.253.88.173.54784: tcp 74
12:50:07.545952 IP 208.85.40.50.80 > 10.253.88.173.54784: tcp 1386
12:50:07.545953 IP 208.85.40.50.80 > 10.253.88.173.54784: tcp 74
12:50:07.546185 IP 10.253.88.173.54784 > 208.85.40.50.80: tcp 0
12:50:07.547534 IP 208.85.40.50.80 > 10.253.88.173.54784: tcp 1386
12:50:07.547535 IP 208.85.40.50.80 > 10.253.88.173.54784: tcp 74
12:50:07.547536 IP 208.85.40.50.80 > 10.253.88.173.54784: tcp 1386
12:50:07.547536 IP 208.85.40.50.80 > 10.253.88.173.54784: tcp 74
12:50:07.547536 IP 208.85.40.50.80 > 10.253.88.173.54784: tcp 1386
12:50:07.547537 IP 208.85.40.50.80 > 10.253.88.173.54784: tcp 74
12:50:07.547538 IP 208.85.40.50.80 > 10.253.88.173.54784: tcp 1386
12:50:07.547538 IP 208.85.40.50.80 > 10.253.88.173.54784: tcp 74
12:50:07.547539 IP 208.85.40.50.80 > 10.253.88.173.54784: tcp 1386
12:50:07.547539 IP 208.85.40.50.80 > 10.253.88.173.54784: tcp 74
12:50:07.547539 IP 208.85.40.50.80 > 10.253.88.173.54784: tcp 1386
12:50:07.547540 IP 208.85.40.50.80 > 10.253.88.173.54784: tcp 74
12:50:07.547541 IP 208.85.40.50.80 > 10.253.88.173.54784: tcp 1386
12:50:07.547541 IP 208.85.40.50.80 > 10.253.88.173.54784: tcp 74
12:50:07.547544 IP 208.85.40.50.80 > 10.253.88.173.54784: tcp 1386
12:50:07.547545 IP 208.85.40.50.80 > 10.253.88.173.54784: tcp 74
12:50:07.547545 IP 208.85.40.50.80 > 10.253.88.173.54784: tcp 1386
12:50:07.547546 IP 208.85.40.50.80 > 10.253.88.173.54784: tcp 74
12:50:07.547547 IP 208.85.40.50.80 > 10.253.88.173.54784: tcp 1386
12:50:07.547548 IP 208.85.40.50.80 > 10.253.88.173.54784: tcp 74
12:50:07.547548 IP 208.85.40.50.80 > 10.253.88.173.54784: tcp 1386
12:50:07.547549 IP 208.85.40.50.80 > 10.253.88.173.54784: tcp 74
12:50:07.547550 IP 208.85.40.50.80 > 10.253.88.173.54784: tcp 1386
12:50:07.547551 IP 208.85.40.50.80 > 10.253.88.173.54784: tcp 74
12:50:07.547551 IP 208.85.40.50.80 > 10.253.88.173.54784: tcp 1386
12:50:07.547552 IP 208.85.40.50.80 > 10.253.88.173.54784: tcp 74
12:50:07.547553 IP 208.85.40.50.80 > 10.253.88.173.54784: tcp 1386
12:50:07.547554 IP 208.85.40.50.80 > 10.253.88.173.54784: tcp 74
12:50:07.547554 IP 208.85.40.50.80 > 10.253.88.173.54784: tcp 1386
12:50:07.547555 IP 208.85.40.50.80 > 10.253.88.173.54784: tcp 74
12:50:07.547555 IP 208.85.40.50.80 > 10.253.88.173.54784: tcp 1386
12:50:07.547556 IP 208.85.40.50.80 > 10.253.88.173.54784: tcp 74
12:50:07.548908 IP 10.253.88.173.54784 > 208.85.40.50.80: tcp 0
12:50:07.549334 IP 208.85.40.50.80 > 10.253.88.173.54784: tcp 561
12:50:07.549469 IP 10.253.88.173.54784 > 208.85.40.50.80: tcp 0
12:50:07.746491 IP 208.85.40.50.80 > 10.253.88.173.54784: tcp 899
12:50:07.746492 IP 208.85.40.50.80 > 10.253.88.173.54784: tcp 1386
12:50:07.746492 IP 208.85.40.50.80 > 10.253.88.173.54784: tcp 1386
12:50:07.746493 IP 208.85.40.50.80 > 10.253.88.173.54784: tcp 1386
12:50:07.746494 IP 208.85.40.50.80 > 10.253.88.173.54784: tcp 1386
12:50:07.746773 IP 10.253.88.173.54784 > 208.85.40.50.80: tcp 0
12:50:07.747432 IP 208.85.40.50.80 > 10.253.88.173.54784: tcp 296
12:50:07.747433 IP 208.85.40.50.80 > 10.253.88.173.54784: tcp 1386
12:50:07.747434 IP 208.85.40.50.80 > 10.253.88.173.54784: tcp 1386
12:50:07.747435 IP 208.85.40.50.80 > 10.253.88.173.54784: tcp 148
12:50:07.747435 IP 208.85.40.50.80 > 10.253.88.173.54784: tcp 1386
12:50:07.747436 IP 208.85.40.50.80 > 10.253.88.173.54784: tcp 1386
12:50:07.747436 IP 208.85.40.50.80 > 10.253.88.173.54784: tcp 1386
12:50:07.747437 IP 208.85.40.50.80 > 10.253.88.173.54784: tcp 1386
12:50:07.747437 IP 208.85.40.50.80 > 10.253.88.173.54784: tcp 1386
12:50:07.747438 IP 208.85.40.50.80 > 10.253.88.173.54784: tcp 1386
12:50:07.747438 IP 208.85.40.50.80 > 10.253.88.173.54784: tcp 1386
12:50:07.747439 IP 208.85.40.50.80 > 10.253.88.173.54784: tcp 1386
12:50:07.747439 IP 208.85.40.50.80 > 10.253.88.173.54784: tcp 1386
12:50:07.747441 IP 208.85.40.50.80 > 10.253.88.173.54784: tcp 1187
12:50:07.747912 IP 10.253.88.173.54784 > 208.85.40.50.80: tcp 0
12:50:08.653565 IP 10.253.88.173.54784 > 208.85.40.50.80: tcp 931
12:50:08.655682 IP 10.253.88.173.54785 > 208.85.40.50.80: tcp 853
12:50:08.657993 IP 10.253.88.173.54783 > 208.85.40.50.80: tcp 943
12:50:08.661899 IP 10.253.88.173.54788 > 208.85.40.50.80: tcp 944
12:50:08.663333 IP 10.253.88.173.55046 > 208.85.40.50.80: tcp 947
12:50:08.665593 IP 10.253.88.173.54787 > 208.85.40.50.80: tcp 912
12:50:08.760536 IP 208.85.40.50.80 > 10.253.88.173.54788: tcp 0
12:50:08.760537 IP 208.85.40.50.80 > 10.253.88.173.54784: tcp 0
12:50:08.760538 IP 208.85.40.50.80 > 10.253.88.173.54783: tcp 0
12:50:08.760538 IP 208.85.40.50.80 > 10.253.88.173.54785: tcp 0
12:50:08.760539 IP 208.85.40.50.80 > 10.253.88.173.54787: tcp 0
12:50:08.760539 IP 208.85.40.50.80 > 10.253.88.173.55046: tcp 0
12:50:08.760540 IP 208.85.40.50.80 > 10.253.88.173.54788: tcp 1038
12:50:08.763594 IP 208.85.40.50.80 > 10.253.88.173.54783: tcp 1386
12:50:08.763596 IP 208.85.40.50.80 > 10.253.88.173.54783: tcp 74
12:50:08.763596 IP 208.85.40.50.80 > 10.253.88.173.54783: tcp 1386
12:50:08.763596 IP 208.85.40.50.80 > 10.253.88.173.54783: tcp 74
12:50:08.763597 IP 208.85.40.50.80 > 10.253.88.173.54783: tcp 269
12:50:08.763597 IP 208.85.40.50.80 > 10.253.88.173.55046: tcp 1386
12:50:08.763598 IP 208.85.40.50.80 > 10.253.88.173.55046: tcp 62
12:50:08.763598 IP 208.85.40.50.80 > 10.253.88.173.55046: tcp 1386
12:50:08.763599 IP 208.85.40.50.80 > 10.253.88.173.55046: tcp 62
12:50:08.763599 IP 208.85.40.50.80 > 10.253.88.173.55046: tcp 294
12:50:08.763936 IP 10.253.88.173.54783 > 208.85.40.50.80: tcp 0
12:50:08.764027 IP 10.253.88.173.55046 > 208.85.40.50.80: tcp 0
12:50:08.764507 IP 208.85.40.50.80 > 10.253.88.173.54785: tcp 1386
12:50:08.764507 IP 208.85.40.50.80 > 10.253.88.173.54785: tcp 62
12:50:08.764613 IP 10.253.88.173.54785 > 208.85.40.50.80: tcp 0
12:50:08.765064 IP 208.85.40.50.80 > 10.253.88.173.54785: tcp 1386
12:50:08.765065 IP 208.85.40.50.80 > 10.253.88.173.54785: tcp 62
12:50:08.765065 IP 208.85.40.50.80 > 10.253.88.173.54785: tcp 1386
12:50:08.765187 IP 10.253.88.173.54785 > 208.85.40.50.80: tcp 0
12:50:08.765487 IP 208.85.40.50.80 > 10.253.88.173.54785: tcp 62
12:50:08.765488 IP 208.85.40.50.80 > 10.253.88.173.54785: tcp 1386
12:50:08.765488 IP 208.85.40.50.80 > 10.253.88.173.54785: tcp 62
12:50:08.765604 IP 10.253.88.173.54785 > 208.85.40.50.80: tcp 0
12:50:08.766041 IP 208.85.40.50.80 > 10.253.88.173.54785: tcp 1386
12:50:08.766493 IP 208.85.40.50.80 > 10.253.88.173.54785: tcp 62
12:50:08.766493 IP 208.85.40.50.80 > 10.253.88.173.54785: tcp 298
12:50:08.766577 IP 10.253.88.173.54785 > 208.85.40.50.80: tcp 0
12:50:08.771250 IP 10.253.88.173.54788 > 208.85.40.50.80: tcp 918
12:50:08.776068 IP 208.85.40.50.80 > 10.253.88.173.54787: tcp 1386
12:50:08.776070 IP 208.85.40.50.80 > 10.253.88.173.54787: tcp 62
12:50:08.776070 IP 208.85.40.50.80 > 10.253.88.173.54787: tcp 1386
12:50:08.776071 IP 208.85.40.50.80 > 10.253.88.173.54787: tcp 62
12:50:08.776072 IP 208.85.40.50.80 > 10.253.88.173.54787: tcp 1386
12:50:08.776072 IP 208.85.40.50.80 > 10.253.88.173.54787: tcp 62
12:50:08.776072 IP 208.85.40.50.80 > 10.253.88.173.54787: tcp 1386
12:50:08.776073 IP 208.85.40.50.80 > 10.253.88.173.54787: tcp 62
12:50:08.776073 IP 208.85.40.50.80 > 10.253.88.173.54787: tcp 1386
12:50:08.776074 IP 208.85.40.50.80 > 10.253.88.173.54787: tcp 62
12:50:08.776075 IP 208.85.40.50.80 > 10.253.88.173.54787: tcp 1386
12:50:08.776075 IP 208.85.40.50.80 > 10.253.88.173.54787: tcp 62
12:50:08.776406 IP 10.253.88.173.54787 > 208.85.40.50.80: tcp 0
12:50:08.777003 IP 208.85.40.50.80 > 10.253.88.173.54787: tcp 1386
12:50:08.777003 IP 208.85.40.50.80 > 10.253.88.173.54787: tcp 62
12:50:08.777093 IP 10.253.88.173.54787 > 208.85.40.50.80: tcp 0
12:50:08.777599 IP 208.85.40.50.80 > 10.253.88.173.54787: tcp 1386
12:50:08.777600 IP 208.85.40.50.80 > 10.253.88.173.54787: tcp 62
12:50:08.777600 IP 208.85.40.50.80 > 10.253.88.173.54787: tcp 1386
12:50:08.777600 IP 208.85.40.50.80 > 10.253.88.173.54787: tcp 62
12:50:08.777601 IP 208.85.40.50.80 > 10.253.88.173.54787: tcp 1386
12:50:08.777602 IP 208.85.40.50.80 > 10.253.88.173.54787: tcp 62
12:50:08.777602 IP 208.85.40.50.80 > 10.253.88.173.54787: tcp 1386
12:50:08.777603 IP 208.85.40.50.80 > 10.253.88.173.54787: tcp 62
12:50:08.777603 IP 208.85.40.50.80 > 10.253.88.173.54787: tcp 1386
12:50:08.777604 IP 208.85.40.50.80 > 10.253.88.173.54787: tcp 62
12:50:08.777604 IP 208.85.40.50.80 > 10.253.88.173.54787: tcp 1386
12:50:08.777605 IP 208.85.40.50.80 > 10.253.88.173.54787: tcp 62
12:50:08.777605 IP 208.85.40.50.80 > 10.253.88.173.54787: tcp 1386
12:50:08.777606 IP 208.85.40.50.80 > 10.253.88.173.54787: tcp 62
12:50:08.778009 IP 10.253.88.173.54787 > 208.85.40.50.80: tcp 0
12:50:08.778559 IP 208.85.40.50.80 > 10.253.88.173.54787: tcp 1386
12:50:08.778560 IP 208.85.40.50.80 > 10.253.88.173.54787: tcp 62
12:50:08.778560 IP 208.85.40.50.80 > 10.253.88.173.54787: tcp 1386
12:50:08.778560 IP 208.85.40.50.80 > 10.253.88.173.54787: tcp 62
12:50:08.778706 IP 10.253.88.173.54787 > 208.85.40.50.80: tcp 0
12:50:08.780041 IP 208.85.40.50.80 > 10.253.88.173.54787: tcp 1386
12:50:08.780043 IP 208.85.40.50.80 > 10.253.88.173.54787: tcp 62
12:50:08.780043 IP 208.85.40.50.80 > 10.253.88.173.54787: tcp 1386
12:50:08.780044 IP 208.85.40.50.80 > 10.253.88.173.54787: tcp 62
12:50:08.780044 IP 208.85.40.50.80 > 10.253.88.173.54787: tcp 1386
12:50:08.780044 IP 208.85.40.50.80 > 10.253.88.173.54787: tcp 62
12:50:08.780044 IP 208.85.40.50.80 > 10.253.88.173.54787: tcp 1386
12:50:08.780045 IP 208.85.40.50.80 > 10.253.88.173.54787: tcp 62
12:50:08.780045 IP 208.85.40.50.80 > 10.253.88.173.54787: tcp 1386
12:50:08.780045 IP 208.85.40.50.80 > 10.253.88.173.54787: tcp 62
12:50:08.780046 IP 208.85.40.50.80 > 10.253.88.173.54787: tcp 1386
12:50:08.780046 IP 208.85.40.50.80 > 10.253.88.173.54787: tcp 62
12:50:08.780385 IP 10.253.88.173.54787 > 208.85.40.50.80: tcp 0
12:50:08.781100 IP 208.85.40.50.80 > 10.253.88.173.54787: tcp 1386
12:50:08.781101 IP 208.85.40.50.80 > 10.253.88.173.54787: tcp 62
12:50:08.781101 IP 208.85.40.50.80 > 10.253.88.173.54787: tcp 1386
12:50:08.781102 IP 208.85.40.50.80 > 10.253.88.173.54787: tcp 62
12:50:08.781102 IP 208.85.40.50.80 > 10.253.88.173.54787: tcp 1386
12:50:08.781102 IP 208.85.40.50.80 > 10.253.88.173.54787: tcp 62
12:50:08.781103 IP 208.85.40.50.80 > 10.253.88.173.54787: tcp 604
12:50:08.781251 IP 10.253.88.173.54787 > 208.85.40.50.80: tcp 0
12:50:08.781508 IP 208.85.40.50.80 > 10.253.88.173.54784: tcp 1386
12:50:08.781509 IP 208.85.40.50.80 > 10.253.88.173.54784: tcp 62
12:50:08.781510 IP 208.85.40.50.80 > 10.253.88.173.54784: tcp 1386
12:50:08.781640 IP 10.253.88.173.54784 > 208.85.40.50.80: tcp 0
12:50:08.782087 IP 208.85.40.50.80 > 10.253.88.173.54784: tcp 62
12:50:08.782088 IP 208.85.40.50.80 > 10.253.88.173.54784: tcp 1386
12:50:08.782088 IP 208.85.40.50.80 > 10.253.88.173.54784: tcp 62
12:50:08.782089 IP 208.85.40.50.80 > 10.253.88.173.54784: tcp 1386
12:50:08.782090 IP 208.85.40.50.80 > 10.253.88.173.54784: tcp 62
12:50:08.782090 IP 208.85.40.50.80 > 10.253.88.173.54784: tcp 1386
12:50:08.782090 IP 208.85.40.50.80 > 10.253.88.173.54784: tcp 62
12:50:08.782313 IP 10.253.88.173.54784 > 208.85.40.50.80: tcp 0
12:50:08.782497 IP 208.85.40.50.80 > 10.253.88.173.54784: tcp 1386
12:50:08.782498 IP 208.85.40.50.80 > 10.253.88.173.54784: tcp 62
12:50:08.782588 IP 10.253.88.173.54784 > 208.85.40.50.80: tcp 0
12:50:08.783078 IP 208.85.40.50.80 > 10.253.88.173.54784: tcp 1386
12:50:08.783079 IP 208.85.40.50.80 > 10.253.88.173.54784: tcp 62
12:50:08.783079 IP 208.85.40.50.80 > 10.253.88.173.54784: tcp 1386
12:50:08.783080 IP 208.85.40.50.80 > 10.253.88.173.54784: tcp 62
12:50:08.783080 IP 208.85.40.50.80 > 10.253.88.173.54784: tcp 1386
12:50:08.783080 IP 208.85.40.50.80 > 10.253.88.173.54784: tcp 62
12:50:08.783080 IP 208.85.40.50.80 > 10.253.88.173.54784: tcp 1386
12:50:08.783081 IP 208.85.40.50.80 > 10.253.88.173.54784: tcp 62
12:50:08.783081 IP 208.85.40.50.80 > 10.253.88.173.54784: tcp 1386
12:50:08.783082 IP 208.85.40.50.80 > 10.253.88.173.54784: tcp 62
12:50:08.783387 IP 10.253.88.173.54784 > 208.85.40.50.80: tcp 0
12:50:08.783515 IP 208.85.40.50.80 > 10.253.88.173.54784: tcp 1386
12:50:08.783516 IP 208.85.40.50.80 > 10.253.88.173.54784: tcp 62
12:50:08.783516 IP 208.85.40.50.80 > 10.253.88.173.54784: tcp 1386
12:50:08.783517 IP 208.85.40.50.80 > 10.253.88.173.54784: tcp 62
12:50:08.783517 IP 208.85.40.50.80 > 10.253.88.173.54784: tcp 1386
12:50:08.783517 IP 208.85.40.50.80 > 10.253.88.173.54784: tcp 62
12:50:08.783713 IP 10.253.88.173.54784 > 208.85.40.50.80: tcp 0
12:50:08.785551 IP 208.85.40.50.80 > 10.253.88.173.54784: tcp 1386
12:50:08.785551 IP 208.85.40.50.80 > 10.253.88.173.54784: tcp 62
12:50:08.785551 IP 208.85.40.50.80 > 10.253.88.173.54784: tcp 1386
12:50:08.785552 IP 208.85.40.50.80 > 10.253.88.173.54784: tcp 62
12:50:08.785552 IP 208.85.40.50.80 > 10.253.88.173.54784: tcp 1386
12:50:08.785553 IP 208.85.40.50.80 > 10.253.88.173.54784: tcp 62
12:50:08.785553 IP 208.85.40.50.80 > 10.253.88.173.54784: tcp 1386
12:50:08.785554 IP 208.85.40.50.80 > 10.253.88.173.54784: tcp 62
12:50:08.785554 IP 208.85.40.50.80 > 10.253.88.173.54784: tcp 1386
12:50:08.785554 IP 208.85.40.50.80 > 10.253.88.173.54784: tcp 62
12:50:08.785555 IP 208.85.40.50.80 > 10.253.88.173.54784: tcp 1386
12:50:08.785555 IP 208.85.40.50.80 > 10.253.88.173.54784: tcp 62
12:50:08.785845 IP 10.253.88.173.54784 > 208.85.40.50.80: tcp 0
12:50:08.786055 IP 208.85.40.50.80 > 10.253.88.173.54784: tcp 1386
12:50:08.786056 IP 208.85.40.50.80 > 10.253.88.173.54784: tcp 62
12:50:08.786056 IP 208.85.40.50.80 > 10.253.88.173.54784: tcp 1386
12:50:08.786056 IP 208.85.40.50.80 > 10.253.88.173.54784: tcp 62
12:50:08.786183 IP 10.253.88.173.54784 > 208.85.40.50.80: tcp 0
12:50:08.786511 IP 208.85.40.50.80 > 10.253.88.173.54784: tcp 1386
12:50:08.786512 IP 208.85.40.50.80 > 10.253.88.173.54784: tcp 62
12:50:08.786512 IP 208.85.40.50.80 > 10.253.88.173.54784: tcp 1386
12:50:08.786513 IP 208.85.40.50.80 > 10.253.88.173.54784: tcp 62
12:50:08.786513 IP 208.85.40.50.80 > 10.253.88.173.54784: tcp 1386
12:50:08.786694 IP 10.253.88.173.54784 > 208.85.40.50.80: tcp 0
12:50:08.787065 IP 208.85.40.50.80 > 10.253.88.173.54784: tcp 62
12:50:08.787066 IP 208.85.40.50.80 > 10.253.88.173.54784: tcp 1386
12:50:08.787067 IP 208.85.40.50.80 > 10.253.88.173.54784: tcp 62
12:50:08.787067 IP 208.85.40.50.80 > 10.253.88.173.54784: tcp 787
12:50:08.787200 IP 10.253.88.173.54784 > 208.85.40.50.80: tcp 0
12:50:08.818780 IP 10.253.88.173.54783 > 208.85.40.50.80: tcp 933
12:50:08.822687 IP 10.253.88.173.55046 > 208.85.40.50.80: tcp 921
12:50:08.858058 IP 208.85.40.50.80 > 10.253.88.173.54788: tcp 0
12:50:08.862085 IP 208.85.40.50.80 > 10.253.88.173.54788: tcp 1386
12:50:08.862086 IP 208.85.40.50.80 > 10.253.88.173.54788: tcp 62
12:50:08.862086 IP 208.85.40.50.80 > 10.253.88.173.54788: tcp 1180
12:50:08.862232 IP 10.253.88.173.54788 > 208.85.40.50.80: tcp 0
12:50:08.866174 IP 208.85.40.50.80 > 10.253.88.173.54787: tcp 1386
12:50:08.866175 IP 208.85.40.50.80 > 10.253.88.173.54787: tcp 1386
12:50:08.866176 IP 208.85.40.50.80 > 10.253.88.173.54787: tcp 1386
12:50:08.866176 IP 208.85.40.50.80 > 10.253.88.173.54787: tcp 759
12:50:08.866343 IP 10.253.88.173.54787 > 208.85.40.50.80: tcp 0
12:50:08.870175 IP 208.85.40.50.80 > 10.253.88.173.54784: tcp 1386
12:50:08.870177 IP 208.85.40.50.80 > 10.253.88.173.54784: tcp 723
12:50:08.870290 IP 10.253.88.173.54784 > 208.85.40.50.80: tcp 0
12:50:08.874148 IP 208.85.40.50.80 > 10.253.88.173.54784: tcp 1386
12:50:08.874149 IP 208.85.40.50.80 > 10.253.88.173.54784: tcp 1386
12:50:08.874150 IP 208.85.40.50.80 > 10.253.88.173.54784: tcp 124
12:50:08.874150 IP 208.85.40.50.80 > 10.253.88.173.54784: tcp 1288
12:50:08.874309 IP 10.253.88.173.54784 > 208.85.40.50.80: tcp 0
12:50:08.881865 IP 10.253.88.173.54788 > 208.85.40.50.80: tcp 949
12:50:08.902073 IP 208.85.40.50.80 > 10.253.88.173.54783: tcp 0
12:50:08.907579 IP 208.85.40.50.80 > 10.253.88.173.54783: tcp 1386
12:50:08.907580 IP 208.85.40.50.80 > 10.253.88.173.54783: tcp 6
12:50:08.907581 IP 208.85.40.50.80 > 10.253.88.173.55046: tcp 0
12:50:08.907731 IP 10.253.88.173.54783 > 208.85.40.50.80: tcp 0
12:50:08.912470 IP 10.253.88.173.54785 > 208.85.40.50.80: tcp 916
12:50:08.922590 IP 208.85.40.50.80 > 10.253.88.173.55046: tcp 1386
12:50:08.922591 IP 208.85.40.50.80 > 10.253.88.173.55046: tcp 62
12:50:08.922708 IP 10.253.88.173.55046 > 208.85.40.50.80: tcp 0
12:50:08.924622 IP 208.85.40.50.80 > 10.253.88.173.55046: tcp 1253
12:50:08.930119 IP 10.253.88.173.54783 > 208.85.40.50.80: tcp 910
12:50:08.949136 IP 10.253.88.173.55046 > 208.85.40.50.80: tcp 943
12:50:08.966710 IP 208.85.40.50.80 > 10.253.88.173.54788: tcp 0
12:50:08.974149 IP 208.85.40.50.80 > 10.253.88.173.54788: tcp 1386
12:50:08.974150 IP 208.85.40.50.80 > 10.253.88.173.54788: tcp 62
12:50:08.974290 IP 10.253.88.173.54788 > 208.85.40.50.80: tcp 0
12:50:08.974619 IP 208.85.40.50.80 > 10.253.88.173.54788: tcp 1386
12:50:08.974620 IP 208.85.40.50.80 > 10.253.88.173.54788: tcp 62
12:50:08.974621 IP 208.85.40.50.80 > 10.253.88.173.54788: tcp 1386
12:50:08.974621 IP 208.85.40.50.80 > 10.253.88.173.54788: tcp 62
12:50:08.974622 IP 208.85.40.50.80 > 10.253.88.173.54788: tcp 1386
12:50:08.974623 IP 208.85.40.50.80 > 10.253.88.173.54788: tcp 62
12:50:08.974804 IP 10.253.88.173.54788 > 208.85.40.50.80: tcp 0
12:50:08.976125 IP 208.85.40.50.80 > 10.253.88.173.54788: tcp 1386
12:50:08.976125 IP 208.85.40.50.80 > 10.253.88.173.54788: tcp 62
12:50:08.976126 IP 208.85.40.50.80 > 10.253.88.173.54788: tcp 1386
12:50:08.976126 IP 208.85.40.50.80 > 10.253.88.173.54788: tcp 62
12:50:08.976127 IP 208.85.40.50.80 > 10.253.88.173.54788: tcp 1386
12:50:08.976127 IP 208.85.40.50.80 > 10.253.88.173.54788: tcp 62
12:50:08.976127 IP 208.85.40.50.80 > 10.253.88.173.54788: tcp 1386
12:50:08.976128 IP 208.85.40.50.80 > 10.253.88.173.54788: tcp 62
12:50:08.976128 IP 208.85.40.50.80 > 10.253.88.173.54788: tcp 868
12:50:08.976324 IP 10.253.88.173.54788 > 208.85.40.50.80: tcp 0
12:50:09.019152 IP 208.85.40.50.80 > 10.253.88.173.54783: tcp 0
12:50:09.019623 IP 208.85.40.50.80 > 10.253.88.173.54785: tcp 0
12:50:09.036664 IP 208.85.40.50.80 > 10.253.88.173.55046: tcp 0
12:50:09.038194 IP 208.85.40.50.80 > 10.253.88.173.54783: tcp 1386
12:50:09.038195 IP 208.85.40.50.80 > 10.253.88.173.54783: tcp 62
12:50:09.038195 IP 208.85.40.50.80 > 10.253.88.173.54783: tcp 1386
12:50:09.038196 IP 208.85.40.50.80 > 10.253.88.173.54783: tcp 62
12:50:09.038362 IP 10.253.88.173.54783 > 208.85.40.50.80: tcp 0
12:50:09.039179 IP 208.85.40.50.80 > 10.253.88.173.54783: tcp 1386
12:50:09.039180 IP 208.85.40.50.80 > 10.253.88.173.54783: tcp 62
12:50:09.039181 IP 208.85.40.50.80 > 10.253.88.173.54783: tcp 1386
12:50:09.039181 IP 208.85.40.50.80 > 10.253.88.173.54783: tcp 62
12:50:09.039181 IP 208.85.40.50.80 > 10.253.88.173.54783: tcp 1386
12:50:09.039339 IP 10.253.88.173.54783 > 208.85.40.50.80: tcp 0
12:50:09.041283 IP 208.85.40.50.80 > 10.253.88.173.54783: tcp 62
12:50:09.041284 IP 208.85.40.50.80 > 10.253.88.173.54783: tcp 1288
12:50:09.041284 IP 208.85.40.50.80 > 10.253.88.173.54783: tcp 1386
12:50:09.041285 IP 208.85.40.50.80 > 10.253.88.173.54783: tcp 62
12:50:09.041286 IP 208.85.40.50.80 > 10.253.88.173.54783: tcp 1386
12:50:09.041286 IP 208.85.40.50.80 > 10.253.88.173.54783: tcp 62
12:50:09.041286 IP 208.85.40.50.80 > 10.253.88.173.54783: tcp 1386
12:50:09.041287 IP 208.85.40.50.80 > 10.253.88.173.54783: tcp 62
12:50:09.041287 IP 208.85.40.50.80 > 10.253.88.173.54783: tcp 1386
12:50:09.041288 IP 208.85.40.50.80 > 10.253.88.173.54783: tcp 62
12:50:09.041288 IP 208.85.40.50.80 > 10.253.88.173.54783: tcp 1386
12:50:09.041289 IP 208.85.40.50.80 > 10.253.88.173.54783: tcp 62
12:50:09.041289 IP 208.85.40.50.80 > 10.253.88.173.54783: tcp 1386
12:50:09.041290 IP 208.85.40.50.80 > 10.253.88.173.54783: tcp 62
12:50:09.041290 IP 208.85.40.50.80 > 10.253.88.173.54783: tcp 1386
12:50:09.041290 IP 208.85.40.50.80 > 10.253.88.173.54783: tcp 62
12:50:09.041291 IP 208.85.40.50.80 > 10.253.88.173.54783: tcp 1386
12:50:09.041291 IP 208.85.40.50.80 > 10.253.88.173.54783: tcp 62
12:50:09.041292 IP 208.85.40.50.80 > 10.253.88.173.54783: tcp 1386
12:50:09.041292 IP 208.85.40.50.80 > 10.253.88.173.54783: tcp 62
12:50:09.041292 IP 208.85.40.50.80 > 10.253.88.173.54783: tcp 1386
12:50:09.041294 IP 208.85.40.50.80 > 10.253.88.173.54783: tcp 62
12:50:09.041294 IP 208.85.40.50.80 > 10.253.88.173.54783: tcp 1386
12:50:09.041295 IP 208.85.40.50.80 > 10.253.88.173.54783: tcp 62
12:50:09.041295 IP 208.85.40.50.80 > 10.253.88.173.54783: tcp 1386
12:50:09.041296 IP 208.85.40.50.80 > 10.253.88.173.54783: tcp 62
12:50:09.041296 IP 208.85.40.50.80 > 10.253.88.173.54783: tcp 1386
12:50:09.041296 IP 208.85.40.50.80 > 10.253.88.173.54783: tcp 62
12:50:09.041297 IP 208.85.40.50.80 > 10.253.88.173.54783: tcp 1386
12:50:09.041297 IP 208.85.40.50.80 > 10.253.88.173.54783: tcp 62
12:50:09.041298 IP 208.85.40.50.80 > 10.253.88.173.54783: tcp 1386
12:50:09.041298 IP 208.85.40.50.80 > 10.253.88.173.54783: tcp 62
12:50:09.041910 IP 10.253.88.173.54783 > 208.85.40.50.80: tcp 0
12:50:09.042125 IP 208.85.40.50.80 > 10.253.88.173.54783: tcp 1386
12:50:09.042126 IP 208.85.40.50.80 > 10.253.88.173.54783: tcp 62
12:50:09.042126 IP 208.85.40.50.80 > 10.253.88.173.54783: tcp 1386
12:50:09.042126 IP 208.85.40.50.80 > 10.253.88.173.54783: tcp 62
12:50:09.042127 IP 208.85.40.50.80 > 10.253.88.173.54783: tcp 1386
12:50:09.042127 IP 208.85.40.50.80 > 10.253.88.173.54783: tcp 62
12:50:09.042127 IP 208.85.40.50.80 > 10.253.88.173.54783: tcp 1386
12:50:09.042128 IP 208.85.40.50.80 > 10.253.88.173.54783: tcp 62
12:50:09.042129 IP 208.85.40.50.80 > 10.253.88.173.54783: tcp 1386
12:50:09.042130 IP 208.85.40.50.80 > 10.253.88.173.54783: tcp 62
12:50:09.042130 IP 208.85.40.50.80 > 10.253.88.173.54783: tcp 1386
12:50:09.042130 IP 208.85.40.50.80 > 10.253.88.173.54783: tcp 62
12:50:09.042131 IP 208.85.40.50.80 > 10.253.88.173.54783: tcp 1386
12:50:09.042131 IP 208.85.40.50.80 > 10.253.88.173.54783: tcp 62
12:50:09.042450 IP 10.253.88.173.54783 > 208.85.40.50.80: tcp 0
12:50:09.042595 IP 208.85.40.50.80 > 10.253.88.173.54783: tcp 1386
12:50:09.042596 IP 208.85.40.50.80 > 10.253.88.173.54783: tcp 62
12:50:09.042596 IP 208.85.40.50.80 > 10.253.88.173.54783: tcp 1386
12:50:09.042691 IP 10.253.88.173.54783 > 208.85.40.50.80: tcp 0
12:50:09.044582 IP 208.85.40.50.80 > 10.253.88.173.54783: tcp 62
12:50:09.044583 IP 208.85.40.50.80 > 10.253.88.173.54783: tcp 1386
12:50:09.044584 IP 208.85.40.50.80 > 10.253.88.173.54783: tcp 62
12:50:09.044584 IP 208.85.40.50.80 > 10.253.88.173.54783: tcp 1386
12:50:09.044585 IP 208.85.40.50.80 > 10.253.88.173.55046: tcp 237
12:50:09.044585 IP 208.85.40.50.80 > 10.253.88.173.54783: tcp 62
12:50:09.044585 IP 208.85.40.50.80 > 10.253.88.173.54783: tcp 760
12:50:09.044818 IP 10.253.88.173.54783 > 208.85.40.50.80: tcp 0
12:50:09.045655 IP 208.85.40.50.80 > 10.253.88.173.54785: tcp 1386
12:50:09.045656 IP 208.85.40.50.80 > 10.253.88.173.54785: tcp 62
12:50:09.045656 IP 208.85.40.50.80 > 10.253.88.173.54785: tcp 1386
12:50:09.045657 IP 208.85.40.50.80 > 10.253.88.173.54785: tcp 62
12:50:09.045657 IP 208.85.40.50.80 > 10.253.88.173.54785: tcp 1386
12:50:09.045658 IP 208.85.40.50.80 > 10.253.88.173.54785: tcp 62
12:50:09.045658 IP 208.85.40.50.80 > 10.253.88.173.54785: tcp 1386
12:50:09.045658 IP 208.85.40.50.80 > 10.253.88.173.54785: tcp 62
12:50:09.045659 IP 208.85.40.50.80 > 10.253.88.173.54785: tcp 1386
12:50:09.045659 IP 208.85.40.50.80 > 10.253.88.173.54785: tcp 62
12:50:09.045660 IP 208.85.40.50.80 > 10.253.88.173.54785: tcp 1286
12:50:09.045660 IP 208.85.40.50.80 > 10.253.88.173.54785: tcp 1386
12:50:09.045661 IP 208.85.40.50.80 > 10.253.88.173.54785: tcp 62
12:50:09.045661 IP 208.85.40.50.80 > 10.253.88.173.54785: tcp 1386
12:50:09.045661 IP 208.85.40.50.80 > 10.253.88.173.54785: tcp 62
12:50:09.045661 IP 208.85.40.50.80 > 10.253.88.173.54785: tcp 1386
12:50:09.045662 IP 208.85.40.50.80 > 10.253.88.173.54785: tcp 62
12:50:09.045662 IP 208.85.40.50.80 > 10.253.88.173.54785: tcp 1386
12:50:09.046069 IP 10.253.88.173.54785 > 208.85.40.50.80: tcp 0
12:50:09.046635 IP 208.85.40.50.80 > 10.253.88.173.54785: tcp 62
12:50:09.046636 IP 208.85.40.50.80 > 10.253.88.173.54785: tcp 1386
12:50:09.046636 IP 208.85.40.50.80 > 10.253.88.173.54785: tcp 62
12:50:09.046636 IP 208.85.40.50.80 > 10.253.88.173.54785: tcp 1386
12:50:09.046637 IP 208.85.40.50.80 > 10.253.88.173.54785: tcp 62
12:50:09.046637 IP 208.85.40.50.80 > 10.253.88.173.54785: tcp 1386
12:50:09.046638 IP 208.85.40.50.80 > 10.253.88.173.54785: tcp 62
12:50:09.046825 IP 10.253.88.173.54785 > 208.85.40.50.80: tcp 0
12:50:09.047066 IP 208.85.40.50.80 > 10.253.88.173.54785: tcp 1386
12:50:09.047067 IP 208.85.40.50.80 > 10.253.88.173.54785: tcp 62
12:50:09.047067 IP 208.85.40.50.80 > 10.253.88.173.54785: tcp 1386
12:50:09.047068 IP 208.85.40.50.80 > 10.253.88.173.54785: tcp 62
12:50:09.047068 IP 208.85.40.50.80 > 10.253.88.173.54785: tcp 1386
12:50:09.047068 IP 208.85.40.50.80 > 10.253.88.173.54785: tcp 62
12:50:09.047069 IP 208.85.40.50.80 > 10.253.88.173.54785: tcp 1386
12:50:09.047069 IP 208.85.40.50.80 > 10.253.88.173.54785: tcp 62
12:50:09.047272 IP 10.253.88.173.54785 > 208.85.40.50.80: tcp 0
12:50:09.048669 IP 208.85.40.50.80 > 10.253.88.173.54785: tcp 1386
12:50:09.048670 IP 208.85.40.50.80 > 10.253.88.173.54785: tcp 62
12:50:09.048671 IP 208.85.40.50.80 > 10.253.88.173.54785: tcp 1386
12:50:09.048671 IP 208.85.40.50.80 > 10.253.88.173.54785: tcp 62
12:50:09.048672 IP 208.85.40.50.80 > 10.253.88.173.54785: tcp 1386
12:50:09.048672 IP 208.85.40.50.80 > 10.253.88.173.54785: tcp 62
12:50:09.048673 IP 208.85.40.50.80 > 10.253.88.173.54785: tcp 344
12:50:09.048883 IP 10.253.88.173.54785 > 208.85.40.50.80: tcp 0
12:50:09.091194 IP 10.253.88.173.55046 > 208.85.40.50.80: tcp 0
12:50:09.125646 IP 208.85.40.50.80 > 10.253.88.173.54783: tcp 1386
12:50:09.126115 IP 208.85.40.50.80 > 10.253.88.173.54783: tcp 726
12:50:09.126195 IP 10.253.88.173.54783 > 208.85.40.50.80: tcp 0
12:50:09.127176 IP 208.85.40.50.80 > 10.253.88.173.54783: tcp 1386
12:50:09.127176 IP 208.85.40.50.80 > 10.253.88.173.54783: tcp 1386
12:50:09.127263 IP 10.253.88.173.54783 > 208.85.40.50.80: tcp 0
12:50:09.127606 IP 208.85.40.50.80 > 10.253.88.173.54783: tcp 124
12:50:09.128633 IP 208.85.40.50.80 > 10.253.88.173.54783: tcp 1386
12:50:09.128634 IP 208.85.40.50.80 > 10.253.88.173.54783: tcp 1386
12:50:09.128634 IP 208.85.40.50.80 > 10.253.88.173.54783: tcp 1386
12:50:09.128635 IP 208.85.40.50.80 > 10.253.88.173.54783: tcp 1386
12:50:09.128740 IP 10.253.88.173.54783 > 208.85.40.50.80: tcp 0
12:50:09.130717 IP 208.85.40.50.80 > 10.253.88.173.54783: tcp 1386
12:50:09.130718 IP 208.85.40.50.80 > 10.253.88.173.54783: tcp 1386
12:50:09.130718 IP 208.85.40.50.80 > 10.253.88.173.54783: tcp 1386
12:50:09.130719 IP 208.85.40.50.80 > 10.253.88.173.54783: tcp 1386
12:50:09.130719 IP 208.85.40.50.80 > 10.253.88.173.54783: tcp 1386
12:50:09.130719 IP 208.85.40.50.80 > 10.253.88.173.54783: tcp 1386
12:50:09.130720 IP 208.85.40.50.80 > 10.253.88.173.54783: tcp 1386
12:50:09.130720 IP 208.85.40.50.80 > 10.253.88.173.54783: tcp 1386
12:50:09.130720 IP 208.85.40.50.80 > 10.253.88.173.54783: tcp 1386
12:50:09.130721 IP 208.85.40.50.80 > 10.253.88.173.54783: tcp 1386
12:50:09.130722 IP 208.85.40.50.80 > 10.253.88.173.54783: tcp 1386
12:50:09.130722 IP 208.85.40.50.80 > 10.253.88.173.54783: tcp 1386
12:50:09.130723 IP 208.85.40.50.80 > 10.253.88.173.54783: tcp 1386
12:50:09.131024 IP 10.253.88.173.54783 > 208.85.40.50.80: tcp 0
12:50:09.131627 IP 208.85.40.50.80 > 10.253.88.173.54783: tcp 750
12:50:09.131628 IP 208.85.40.50.80 > 10.253.88.173.54783: tcp 1386
12:50:09.131629 IP 208.85.40.50.80 > 10.253.88.173.54783: tcp 1386
12:50:09.131629 IP 208.85.40.50.80 > 10.253.88.173.54783: tcp 1386
12:50:09.131758 IP 10.253.88.173.54783 > 208.85.40.50.80: tcp 0
12:50:09.132104 IP 208.85.40.50.80 > 10.253.88.173.54783: tcp 1386
12:50:09.132105 IP 208.85.40.50.80 > 10.253.88.173.54783: tcp 1386
12:50:09.132184 IP 10.253.88.173.54783 > 208.85.40.50.80: tcp 0
12:50:09.133623 IP 208.85.40.50.80 > 10.253.88.173.54783: tcp 1386
12:50:09.133623 IP 208.85.40.50.80 > 10.253.88.173.54783: tcp 1386
12:50:09.133625 IP 208.85.40.50.80 > 10.253.88.173.54783: tcp 434
12:50:09.133625 IP 208.85.40.50.80 > 10.253.88.173.54783: tcp 1386
12:50:09.133626 IP 208.85.40.50.80 > 10.253.88.173.54783: tcp 1386
12:50:09.133626 IP 208.85.40.50.80 > 10.253.88.173.54783: tcp 124
12:50:09.133791 IP 10.253.88.173.54783 > 208.85.40.50.80: tcp 0
12:50:09.134122 IP 208.85.40.50.80 > 10.253.88.173.54783: tcp 1386
12:50:09.134123 IP 208.85.40.50.80 > 10.253.88.173.54783: tcp 1386
12:50:09.134123 IP 208.85.40.50.80 > 10.253.88.173.54783: tcp 1386
12:50:09.134124 IP 208.85.40.50.80 > 10.253.88.173.54783: tcp 186
12:50:09.134124 IP 208.85.40.50.80 > 10.253.88.173.54785: tcp 1386
12:50:09.134277 IP 10.253.88.173.54783 > 208.85.40.50.80: tcp 0
12:50:09.134620 IP 208.85.40.50.80 > 10.253.88.173.54785: tcp 1386
12:50:09.134621 IP 208.85.40.50.80 > 10.253.88.173.54785: tcp 1386
12:50:09.134621 IP 208.85.40.50.80 > 10.253.88.173.54785: tcp 1386
12:50:09.134622 IP 208.85.40.50.80 > 10.253.88.173.54785: tcp 1386
12:50:09.134622 IP 208.85.40.50.80 > 10.253.88.173.54785: tcp 1386
12:50:09.134786 IP 10.253.88.173.54785 > 208.85.40.50.80: tcp 0
12:50:09.135696 IP 208.85.40.50.80 > 10.253.88.173.54785: tcp 1386
12:50:09.135697 IP 208.85.40.50.80 > 10.253.88.173.54785: tcp 1386
12:50:09.135697 IP 208.85.40.50.80 > 10.253.88.173.54785: tcp 1386
12:50:09.135697 IP 208.85.40.50.80 > 10.253.88.173.54785: tcp 1386
12:50:09.135698 IP 208.85.40.50.80 > 10.253.88.173.54785: tcp 276
12:50:09.135861 IP 10.253.88.173.54785 > 208.85.40.50.80: tcp 0
12:50:09.136112 IP 208.85.40.50.80 > 10.253.88.173.54785: tcp 1386
12:50:09.136173 IP 10.253.88.173.54785 > 208.85.40.50.80: tcp 0
12:50:09.137196 IP 208.85.40.50.80 > 10.253.88.173.54785: tcp 1386
12:50:09.137197 IP 208.85.40.50.80 > 10.253.88.173.54785: tcp 1386
12:50:09.137198 IP 208.85.40.50.80 > 10.253.88.173.54785: tcp 186
12:50:09.137198 IP 208.85.40.50.80 > 10.253.88.173.54785: tcp 1386
12:50:09.137199 IP 208.85.40.50.80 > 10.253.88.173.54785: tcp 1386
12:50:09.137350 IP 10.253.88.173.54785 > 208.85.40.50.80: tcp 0
12:50:09.137640 IP 208.85.40.50.80 > 10.253.88.173.54785: tcp 1386
12:50:09.137641 IP 208.85.40.50.80 > 10.253.88.173.54785: tcp 1386
12:50:09.137642 IP 208.85.40.50.80 > 10.253.88.173.54785: tcp 224
12:50:09.137642 IP 208.85.40.50.80 > 10.253.88.173.54785: tcp 1386
12:50:09.137642 IP 208.85.40.50.80 > 10.253.88.173.54785: tcp 1386
12:50:09.137643 IP 208.85.40.50.80 > 10.253.88.173.54785: tcp 1386
12:50:09.137810 IP 10.253.88.173.54785 > 208.85.40.50.80: tcp 0
12:50:09.138718 IP 208.85.40.50.80 > 10.253.88.173.54785: tcp 1050
12:50:09.138814 IP 10.253.88.173.54785 > 208.85.40.50.80: tcp 0
12:50:09.214719 IP 208.85.40.50.80 > 10.253.88.173.54783: tcp 1386
12:50:09.214721 IP 208.85.40.50.80 > 10.253.88.173.54783: tcp 62
12:50:09.214842 IP 10.253.88.173.54783 > 208.85.40.50.80: tcp 0
12:50:09.216680 IP 208.85.40.50.80 > 10.253.88.173.54783: tcp 1386
12:50:09.218204 IP 208.85.40.50.80 > 10.253.88.173.54783: tcp 1386
12:50:09.218205 IP 208.85.40.50.80 > 10.253.88.173.54783: tcp 1268
12:50:09.218205 IP 208.85.40.50.80 > 10.253.88.173.54783: tcp 1386
12:50:09.218206 IP 208.85.40.50.80 > 10.253.88.173.54783: tcp 1386
12:50:09.218206 IP 208.85.40.50.80 > 10.253.88.173.54783: tcp 1386
12:50:09.218206 IP 208.85.40.50.80 > 10.253.88.173.54783: tcp 186
12:50:09.218376 IP 10.253.88.173.54783 > 208.85.40.50.80: tcp 0
12:50:09.218670 IP 208.85.40.50.80 > 10.253.88.173.54783: tcp 1386
12:50:09.218727 IP 10.253.88.173.54783 > 208.85.40.50.80: tcp 0
12:50:09.219219 IP 208.85.40.50.80 > 10.253.88.173.54783: tcp 1386
12:50:09.219718 IP 208.85.40.50.80 > 10.253.88.173.54783: tcp 1386
12:50:09.219719 IP 208.85.40.50.80 > 10.253.88.173.54783: tcp 1386
12:50:09.219799 IP 10.253.88.173.54783 > 208.85.40.50.80: tcp 0
12:50:09.220165 IP 208.85.40.50.80 > 10.253.88.173.54783: tcp 1386
12:50:09.220222 IP 10.253.88.173.54783 > 208.85.40.50.80: tcp 0
12:50:09.220745 IP 208.85.40.50.80 > 10.253.88.173.54783: tcp 1386
12:50:09.220745 IP 208.85.40.50.80 > 10.253.88.173.54783: tcp 1386
12:50:09.220745 IP 208.85.40.50.80 > 10.253.88.173.54783: tcp 1386
12:50:09.220746 IP 208.85.40.50.80 > 10.253.88.173.54783: tcp 1386
12:50:09.220746 IP 208.85.40.50.80 > 10.253.88.173.54783: tcp 1386
12:50:09.220747 IP 208.85.40.50.80 > 10.253.88.173.54783: tcp 1386
12:50:09.220893 IP 10.253.88.173.54783 > 208.85.40.50.80: tcp 0
12:50:09.221180 IP 208.85.40.50.80 > 10.253.88.173.54783: tcp 1386
12:50:09.221181 IP 208.85.40.50.80 > 10.253.88.173.54783: tcp 1386
12:50:09.221260 IP 10.253.88.173.54783 > 208.85.40.50.80: tcp 0
12:50:09.221675 IP 208.85.40.50.80 > 10.253.88.173.54783: tcp 502
12:50:09.221676 IP 208.85.40.50.80 > 10.253.88.173.54783: tcp 1386
12:50:09.221676 IP 208.85.40.50.80 > 10.253.88.173.54783: tcp 1386
12:50:09.221676 IP 208.85.40.50.80 > 10.253.88.173.54783: tcp 1386
12:50:09.221785 IP 10.253.88.173.54783 > 208.85.40.50.80: tcp 0
12:50:09.222279 IP 208.85.40.50.80 > 10.253.88.173.54783: tcp 1386
12:50:09.222280 IP 208.85.40.50.80 > 10.253.88.173.54783: tcp 248
12:50:09.222365 IP 10.253.88.173.54783 > 208.85.40.50.80: tcp 0
12:50:09.222737 IP 208.85.40.50.80 > 10.253.88.173.54783: tcp 1386
12:50:09.222738 IP 208.85.40.50.80 > 10.253.88.173.54783: tcp 1386
12:50:09.222739 IP 208.85.40.50.80 > 10.253.88.173.54783: tcp 124
12:50:09.222839 IP 10.253.88.173.54783 > 208.85.40.50.80: tcp 0
12:50:09.223761 IP 208.85.40.50.80 > 10.253.88.173.54783: tcp 1386
12:50:09.223762 IP 208.85.40.50.80 > 10.253.88.173.54783: tcp 62
12:50:09.223762 IP 208.85.40.50.80 > 10.253.88.173.54783: tcp 774
12:50:09.223763 IP 208.85.40.50.80 > 10.253.88.173.54783: tcp 1386
12:50:09.223763 IP 208.85.40.50.80 > 10.253.88.173.54783: tcp 1386
12:50:09.223933 IP 10.253.88.173.54783 > 208.85.40.50.80: tcp 0
12:50:09.224188 IP 208.85.40.50.80 > 10.253.88.173.54783: tcp 1386
12:50:09.224189 IP 208.85.40.50.80 > 10.253.88.173.54783: tcp 860
12:50:09.224190 IP 208.85.40.50.80 > 10.253.88.173.54783: tcp 1386
12:50:09.224319 IP 10.253.88.173.54783 > 208.85.40.50.80: tcp 0
12:50:09.224761 IP 208.85.40.50.80 > 10.253.88.173.54783: tcp 1386
12:50:09.224829 IP 10.253.88.173.54783 > 208.85.40.50.80: tcp 0
12:50:09.225174 IP 208.85.40.50.80 > 10.253.88.173.54783: tcp 124
12:50:09.225175 IP 208.85.40.50.80 > 10.253.88.173.54783: tcp 1386
12:50:09.225175 IP 208.85.40.50.80 > 10.253.88.173.54783: tcp 62
12:50:09.225280 IP 10.253.88.173.54783 > 208.85.40.50.80: tcp 0
12:50:09.225719 IP 208.85.40.50.80 > 10.253.88.173.54783: tcp 1084
12:50:09.225785 IP 10.253.88.173.54783 > 208.85.40.50.80: tcp 0
12:50:09.226210 IP 208.85.40.50.80 > 10.253.88.173.54785: tcp 1386
12:50:09.226210 IP 208.85.40.50.80 > 10.253.88.173.54785: tcp 1386
12:50:09.226210 IP 208.85.40.50.80 > 10.253.88.173.54785: tcp 1386
12:50:09.226335 IP 10.253.88.173.54785 > 208.85.40.50.80: tcp 0
12:50:09.227735 IP 208.85.40.50.80 > 10.253.88.173.54785: tcp 1386
12:50:09.227735 IP 208.85.40.50.80 > 10.253.88.173.54785: tcp 1386
12:50:09.227736 IP 208.85.40.50.80 > 10.253.88.173.54785: tcp 1386
12:50:09.227736 IP 208.85.40.50.80 > 10.253.88.173.54785: tcp 1236
12:50:09.227737 IP 208.85.40.50.80 > 10.253.88.173.54785: tcp 1386
12:50:09.227737 IP 208.85.40.50.80 > 10.253.88.173.54785: tcp 1386
12:50:09.227738 IP 208.85.40.50.80 > 10.253.88.173.54785: tcp 1386
12:50:09.227959 IP 10.253.88.173.54785 > 208.85.40.50.80: tcp 0
12:50:09.228184 IP 208.85.40.50.80 > 10.253.88.173.54785: tcp 1386
12:50:09.228185 IP 208.85.40.50.80 > 10.253.88.173.54785: tcp 1112
12:50:09.228185 IP 208.85.40.50.80 > 10.253.88.173.54785: tcp 1386
12:50:09.228299 IP 10.253.88.173.54785 > 208.85.40.50.80: tcp 0
12:50:09.228732 IP 208.85.40.50.80 > 10.253.88.173.54785: tcp 1386
12:50:09.228796 IP 10.253.88.173.54785 > 208.85.40.50.80: tcp 0
12:50:09.230266 IP 208.85.40.50.80 > 10.253.88.173.54785: tcp 1386
12:50:09.230267 IP 208.85.40.50.80 > 10.253.88.173.54785: tcp 1386
12:50:09.230267 IP 208.85.40.50.80 > 10.253.88.173.54785: tcp 248
12:50:09.230268 IP 208.85.40.50.80 > 10.253.88.173.54785: tcp 1386
12:50:09.230268 IP 208.85.40.50.80 > 10.253.88.173.54785: tcp 1386
12:50:09.230268 IP 208.85.40.50.80 > 10.253.88.173.54785: tcp 1386
12:50:09.230269 IP 208.85.40.50.80 > 10.253.88.173.54785: tcp 1386
12:50:09.230269 IP 208.85.40.50.80 > 10.253.88.173.54785: tcp 1386
12:50:09.230270 IP 208.85.40.50.80 > 10.253.88.173.54785: tcp 310
12:50:09.230270 IP 208.85.40.50.80 > 10.253.88.173.54785: tcp 1386
12:50:09.230574 IP 10.253.88.173.54785 > 208.85.40.50.80: tcp 0
12:50:09.299266 IP 208.85.40.50.80 > 10.253.88.173.54783: tcp 364
12:50:09.308770 IP 208.85.40.50.80 > 10.253.88.173.54783: tcp 1386
12:50:09.308881 IP 10.253.88.173.54783 > 208.85.40.50.80: tcp 0
12:50:09.309276 IP 208.85.40.50.80 > 10.253.88.173.54783: tcp 1386
12:50:09.309277 IP 208.85.40.50.80 > 10.253.88.173.54783: tcp 1386
12:50:09.309371 IP 10.253.88.173.54783 > 208.85.40.50.80: tcp 0
12:50:09.311401 IP 208.85.40.50.80 > 10.253.88.173.54783: tcp 1386
12:50:09.311402 IP 208.85.40.50.80 > 10.253.88.173.54783: tcp 1386
12:50:09.311402 IP 208.85.40.50.80 > 10.253.88.173.54783: tcp 310
12:50:09.311403 IP 208.85.40.50.80 > 10.253.88.173.54783: tcp 1386
12:50:09.311404 IP 208.85.40.50.80 > 10.253.88.173.54783: tcp 62
12:50:09.311570 IP 10.253.88.173.54783 > 208.85.40.50.80: tcp 0
12:50:09.311743 IP 208.85.40.50.80 > 10.253.88.173.54783: tcp 1386
12:50:09.311802 IP 10.253.88.173.54783 > 208.85.40.50.80: tcp 0
12:50:09.312291 IP 208.85.40.50.80 > 10.253.88.173.54783: tcp 1386
12:50:09.312740 IP 208.85.40.50.80 > 10.253.88.173.54783: tcp 1386
12:50:09.312799 IP 10.253.88.173.54783 > 208.85.40.50.80: tcp 0
12:50:09.313338 IP 208.85.40.50.80 > 10.253.88.173.54783: tcp 746
12:50:09.313339 IP 208.85.40.50.80 > 10.253.88.173.54783: tcp 1386
12:50:09.313340 IP 208.85.40.50.80 > 10.253.88.173.54783: tcp 62
12:50:09.313445 IP 10.253.88.173.54783 > 208.85.40.50.80: tcp 0
12:50:09.314300 IP 208.85.40.50.80 > 10.253.88.173.54783: tcp 1386
