15:24:46.698958 IP 129.63.5.156.56147 > 23.253.87.159.80: tcp 0
15:24:46.698960 IP 129.63.5.156.56148 > 23.253.87.159.80: tcp 0
15:24:46.698962 IP 129.63.5.156.56149 > 23.253.87.159.80: tcp 0
15:24:46.698963 IP 129.63.5.156.56150 > 23.253.87.159.80: tcp 0
15:24:46.698964 IP 129.63.5.156.56151 > 23.253.87.159.80: tcp 0
15:24:46.698965 IP 129.63.5.156.56152 > 23.253.87.159.80: tcp 0
15:24:46.759367 IP 23.253.87.159.80 > 129.63.5.156.56147: tcp 0
15:24:46.759666 IP 129.63.5.156.56147 > 23.253.87.159.80: tcp 0
15:24:46.766451 IP 129.63.5.156.56147 > 23.253.87.159.80: tcp 685
15:24:46.776154 IP 23.253.87.159.80 > 129.63.5.156.56148: tcp 0
15:24:46.776260 IP 23.253.87.159.80 > 129.63.5.156.56149: tcp 0
15:24:46.776331 IP 129.63.5.156.56148 > 23.253.87.159.80: tcp 0
15:24:46.776332 IP 129.63.5.156.56149 > 23.253.87.159.80: tcp 0
15:24:46.776367 IP 23.253.87.159.80 > 129.63.5.156.56152: tcp 0
15:24:46.776441 IP 129.63.5.156.56152 > 23.253.87.159.80: tcp 0
15:24:46.776471 IP 23.253.87.159.80 > 129.63.5.156.56150: tcp 0
15:24:46.776555 IP 23.253.87.159.80 > 129.63.5.156.56151: tcp 0
15:24:46.776626 IP 129.63.5.156.56150 > 23.253.87.159.80: tcp 0
15:24:46.776627 IP 129.63.5.156.56151 > 23.253.87.159.80: tcp 0
15:24:46.825227 IP 23.253.87.159.80 > 129.63.5.156.56147: tcp 0
15:24:46.826243 IP 23.253.87.159.80 > 129.63.5.156.56147: tcp 101
15:24:46.826279 IP 23.253.87.159.80 > 129.63.5.156.56147: tcp 0
15:24:46.826361 IP 129.63.5.156.56147 > 23.253.87.159.80: tcp 0
15:24:46.826845 IP 129.63.5.156.56147 > 23.253.87.159.80: tcp 0
15:24:46.884023 IP 23.253.87.159.80 > 129.63.5.156.56147: tcp 0
15:24:46.908968 IP 129.63.5.156.56148 > 23.253.87.159.80: tcp 691
15:24:46.908969 IP 129.63.5.156.56149 > 23.253.87.159.80: tcp 674
15:24:46.908970 IP 129.63.5.156.56152 > 23.253.87.159.80: tcp 685
15:24:46.909473 IP 129.63.5.156.56150 > 23.253.87.159.80: tcp 668
15:24:46.910597 IP 129.63.5.156.56151 > 23.253.87.159.80: tcp 679
15:24:46.912072 IP 129.63.5.156.56165 > 23.253.87.159.80: tcp 0
15:24:46.981427 IP 23.253.87.159.80 > 129.63.5.156.56148: tcp 0
15:24:46.981505 IP 23.253.87.159.80 > 129.63.5.156.56149: tcp 0
15:24:46.981876 IP 23.253.87.159.80 > 129.63.5.156.56152: tcp 0
15:24:46.982962 IP 23.253.87.159.80 > 129.63.5.156.56150: tcp 0
15:24:46.983320 IP 23.253.87.159.80 > 129.63.5.156.56165: tcp 0
15:24:46.983443 IP 129.63.5.156.56165 > 23.253.87.159.80: tcp 0
15:24:46.983612 IP 129.63.5.156.56165 > 23.253.87.159.80: tcp 665
15:24:46.983777 IP 23.253.87.159.80 > 129.63.5.156.56151: tcp 0
15:24:46.984502 IP 23.253.87.159.80 > 129.63.5.156.56149: tcp 101
15:24:46.984537 IP 23.253.87.159.80 > 129.63.5.156.56149: tcp 0
15:24:46.984606 IP 129.63.5.156.56149 > 23.253.87.159.80: tcp 0
15:24:46.985175 IP 129.63.5.156.56149 > 23.253.87.159.80: tcp 0
15:24:46.985908 IP 23.253.87.159.80 > 129.63.5.156.56148: tcp 101
15:24:46.985947 IP 23.253.87.159.80 > 129.63.5.156.56148: tcp 0
15:24:46.986022 IP 129.63.5.156.56148 > 23.253.87.159.80: tcp 0
15:24:46.986510 IP 129.63.5.156.56148 > 23.253.87.159.80: tcp 0
15:24:46.987707 IP 23.253.87.159.80 > 129.63.5.156.56152: tcp 101
15:24:46.987758 IP 23.253.87.159.80 > 129.63.5.156.56152: tcp 0
15:24:46.988130 IP 129.63.5.156.56152 > 23.253.87.159.80: tcp 0
15:24:46.988450 IP 129.63.5.156.56152 > 23.253.87.159.80: tcp 0
15:24:46.988919 IP 23.253.87.159.80 > 129.63.5.156.56150: tcp 101
15:24:46.988968 IP 23.253.87.159.80 > 129.63.5.156.56150: tcp 0
15:24:46.989058 IP 129.63.5.156.56150 > 23.253.87.159.80: tcp 0
15:24:46.989684 IP 129.63.5.156.56150 > 23.253.87.159.80: tcp 0
15:24:46.996881 IP 23.253.87.159.80 > 129.63.5.156.56151: tcp 101
15:24:46.996939 IP 23.253.87.159.80 > 129.63.5.156.56151: tcp 0
15:24:46.997040 IP 129.63.5.156.56151 > 23.253.87.159.80: tcp 0
15:24:46.997619 IP 129.63.5.156.56151 > 23.253.87.159.80: tcp 0
15:24:47.042197 IP 23.253.87.159.80 > 129.63.5.156.56149: tcp 0
15:24:47.042798 IP 23.253.87.159.80 > 129.63.5.156.56165: tcp 0
15:24:47.043052 IP 23.253.87.159.80 > 129.63.5.156.56148: tcp 0
15:24:47.043918 IP 23.253.87.159.80 > 129.63.5.156.56165: tcp 101
15:24:47.044206 IP 23.253.87.159.80 > 129.63.5.156.56165: tcp 0
15:24:47.044324 IP 129.63.5.156.56165 > 23.253.87.159.80: tcp 0
15:24:47.044746 IP 129.63.5.156.56165 > 23.253.87.159.80: tcp 0
15:24:47.048407 IP 23.253.87.159.80 > 129.63.5.156.56152: tcp 0
15:24:47.053616 IP 23.253.87.159.80 > 129.63.5.156.56150: tcp 0
15:24:47.054553 IP 129.63.5.156.56166 > 23.253.87.159.80: tcp 0
15:24:47.055311 IP 23.253.87.159.80 > 129.63.5.156.56151: tcp 0
15:24:47.103419 IP 23.253.87.159.80 > 129.63.5.156.56165: tcp 0
15:24:47.104264 IP 129.63.5.156.56167 > 23.253.87.159.80: tcp 0
15:24:47.104267 IP 129.63.5.156.56168 > 23.253.87.159.80: tcp 0
15:24:47.104268 IP 129.63.5.156.56169 > 23.253.87.159.80: tcp 0
15:24:47.104268 IP 129.63.5.156.56170 > 23.253.87.159.80: tcp 0
15:24:47.104270 IP 129.63.5.156.56171 > 23.253.87.159.80: tcp 0
15:24:47.120714 IP 23.253.87.159.80 > 129.63.5.156.56166: tcp 0
15:24:47.120856 IP 129.63.5.156.56166 > 23.253.87.159.80: tcp 0
15:24:47.121012 IP 129.63.5.156.56166 > 23.253.87.159.80: tcp 697
15:24:47.161212 IP 23.253.87.159.80 > 129.63.5.156.56167: tcp 0
15:24:47.161359 IP 129.63.5.156.56167 > 23.253.87.159.80: tcp 0
15:24:47.161511 IP 129.63.5.156.56167 > 23.253.87.159.80: tcp 714
15:24:47.162155 IP 23.253.87.159.80 > 129.63.5.156.56169: tcp 0
15:24:47.162288 IP 23.253.87.159.80 > 129.63.5.156.56168: tcp 0
15:24:47.162402 IP 129.63.5.156.56169 > 23.253.87.159.80: tcp 0
15:24:47.162403 IP 129.63.5.156.56168 > 23.253.87.159.80: tcp 0
15:24:47.162878 IP 23.253.87.159.80 > 129.63.5.156.56171: tcp 0
15:24:47.162926 IP 129.63.5.156.56169 > 23.253.87.159.80: tcp 720
15:24:47.162927 IP 129.63.5.156.56168 > 23.253.87.159.80: tcp 713
15:24:47.163011 IP 23.253.87.159.80 > 129.63.5.156.56170: tcp 0
15:24:47.163119 IP 129.63.5.156.56171 > 23.253.87.159.80: tcp 0
15:24:47.163120 IP 129.63.5.156.56170 > 23.253.87.159.80: tcp 0
15:24:47.163132 IP 129.63.5.156.56171 > 23.253.87.159.80: tcp 705
15:24:47.163302 IP 129.63.5.156.56170 > 23.253.87.159.80: tcp 710
15:24:47.166212 IP 129.63.5.156.56173 > 23.253.87.159.80: tcp 0
15:24:47.178106 IP 23.253.87.159.80 > 129.63.5.156.56166: tcp 0
15:24:47.179736 IP 23.253.87.159.80 > 129.63.5.156.56166: tcp 101
15:24:47.179786 IP 23.253.87.159.80 > 129.63.5.156.56166: tcp 0
15:24:47.179858 IP 129.63.5.156.56166 > 23.253.87.159.80: tcp 0
15:24:47.180395 IP 129.63.5.156.56166 > 23.253.87.159.80: tcp 0
15:24:47.220090 IP 23.253.87.159.80 > 129.63.5.156.56167: tcp 0
15:24:47.225725 IP 23.253.87.159.80 > 129.63.5.156.56168: tcp 0
15:24:47.225767 IP 23.253.87.159.80 > 129.63.5.156.56169: tcp 0
15:24:47.225828 IP 23.253.87.159.80 > 129.63.5.156.56167: tcp 101
15:24:47.225862 IP 23.253.87.159.80 > 129.63.5.156.56167: tcp 0
15:24:47.225931 IP 129.63.5.156.56167 > 23.253.87.159.80: tcp 0
15:24:47.226076 IP 23.253.87.159.80 > 129.63.5.156.56171: tcp 0
15:24:47.226219 IP 23.253.87.159.80 > 129.63.5.156.56168: tcp 101
15:24:47.226283 IP 23.253.87.159.80 > 129.63.5.156.56168: tcp 0
15:24:47.226376 IP 23.253.87.159.80 > 129.63.5.156.56173: tcp 0
15:24:47.226639 IP 23.253.87.159.80 > 129.63.5.156.56170: tcp 0
15:24:47.226687 IP 23.253.87.159.80 > 129.63.5.156.56169: tcp 101
15:24:47.226735 IP 23.253.87.159.80 > 129.63.5.156.56169: tcp 0
15:24:47.226826 IP 23.253.87.159.80 > 129.63.5.156.56171: tcp 101
15:24:47.226885 IP 23.253.87.159.80 > 129.63.5.156.56171: tcp 0
15:24:47.226925 IP 129.63.5.156.56167 > 23.253.87.159.80: tcp 0
15:24:47.226926 IP 129.63.5.156.56168 > 23.253.87.159.80: tcp 0
15:24:47.226926 IP 129.63.5.156.56173 > 23.253.87.159.80: tcp 0
15:24:47.226927 IP 129.63.5.156.56173 > 23.253.87.159.80: tcp 799
15:24:47.226927 IP 129.63.5.156.56169 > 23.253.87.159.80: tcp 0
15:24:47.227012 IP 129.63.5.156.56171 > 23.253.87.159.80: tcp 0
15:24:47.228054 IP 129.63.5.156.56168 > 23.253.87.159.80: tcp 0
15:24:47.228056 IP 129.63.5.156.56169 > 23.253.87.159.80: tcp 0
15:24:47.228056 IP 129.63.5.156.56171 > 23.253.87.159.80: tcp 0
15:24:47.228725 IP 23.253.87.159.80 > 129.63.5.156.56170: tcp 101
15:24:47.228773 IP 23.253.87.159.80 > 129.63.5.156.56170: tcp 0
15:24:47.228854 IP 129.63.5.156.56170 > 23.253.87.159.80: tcp 0
15:24:47.231543 IP 129.63.5.156.56170 > 23.253.87.159.80: tcp 0
15:24:47.242096 IP 23.253.87.159.80 > 129.63.5.156.56166: tcp 0
15:24:47.267030 IP 129.63.5.156.56174 > 23.253.87.159.80: tcp 0
15:24:47.267032 IP 129.63.5.156.56175 > 23.253.87.159.80: tcp 0
15:24:47.267033 IP 129.63.5.156.56176 > 23.253.87.159.80: tcp 0
15:24:47.267033 IP 129.63.5.156.56177 > 23.253.87.159.80: tcp 0
15:24:47.267034 IP 129.63.5.156.56178 > 23.253.87.159.80: tcp 0
15:24:47.284584 IP 23.253.87.159.80 > 129.63.5.156.56167: tcp 0
15:24:47.284943 IP 23.253.87.159.80 > 129.63.5.156.56173: tcp 0
15:24:47.285088 IP 23.253.87.159.80 > 129.63.5.156.56171: tcp 0
15:24:47.285450 IP 23.253.87.159.80 > 129.63.5.156.56173: tcp 210
15:24:47.285571 IP 23.253.87.159.80 > 129.63.5.156.56173: tcp 0
15:24:47.285804 IP 129.63.5.156.56173 > 23.253.87.159.80: tcp 0
15:24:47.286083 IP 23.253.87.159.80 > 129.63.5.156.56168: tcp 0
15:24:47.286216 IP 23.253.87.159.80 > 129.63.5.156.56169: tcp 0
15:24:47.287459 IP 129.63.5.156.56173 > 23.253.87.159.80: tcp 0
15:24:47.287697 IP 23.253.87.159.80 > 129.63.5.156.56170: tcp 0
15:24:47.292084 IP 129.63.5.156.56179 > 23.253.87.159.80: tcp 0
15:24:47.321724 IP 23.253.87.159.80 > 129.63.5.156.56176: tcp 0
15:24:47.322448 IP 129.63.5.156.56176 > 23.253.87.159.80: tcp 0
15:24:47.322451 IP 129.63.5.156.56176 > 23.253.87.159.80: tcp 703
15:24:47.323447 IP 23.253.87.159.80 > 129.63.5.156.56174: tcp 0
15:24:47.323769 IP 23.253.87.159.80 > 129.63.5.156.56175: tcp 0
15:24:47.324315 IP 23.253.87.159.80 > 129.63.5.156.56177: tcp 0
15:24:47.324452 IP 129.63.5.156.56174 > 23.253.87.159.80: tcp 0
15:24:47.324454 IP 129.63.5.156.56175 > 23.253.87.159.80: tcp 0
15:24:47.324455 IP 129.63.5.156.56174 > 23.253.87.159.80: tcp 706
15:24:47.324456 IP 129.63.5.156.56175 > 23.253.87.159.80: tcp 708
15:24:47.324677 IP 23.253.87.159.80 > 129.63.5.156.56178: tcp 0
15:24:47.325138 IP 129.63.5.156.56177 > 23.253.87.159.80: tcp 0
15:24:47.325139 IP 129.63.5.156.56177 > 23.253.87.159.80: tcp 705
15:24:47.325140 IP 129.63.5.156.56178 > 23.253.87.159.80: tcp 0
15:24:47.326450 IP 129.63.5.156.56178 > 23.253.87.159.80: tcp 712
15:24:47.343205 IP 23.253.87.159.80 > 129.63.5.156.56173: tcp 0
15:24:47.349634 IP 23.253.87.159.80 > 129.63.5.156.56179: tcp 0
15:24:47.349934 IP 129.63.5.156.56179 > 23.253.87.159.80: tcp 0
15:24:47.350459 IP 129.63.5.156.56179 > 23.253.87.159.80: tcp 704
15:24:47.382412 IP 23.253.87.159.80 > 129.63.5.156.56176: tcp 0
15:24:47.383419 IP 23.253.87.159.80 > 129.63.5.156.56176: tcp 101
15:24:47.383634 IP 23.253.87.159.80 > 129.63.5.156.56176: tcp 0
15:24:47.383820 IP 23.253.87.159.80 > 129.63.5.156.56174: tcp 0
15:24:47.383961 IP 23.253.87.159.80 > 129.63.5.156.56175: tcp 0
15:24:47.384635 IP 129.63.5.156.56176 > 23.253.87.159.80: tcp 0
15:24:47.384636 IP 129.63.5.156.56176 > 23.253.87.159.80: tcp 0
15:24:47.387043 IP 23.253.87.159.80 > 129.63.5.156.56174: tcp 101
15:24:47.387120 IP 23.253.87.159.80 > 129.63.5.156.56174: tcp 0
15:24:47.387286 IP 23.253.87.159.80 > 129.63.5.156.56177: tcp 0
15:24:47.387358 IP 23.253.87.159.80 > 129.63.5.156.56175: tcp 101
15:24:47.387414 IP 23.253.87.159.80 > 129.63.5.156.56175: tcp 0
15:24:47.387482 IP 129.63.5.156.56174 > 23.253.87.159.80: tcp 0
15:24:47.387483 IP 129.63.5.156.56175 > 23.253.87.159.80: tcp 0
15:24:47.387550 IP 23.253.87.159.80 > 129.63.5.156.56178: tcp 0
15:24:47.387599 IP 23.253.87.159.80 > 129.63.5.156.56177: tcp 101
15:24:47.387658 IP 23.253.87.159.80 > 129.63.5.156.56177: tcp 0
15:24:47.387852 IP 23.253.87.159.80 > 129.63.5.156.56178: tcp 101
15:24:47.387908 IP 23.253.87.159.80 > 129.63.5.156.56178: tcp 0
15:24:47.388529 IP 129.63.5.156.56177 > 23.253.87.159.80: tcp 0
15:24:47.388530 IP 129.63.5.156.56180 > 23.253.87.159.80: tcp 0
15:24:47.388531 IP 129.63.5.156.56174 > 23.253.87.159.80: tcp 0
15:24:47.388531 IP 129.63.5.156.56178 > 23.253.87.159.80: tcp 0
15:24:47.388531 IP 129.63.5.156.56175 > 23.253.87.159.80: tcp 0
15:24:47.390497 IP 129.63.5.156.56177 > 23.253.87.159.80: tcp 0
15:24:47.390498 IP 129.63.5.156.56178 > 23.253.87.159.80: tcp 0
15:24:47.397491 IP 129.63.5.156.56181 > 23.253.87.159.80: tcp 0
15:24:47.398490 IP 129.63.5.156.56182 > 23.253.87.159.80: tcp 0
15:24:47.399415 IP 129.63.5.156.56183 > 23.253.87.159.80: tcp 0
15:24:47.400001 IP 129.63.5.156.56184 > 23.253.87.159.80: tcp 0
15:24:47.408377 IP 23.253.87.159.80 > 129.63.5.156.56179: tcp 0
15:24:47.408826 IP 23.253.87.159.80 > 129.63.5.156.56179: tcp 101
15:24:47.408876 IP 23.253.87.159.80 > 129.63.5.156.56179: tcp 0
15:24:47.408962 IP 129.63.5.156.56179 > 23.253.87.159.80: tcp 0
15:24:47.409408 IP 129.63.5.156.56179 > 23.253.87.159.80: tcp 0
15:24:47.442578 IP 23.253.87.159.80 > 129.63.5.156.56176: tcp 0
15:24:47.453787 IP 23.253.87.159.80 > 129.63.5.156.56180: tcp 0
15:24:47.453956 IP 23.253.87.159.80 > 129.63.5.156.56174: tcp 0
15:24:47.454092 IP 23.253.87.159.80 > 129.63.5.156.56177: tcp 0
15:24:47.454165 IP 23.253.87.159.80 > 129.63.5.156.56175: tcp 0
15:24:47.454371 IP 129.63.5.156.56180 > 23.253.87.159.80: tcp 0
15:24:47.454372 IP 129.63.5.156.56180 > 23.253.87.159.80: tcp 689
15:24:47.454767 IP 23.253.87.159.80 > 129.63.5.156.56178: tcp 0
15:24:47.454817 IP 23.253.87.159.80 > 129.63.5.156.56181: tcp 0
15:24:47.455019 IP 129.63.5.156.56181 > 23.253.87.159.80: tcp 0
15:24:47.455102 IP 129.63.5.156.56181 > 23.253.87.159.80: tcp 695
15:24:47.458025 IP 23.253.87.159.80 > 129.63.5.156.56183: tcp 0
15:24:47.458263 IP 129.63.5.156.56183 > 23.253.87.159.80: tcp 0
15:24:47.458311 IP 23.253.87.159.80 > 129.63.5.156.56184: tcp 0
15:24:47.460076 IP 129.63.5.156.56183 > 23.253.87.159.80: tcp 700
15:24:47.460078 IP 129.63.5.156.56184 > 23.253.87.159.80: tcp 0
15:24:47.460078 IP 129.63.5.156.56184 > 23.253.87.159.80: tcp 702
15:24:47.468659 IP 23.253.87.159.80 > 129.63.5.156.56179: tcp 0
15:24:47.490753 IP 23.253.87.159.80 > 129.63.5.156.56182: tcp 0
15:24:47.492006 IP 129.63.5.156.56182 > 23.253.87.159.80: tcp 0
15:24:47.492007 IP 129.63.5.156.56182 > 23.253.87.159.80: tcp 709
15:24:47.517892 IP 23.253.87.159.80 > 129.63.5.156.56181: tcp 0
15:24:47.518408 IP 23.253.87.159.80 > 129.63.5.156.56180: tcp 0
15:24:47.518674 IP 23.253.87.159.80 > 129.63.5.156.56181: tcp 101
15:24:47.518720 IP 23.253.87.159.80 > 129.63.5.156.56181: tcp 0
15:24:47.518802 IP 129.63.5.156.56181 > 23.253.87.159.80: tcp 0
15:24:47.519275 IP 129.63.5.156.56181 > 23.253.87.159.80: tcp 0
15:24:47.520899 IP 23.253.87.159.80 > 129.63.5.156.56183: tcp 0
15:24:47.520992 IP 23.253.87.159.80 > 129.63.5.156.56184: tcp 0
15:24:47.521703 IP 23.253.87.159.80 > 129.63.5.156.56180: tcp 101
15:24:47.521743 IP 23.253.87.159.80 > 129.63.5.156.56180: tcp 0
15:24:47.521812 IP 129.63.5.156.56180 > 23.253.87.159.80: tcp 0
15:24:47.522196 IP 129.63.5.156.56180 > 23.253.87.159.80: tcp 0
15:24:47.522368 IP 23.253.87.159.80 > 129.63.5.156.56183: tcp 101
15:24:47.522421 IP 23.253.87.159.80 > 129.63.5.156.56183: tcp 0
15:24:47.522504 IP 129.63.5.156.56183 > 23.253.87.159.80: tcp 0
15:24:47.522863 IP 129.63.5.156.56183 > 23.253.87.159.80: tcp 0
15:24:47.522944 IP 23.253.87.159.80 > 129.63.5.156.56184: tcp 101
15:24:47.522994 IP 23.253.87.159.80 > 129.63.5.156.56184: tcp 0
15:24:47.523117 IP 129.63.5.156.56184 > 23.253.87.159.80: tcp 0
15:24:47.523453 IP 129.63.5.156.56184 > 23.253.87.159.80: tcp 0
15:24:47.590989 IP 23.253.87.159.80 > 129.63.5.156.56181: tcp 0
15:24:47.604748 IP 23.253.87.159.80 > 129.63.5.156.56183: tcp 0
15:24:47.604802 IP 23.253.87.159.80 > 129.63.5.156.56180: tcp 0
15:24:47.611818 IP 23.253.87.159.80 > 129.63.5.156.56182: tcp 0
15:24:47.611999 IP 23.253.87.159.80 > 129.63.5.156.56182: tcp 101
15:24:47.612043 IP 23.253.87.159.80 > 129.63.5.156.56182: tcp 0
15:24:47.612154 IP 129.63.5.156.56182 > 23.253.87.159.80: tcp 0
15:24:47.618637 IP 129.63.5.156.56182 > 23.253.87.159.80: tcp 0
15:24:47.620009 IP 23.253.87.159.80 > 129.63.5.156.56184: tcp 0
15:24:47.710500 IP 23.253.87.159.80 > 129.63.5.156.56182: tcp 0
15:24:47.916843 IP 129.63.5.156.56189 > 23.253.87.159.80: tcp 0
15:24:47.968900 IP 23.253.87.159.80 > 129.63.5.156.56189: tcp 0
15:24:47.969047 IP 129.63.5.156.56189 > 23.253.87.159.80: tcp 0
15:24:47.969207 IP 129.63.5.156.56189 > 23.253.87.159.80: tcp 595
15:24:48.025065 IP 23.253.87.159.80 > 129.63.5.156.56189: tcp 0
15:24:48.026927 IP 23.253.87.159.80 > 129.63.5.156.56189: tcp 1360
15:24:48.027031 IP 23.253.87.159.80 > 129.63.5.156.56189: tcp 1155
15:24:48.027188 IP 129.63.5.156.56189 > 23.253.87.159.80: tcp 0
15:24:48.027314 IP 23.253.87.159.80 > 129.63.5.156.56189: tcp 0
15:24:48.027504 IP 129.63.5.156.56189 > 23.253.87.159.80: tcp 0
15:24:48.028506 IP 129.63.5.156.56189 > 23.253.87.159.80: tcp 0
15:24:48.082952 IP 23.253.87.159.80 > 129.63.5.156.56189: tcp 0
