16:28:32.224086 IP 80.67.87.31.80 > 129.63.141.138.2920: tcp 182
16:28:32.224130 IP 129.63.27.12.2146 > 192.122.221.28.5999: tcp 1400
16:28:32.224258 IP 129.63.27.12.2146 > 192.122.221.28.5999: tcp 1400
16:28:32.224261 IP 129.63.28.69.49629 > 8.12.96.24.80: tcp 0
16:28:32.224387 IP 129.63.27.12.2146 > 192.122.221.28.5999: tcp 1400
16:28:32.224390 IP 129.63.28.25.50021 > 64.15.112.107.80: tcp 0
16:28:32.224451 IP 129.63.27.12.2146 > 192.122.221.28.5999: tcp 1400
16:28:32.224454 IP 129.63.70.86.1265 > 125.90.207.4.80: tcp 0
16:28:32.224492 IP 140.130.175.207.16800 > 129.63.144.87.2130: tcp 0
16:28:32.224596 IP 149.174.133.201.80 > 129.63.184.69.2243: tcp 1460
16:28:32.224599 IP 129.63.27.12.2146 > 192.122.221.28.5999: tcp 997
16:28:32.224601 IP 149.174.133.201.80 > 129.63.184.69.2243: tcp 1369
16:28:32.224603 IP 129.63.153.203.27569 > 149.166.112.192.57561: tcp 1460
16:28:32.224644 IP 129.63.35.133.4299 > 24.3.20.216.43442: tcp 1460
16:28:32.224697 IP 129.63.56.9.49730 > 8.3.209.233.80: tcp 0
16:28:32.224700 IP 129.63.68.84.1707 > 38.99.76.220.80: tcp 0
16:28:32.224776 IP 208.111.129.46.80 > 129.63.137.96.2653: tcp 1460
16:28:32.224810 IP 208.111.129.46.80 > 129.63.137.96.2653: tcp 1460
16:28:32.224813 IP 71.71.118.209.21539 > 129.63.151.26.1631: tcp 0
16:28:32.224815 IP 129.63.203.43.2392 > 116.37.163.131.9913: tcp 0
16:28:32.224818 IP 129.63.151.26.1840 > 74.72.205.81.8444: tcp 0
16:28:32.224858 IP 209.17.66.11.80 > 129.63.68.84.1677: tcp 1460
16:28:32.224919 IP 209.17.66.11.80 > 129.63.68.84.1677: tcp 1460
16:28:32.225004 IP 129.63.151.80.1029 > 24.178.43.72.42589: tcp 1460
16:28:32.225007 IP 209.17.66.11.80 > 129.63.68.84.1677: tcp 1460
16:28:32.225009 IP 72.21.202.37.80 > 129.63.57.162.52312: tcp 1460
16:28:32.225051 IP 72.21.202.37.80 > 129.63.57.162.52312: tcp 1460
16:28:32.225054 IP 72.21.202.37.80 > 129.63.57.162.52312: tcp 1460
16:28:32.225056 IP 72.21.202.37.80 > 129.63.57.162.52312: tcp 1460
16:28:32.225269 IP 129.63.141.138.2920 > 80.67.87.31.80: tcp 1460
16:28:32.225272 IP 129.63.141.138.2920 > 80.67.87.31.80: tcp 262
16:28:32.225346 IP 129.63.184.69.2243 > 149.174.133.201.80: tcp 0
16:28:32.225411 IP 129.63.35.133.4299 > 24.3.20.216.43442: tcp 1460
16:28:32.225596 IP 146.189.117.246.443 > 129.63.49.202.2126: tcp 72
16:28:32.225645 IP 129.63.223.138.4956 > 218.61.9.24.80: tcp 0
16:28:32.225908 IP 71.184.159.133.63026 > 129.63.30.63.64880: tcp 1448
16:28:32.225911 IP 129.63.71.175.3803 > 70.87.68.194.80: tcp 1104
16:28:32.225913 IP 129.63.68.84.1677 > 209.17.66.11.80: tcp 0
16:28:32.226307 IP 129.63.35.133.4299 > 24.3.20.216.43442: tcp 1460
16:28:32.226310 IP 129.63.68.84.1677 > 209.17.66.11.80: tcp 0
16:28:32.226595 IP 129.63.151.80.3896 > 77.101.19.28.60710: tcp 5
16:28:32.226661 IP 129.63.30.63.64880 > 71.184.159.133.63026: tcp 0
16:28:32.226664 IP 129.63.151.26.1621 > 71.230.167.44.8700: tcp 0
16:28:32.226703 IP 222.114.52.78.19101 > 129.63.151.47.1077: tcp 1460
16:28:32.226769 IP 129.63.151.80.1029 > 24.178.43.72.42589: tcp 1460
16:28:32.226789 IP 79.180.35.99.10308 > 129.63.54.50.2628: tcp 1360
16:28:32.226919 IP 129.63.28.25.50021 > 64.15.112.107.80: tcp 0
16:28:32.226990 IP 218.61.9.24.80 > 129.63.223.138.4956: tcp 1460
16:28:32.226996 IP 190.1.195.2.51457 > 129.63.35.133.1227: tcp 0
16:28:32.227025 IP 218.61.9.24.80 > 129.63.223.138.4956: tcp 1460
16:28:32.227060 IP 218.61.9.24.80 > 129.63.223.138.4956: tcp 1460
16:28:32.227062 IP 129.63.35.133.1339 > 12.202.123.81.7274: tcp 0
16:28:32.227086 IP 218.61.9.24.80 > 129.63.223.138.4956: tcp 1460
16:28:32.227089 IP 205.188.142.249.443 > 129.63.58.22.65158: tcp 27
16:28:32.227091 IP 128.2.207.24.80 > 129.63.16.115.3149: tcp 0
16:28:32.227224 IP 129.63.35.133.1339 > 12.202.123.81.7274: tcp 1460
16:28:32.227227 IP 65.39.221.80.80 > 129.63.96.102.2809: tcp 1460
16:28:32.227282 IP 65.39.221.80.80 > 129.63.96.102.2809: tcp 1377
16:28:32.227507 IP 198.93.34.50.443 > 129.63.8.83.64799: tcp 1380
16:28:32.227510 IP 198.93.34.50.443 > 129.63.8.83.64799: tcp 1380
16:28:32.227512 IP 198.93.34.50.443 > 129.63.8.83.64799: tcp 51
16:28:32.227517 IP 129.63.16.115.3149 > 128.2.207.24.80: tcp 0
16:28:32.227526 IP 64.12.26.124.5190 > 129.63.56.9.49607: tcp 135
16:28:32.227807 IP 206.16.21.31.80 > 129.63.56.33.51557: tcp 0
16:28:32.227952 IP 129.63.56.12.2950 > 89.142.48.135.17714: tcp 0
16:28:32.227955 IP 70.171.41.7.55555 > 129.63.27.12.2947: tcp 0
16:28:32.228052 IP 129.63.35.133.1339 > 12.202.123.81.7274: tcp 1460
16:28:32.228055 IP 129.63.27.152.49431 > 83.157.141.218.25966: tcp 1452
16:28:32.228057 IP 129.63.227.142.53054 > 66.216.26.124.80: tcp 0
16:28:32.228087 IP 8.12.96.24.80 > 129.63.28.69.49627: tcp 1460
16:28:32.228090 IP 8.12.96.24.80 > 129.63.28.69.49627: tcp 1460
16:28:32.228165 IP 129.63.27.152.49431 > 83.157.141.218.25966: tcp 1452
16:28:32.228168 IP 129.63.56.9.49607 > 64.12.26.124.5190: tcp 0
16:28:32.228203 IP 129.63.57.162.52312 > 72.21.202.37.80: tcp 0
16:28:32.228292 IP 129.63.27.152.49431 > 83.157.141.218.25966: tcp 1452
16:28:32.228329 IP 71.184.159.133.63026 > 129.63.30.63.64880: tcp 1448
16:28:32.228332 IP 129.63.1.24.443 > 68.160.151.218.50566: tcp 0
16:28:32.228412 IP 68.142.90.154.80 > 129.63.227.141.64924: tcp 1460
16:28:32.228414 IP 68.142.90.154.80 > 129.63.227.141.64924: tcp 1460
16:28:32.228417 IP 129.63.227.142.53054 > 66.216.26.124.80: tcp 0
16:28:32.228493 IP 129.63.151.80.1029 > 24.178.43.72.42589: tcp 1460
16:28:32.228589 IP 129.63.223.138.4956 > 218.61.9.24.80: tcp 0
16:28:32.228805 IP 74.72.205.81.8444 > 129.63.151.26.1840: tcp 1460
16:28:32.228807 IP 129.63.35.133.1339 > 12.202.123.81.7274: tcp 1460
16:28:32.228810 IP 129.63.96.102.2809 > 65.39.221.80.80: tcp 0
16:28:32.228886 IP 168.7.249.200.41848 > 129.63.34.60.54110: tcp 0
16:28:32.229081 IP 83.249.114.146.36833 > 129.63.57.175.34590: tcp 139
16:28:32.229166 IP 129.63.223.138.4956 > 218.61.9.24.80: tcp 0
16:28:32.229260 IP 77.74.131.155.21 > 129.63.57.175.36899: tcp 1448
16:28:32.229263 IP 70.79.75.139.22742 > 129.63.64.123.2672: tcp 0
16:28:32.229291 IP 129.63.36.117.56318 > 66.152.88.153.80: tcp 0
16:28:32.229371 IP 129.63.35.135.3737 > 67.84.225.180.22091: tcp 0
16:28:32.229465 IP 129.63.53.85.1947 > 64.12.24.141.443: tcp 10
16:28:32.229508 IP 157.157.183.84.55584 > 129.63.67.143.58462: tcp 1350
16:28:32.229628 IP 217.210.155.81.6881 > 129.63.151.26.1859: tcp 1300
16:28:32.229632 IP 129.63.223.138.4956 > 218.61.9.24.80: tcp 0
16:28:32.229647 IP 129.63.35.133.1339 > 12.202.123.81.7274: tcp 1460
16:28:32.229678 IP 129.63.137.96.2653 > 208.111.129.46.80: tcp 0
16:28:32.229932 IP 129.63.66.48.1789 > 66.150.193.111.80: tcp 0
16:28:32.230105 IP 209.170.113.9.80 > 129.63.163.30.4764: tcp 0
16:28:32.230224 IP 129.63.151.80.1029 > 24.178.43.72.42589: tcp 1460
16:28:32.230268 IP 222.114.52.78.19101 > 129.63.151.47.1077: tcp 1460
16:28:32.230368 IP 129.63.184.159.3176 > 209.191.106.109.80: tcp 1460
16:28:32.230371 IP 129.63.184.159.3176 > 209.191.106.109.80: tcp 444
16:28:32.230436 IP 129.63.8.83.64799 > 198.93.34.50.443: tcp 0
16:28:32.230471 IP 129.63.59.108.58852 > 67.176.174.86.11624: tcp 1460
16:28:32.230474 IP 129.63.63.166.63952 > 66.151.244.166.80: tcp 0
16:28:32.230699 IP 129.63.227.207.60209 > 80.67.87.118.80: tcp 0
16:28:32.230760 IP 85.17.132.20.80 > 129.63.166.138.1783: tcp 1460
16:28:32.230763 IP 85.17.132.20.80 > 129.63.166.138.1783: tcp 1460
16:28:32.230766 IP 129.63.28.69.49627 > 8.12.96.24.80: tcp 0
16:28:32.230837 IP 85.17.132.20.80 > 129.63.166.138.1783: tcp 1460
16:28:32.230840 IP 157.157.215.176.55666 > 129.63.57.175.41835: tcp 1338
16:28:32.230845 IP 129.63.166.129.4647 > 209.11.136.178.80: tcp 0
16:28:32.230857 IP 209.17.66.11.80 > 129.63.68.84.1678: tcp 1460
16:28:32.230876 IP 209.17.66.11.80 > 129.63.68.84.1678: tcp 1460
16:28:32.230910 IP 208.111.129.46.80 > 129.63.137.96.2653: tcp 1460
16:28:32.230939 IP 208.111.129.46.80 > 129.63.137.96.2653: tcp 1460
16:28:32.230976 IP 209.17.66.11.80 > 129.63.68.84.1678: tcp 1460
16:28:32.231010 IP 85.17.132.20.80 > 129.63.166.138.1783: tcp 1460
16:28:32.231014 IP 71.184.159.133.63026 > 129.63.30.63.64880: tcp 1448
16:28:32.231016 IP 74.134.46.121.6915 > 129.63.33.167.1578: tcp 133
16:28:32.231031 IP 85.17.132.20.80 > 129.63.166.138.1783: tcp 1460
16:28:32.231084 IP 129.63.57.162.52312 > 72.21.202.37.80: tcp 0
16:28:32.231241 IP 204.2.192.16.80 > 129.63.29.96.2837: tcp 1460
16:28:32.231245 IP 129.63.35.133.1339 > 12.202.123.81.7274: tcp 1460
16:28:32.231247 IP 204.2.192.16.80 > 129.63.29.96.2837: tcp 1460
16:28:32.231249 IP 204.2.192.16.80 > 129.63.29.96.2837: tcp 1354
16:28:32.231252 IP 24.63.144.63.1043 > 129.63.1.23.443: tcp 0
16:28:32.231396 IP 209.17.66.11.80 > 129.63.68.84.1678: tcp 1460
16:28:32.231443 IP 218.61.9.24.80 > 129.63.223.138.4956: tcp 1460
16:28:32.231446 IP 209.17.66.11.80 > 129.63.68.84.1678: tcp 1460
16:28:32.231449 IP 129.63.166.138.1783 > 85.17.132.20.80: tcp 0
16:28:32.231451 IP 218.61.9.24.80 > 129.63.223.138.4956: tcp 1460
16:28:32.231556 IP 64.111.215.8.80 > 129.63.178.8.64524: tcp 1448
16:28:32.231559 IP 8.12.96.24.80 > 129.63.28.69.49629: tcp 1460
16:28:32.231562 IP 64.111.215.8.80 > 129.63.178.8.64524: tcp 930
16:28:32.231564 IP 8.12.96.24.80 > 129.63.28.69.49629: tcp 1460
16:28:32.231566 IP 66.249.83.83.80 > 129.63.16.23.3708: tcp 0
16:28:32.231576 IP 66.249.83.83.80 > 129.63.16.23.3708: tcp 0
16:28:32.231626 IP 71.203.128.68.30779 > 129.63.57.175.57755: tcp 497
16:28:32.231662 IP 129.63.166.138.1783 > 85.17.132.20.80: tcp 0
16:28:32.231769 IP 129.63.30.63.64880 > 71.184.159.133.63026: tcp 0
16:28:32.231886 IP 129.63.151.80.1029 > 24.178.43.72.42589: tcp 1460
16:28:32.231940 IP 129.63.16.115.3149 > 128.2.207.24.80: tcp 449
16:28:32.232077 IP 129.63.59.108.58852 > 67.176.174.86.11624: tcp 1460
16:28:32.232080 IP 129.63.36.117.56318 > 66.152.88.153.80: tcp 0
16:28:32.232169 IP 129.63.227.141.64924 > 68.142.90.154.80: tcp 0
16:28:32.232172 IP 149.166.112.192.57561 > 129.63.153.203.27569: tcp 0
16:28:32.232246 IP 129.63.68.84.1678 > 209.17.66.11.80: tcp 0
16:28:32.232249 IP 129.63.68.84.1678 > 209.17.66.11.80: tcp 0
16:28:32.232350 IP 85.81.48.138.55000 > 129.63.57.175.35822: tcp 1448
16:28:32.232392 IP 62.85.5.142.55455 > 129.63.57.175.45241: tcp 1448
16:28:32.232412 IP 62.85.5.142.55455 > 129.63.57.175.45241: tcp 1448
16:28:32.232548 IP 129.63.49.202.2126 > 146.189.117.246.443: tcp 40
16:28:32.232618 IP 129.63.68.84.1678 > 209.17.66.11.80: tcp 0
16:28:32.232666 IP 70.171.41.7.55555 > 129.63.27.12.2947: tcp 0
16:28:32.232686 IP 129.63.223.138.4956 > 218.61.9.24.80: tcp 0
16:28:32.232919 IP 64.233.169.103.80 > 129.63.171.147.3472: tcp 1430
16:28:32.232983 IP 129.63.35.133.1339 > 12.202.123.81.7274: tcp 1460
16:28:32.232988 IP 64.233.169.103.80 > 129.63.171.147.3472: tcp 1430
16:28:32.233002 IP 64.233.169.103.80 > 129.63.171.147.3472: tcp 1430
16:28:32.233177 IP 129.63.64.178.2541 > 69.28.153.108.27030: tcp 0
16:28:32.233197 IP 129.63.223.138.4956 > 218.61.9.24.80: tcp 0
16:28:32.233347 IP 71.184.159.133.63026 > 129.63.30.63.64880: tcp 1448
16:28:32.233425 IP 38.99.76.220.80 > 129.63.68.84.1707: tcp 1460
16:28:32.233459 IP 206.18.177.53.42766 > 129.63.1.37.25: tcp 1448
16:28:32.233462 IP 129.63.28.69.49629 > 8.12.96.24.80: tcp 0
16:28:32.233479 IP 66.216.26.124.80 > 129.63.227.142.53057: tcp 1460
16:28:32.233530 IP 38.99.76.220.80 > 129.63.68.84.1707: tcp 1460
16:28:32.233598 IP 66.216.26.124.80 > 129.63.227.142.53057: tcp 1460
16:28:32.233651 IP 204.2.192.14.80 > 129.63.29.96.2819: tcp 1460
16:28:32.233654 IP 204.2.192.14.80 > 129.63.29.96.2819: tcp 1460
16:28:32.233657 IP 204.2.192.14.80 > 129.63.29.96.2819: tcp 930
16:28:32.233659 IP 38.99.76.220.80 > 129.63.68.84.1707: tcp 1460
16:28:32.233692 IP 64.233.169.103.80 > 129.63.171.147.3472: tcp 1430
16:28:32.233695 IP 76.109.8.185.20295 > 129.63.58.53.1343: tcp 225
16:28:32.233760 IP 129.63.151.80.1029 > 24.178.43.72.42589: tcp 1460
16:28:32.233763 IP 129.63.59.108.58852 > 67.176.174.86.11624: tcp 1460
16:28:32.233768 IP 129.63.57.40.34694 > 66.29.81.115.80: tcp 0
16:28:32.233780 IP 38.99.76.220.80 > 129.63.68.84.1707: tcp 1460
16:28:32.233907 IP 38.99.76.220.80 > 129.63.68.84.1707: tcp 1460
16:28:32.233911 IP 129.63.166.129.4649 > 12.182.252.65.80: tcp 0
16:28:32.234064 IP 222.114.52.78.19101 > 129.63.151.47.1077: tcp 1460
16:28:32.234067 IP 38.99.76.220.80 > 129.63.68.84.1707: tcp 1460
16:28:32.234069 IP 64.233.169.103.80 > 129.63.171.147.3472: tcp 1430
16:28:32.234072 IP 8.3.209.233.80 > 129.63.56.9.49730: tcp 1448
16:28:32.234092 IP 8.3.209.233.80 > 129.63.56.9.49730: tcp 1448
16:28:32.234095 IP 129.63.166.129.4648 > 12.182.252.65.80: tcp 0
16:28:32.234097 IP 64.233.169.103.80 > 129.63.171.147.3472: tcp 1430
16:28:32.234100 IP 208.53.158.11.80 > 129.63.65.179.1828: tcp 730
16:28:32.234102 IP 208.53.158.11.80 > 129.63.65.179.1828: tcp 730
16:28:32.234145 IP 38.99.76.220.80 > 129.63.68.84.1707: tcp 1460
16:28:32.234148 IP 129.63.171.147.3472 > 64.233.169.103.80: tcp 0
16:28:32.234150 IP 208.53.158.11.80 > 129.63.65.179.1828: tcp 730
16:28:32.234180 IP 129.63.96.117.80 > 121.16.200.98.16411: tcp 1440
16:28:32.234183 IP 129.63.96.117.80 > 121.16.200.98.16411: tcp 1440
16:28:32.234185 IP 129.63.96.117.80 > 121.16.200.98.16411: tcp 381
16:28:32.234200 IP 218.61.9.24.80 > 129.63.223.138.4956: tcp 1460
16:28:32.234245 IP 218.61.9.24.80 > 129.63.223.138.4956: tcp 1460
16:28:32.234248 IP 38.99.76.220.80 > 129.63.68.84.1707: tcp 1460
16:28:32.234250 IP 123.220.54.154.50392 > 129.63.29.11.24240: tcp 0
16:28:32.234299 IP 8.3.209.233.80 > 129.63.56.9.49730: tcp 1448
16:28:32.234347 IP 8.3.209.233.80 > 129.63.56.9.49730: tcp 1448
16:28:32.234407 IP 24.232.133.165.16631 > 129.63.70.157.52638: tcp 1460
16:28:32.234409 IP 212.235.171.5.26534 > 129.63.57.175.44118: tcp 5
16:28:32.234412 IP 81.190.233.57.22222 > 129.63.29.11.2737: tcp 0
16:28:32.234445 IP 129.63.153.203.27569 > 149.166.112.192.57561: tcp 1460
16:28:32.234500 IP 129.63.35.133.1339 > 12.202.123.81.7274: tcp 1460
16:28:32.234614 IP 69.63.176.16.80 > 129.63.54.160.4230: tcp 1460
16:28:32.234617 IP 157.157.215.176.55666 > 129.63.57.175.41835: tcp 244
16:28:32.234729 IP 129.63.68.84.1707 > 38.99.76.220.80: tcp 0
16:28:32.234838 IP 209.17.66.11.80 > 129.63.68.84.1677: tcp 1460
16:28:32.234841 IP 209.17.66.11.80 > 129.63.68.84.1677: tcp 1460
16:28:32.234843 IP 76.237.96.120.37782 > 129.63.56.78.63124: tcp 23
16:28:32.234877 IP 129.63.65.179.1828 > 208.53.158.11.80: tcp 0
16:28:32.234880 IP 129.63.36.117.56318 > 66.152.88.153.80: tcp 0
16:28:32.234956 IP 116.37.163.131.9913 > 129.63.203.43.2392: tcp 1460
16:28:32.234960 IP 77.247.176.134.80 > 129.63.66.50.53536: tcp 0
16:28:32.234997 IP 24.6.124.108.41614 > 129.63.66.169.3342: tcp 1460
16:28:32.235000 IP 208.53.158.11.80 > 129.63.65.179.1828: tcp 730
16:28:32.235003 IP 208.53.158.11.80 > 129.63.65.179.1828: tcp 730
16:28:32.235005 IP 208.53.158.11.80 > 129.63.65.179.1828: tcp 730
16:28:32.235017 IP 209.17.66.11.80 > 129.63.68.84.1677: tcp 1460
16:28:32.235037 IP 209.17.66.11.80 > 129.63.68.84.1677: tcp 1460
16:28:32.235176 IP 129.63.68.84.1707 > 38.99.76.220.80: tcp 0
16:28:32.235246 IP 129.63.56.9.49730 > 8.3.209.233.80: tcp 0
16:28:32.235249 IP 129.63.223.138.4884 > 125.65.45.37.80: tcp 0
16:28:32.235288 IP 129.63.54.168.3243 > 72.190.82.164.30617: tcp 0
16:28:32.235355 IP 129.63.54.168.4052 > 76.26.9.250.24318: tcp 0
16:28:32.235358 IP 129.63.54.168.2769 > 24.7.12.48.9829: tcp 0
16:28:32.235469 IP 129.63.151.80.1029 > 24.178.43.72.42589: tcp 1460
16:28:32.235524 IP 129.63.35.133.1339 > 12.202.123.81.7274: tcp 1460
16:28:32.235527 IP 129.63.55.9.3637 > 24.128.171.199.34730: tcp 0
16:28:32.235600 IP 8.3.209.233.80 > 129.63.56.9.49730: tcp 1448
16:28:32.235632 IP 8.3.209.233.80 > 129.63.56.9.49730: tcp 1448
16:28:32.235638 IP 129.63.65.179.1828 > 208.53.158.11.80: tcp 0
16:28:32.235689 IP 129.63.68.84.1677 > 209.17.66.11.80: tcp 0
16:28:32.235786 IP 208.65.153.72.80 > 129.63.52.111.1664: tcp 1460
16:28:32.235789 IP 129.63.223.138.4956 > 218.61.9.24.80: tcp 0
16:28:32.235830 IP 208.65.153.72.80 > 129.63.52.111.1664: tcp 1460
16:28:32.235833 IP 208.65.153.72.80 > 129.63.52.111.1664: tcp 1460
16:28:32.235907 IP 66.216.26.124.80 > 129.63.227.142.53054: tcp 1460
16:28:32.235937 IP 71.184.159.133.63026 > 129.63.30.63.64880: tcp 1448
16:28:32.236002 IP 209.17.66.11.80 > 129.63.68.84.1678: tcp 1250
16:28:32.236084 IP 66.216.26.124.80 > 129.63.227.142.53054: tcp 1460
16:28:32.236088 IP 129.63.171.147.3472 > 64.233.169.103.80: tcp 0
16:28:32.236162 IP 129.63.65.179.1828 > 208.53.158.11.80: tcp 0
16:28:32.236203 IP 129.63.27.12.1349 > 84.42.159.99.20556: tcp 0
16:28:32.236206 IP 129.63.68.84.1677 > 209.17.66.11.80: tcp 0
16:28:32.236252 IP 208.65.153.72.80 > 129.63.52.111.1664: tcp 1460
16:28:32.236255 IP 129.63.137.96.2653 > 208.111.129.46.80: tcp 0
16:28:32.236258 IP 208.65.153.72.80 > 129.63.52.111.1664: tcp 1460
16:28:32.236272 IP 208.65.153.72.80 > 129.63.52.111.1664: tcp 1460
16:28:32.236316 IP 208.65.153.72.80 > 129.63.52.111.1664: tcp 1460
16:28:32.236319 IP 129.63.59.108.58852 > 67.176.174.86.11624: tcp 1460
16:28:32.236321 IP 208.65.153.72.80 > 129.63.52.111.1664: tcp 1460
16:28:32.236507 IP 208.65.153.72.80 > 129.63.52.111.1664: tcp 1460
16:28:32.236511 IP 69.117.190.97.23800 > 129.63.57.175.48837: tcp 0
16:28:32.236528 IP 208.65.153.72.80 > 129.63.52.111.1664: tcp 1460
16:28:32.236531 IP 216.52.148.4.12550 > 129.63.222.55.50726: tcp 35
16:28:32.236535 IP 99.244.109.213.10429 > 129.63.54.49.4717: tcp 181
16:28:32.236650 IP 8.3.209.233.80 > 129.63.56.9.49730: tcp 1448
16:28:32.236653 IP 129.63.30.63.64880 > 71.184.159.133.63026: tcp 0
16:28:32.236674 IP 8.3.209.233.80 > 129.63.56.9.49730: tcp 1448
16:28:32.236677 IP 129.63.52.111.1664 > 208.65.153.72.80: tcp 0
16:28:32.236710 IP 8.3.209.233.80 > 129.63.56.9.49730: tcp 1448
16:28:32.236714 IP 74.136.32.222.21997 > 129.63.54.49.2072: tcp 149
16:28:32.236716 IP 8.3.209.233.80 > 129.63.56.9.49730: tcp 1448
16:28:32.236843 IP 208.111.160.107.80 > 129.63.62.53.57782: tcp 1460
16:28:32.236846 IP 129.63.56.9.49730 > 8.3.209.233.80: tcp 0
16:28:32.236933 IP 208.111.160.107.80 > 129.63.62.53.57782: tcp 1460
16:28:32.236936 IP 208.111.160.107.80 > 129.63.62.53.57782: tcp 1460
16:28:32.236939 IP 208.65.153.72.80 > 129.63.52.111.1664: tcp 1460
16:28:32.236941 IP 129.63.52.111.1664 > 208.65.153.72.80: tcp 0
16:28:32.236944 IP 208.111.160.107.80 > 129.63.62.53.57782: tcp 1460
16:28:32.236986 IP 208.111.160.107.80 > 129.63.62.53.57782: tcp 1460
16:28:32.236989 IP 208.65.153.72.80 > 129.63.52.111.1664: tcp 1460
16:28:32.237080 IP 129.63.1.23.443 > 24.63.144.63.1043: tcp 1262
16:28:32.237083 IP 129.63.59.108.58852 > 67.176.174.86.11624: tcp 1460
16:28:32.237086 IP 129.63.68.84.1678 > 209.17.66.11.80: tcp 0
16:28:32.237162 IP 129.63.203.43.2392 > 116.37.163.131.9913: tcp 0
16:28:32.237165 IP 129.63.203.43.2392 > 116.37.163.131.9913: tcp 0
16:28:32.237167 IP 129.63.52.111.1664 > 208.65.153.72.80: tcp 0
16:28:32.237200 IP 158.142.163.113.17874 > 129.63.59.165.53181: tcp 1288
16:28:32.237250 IP 208.65.153.72.80 > 129.63.52.111.1664: tcp 1460
16:28:32.237269 IP 208.65.153.72.80 > 129.63.52.111.1664: tcp 1460
16:28:32.237348 IP 208.111.129.46.80 > 129.63.137.96.2653: tcp 1460
16:28:32.237351 IP 129.63.151.80.1029 > 24.178.43.72.42589: tcp 1460
16:28:32.237353 IP 208.111.129.46.80 > 129.63.137.96.2653: tcp 1460
16:28:32.237432 IP 208.65.153.72.80 > 129.63.52.111.1664: tcp 1460
16:28:32.237435 IP 208.65.153.72.80 > 129.63.52.111.1664: tcp 1460
16:28:32.237438 IP 87.223.185.240.6669 > 129.63.65.74.60386: tcp 0
16:28:32.237440 IP 129.63.184.159.2764 > 69.147.112.182.5050: tcp 0
16:28:32.237443 IP 129.63.52.111.1664 > 208.65.153.72.80: tcp 0
16:28:32.237552 IP 129.63.178.8.64524 > 64.111.215.8.80: tcp 0
16:28:32.237606 IP 72.166.185.154.80 > 129.63.69.48.1347: tcp 1460
16:28:32.237655 IP 72.166.185.154.80 > 129.63.69.48.1347: tcp 1460
16:28:32.237658 IP 72.166.185.154.80 > 129.63.69.48.1347: tcp 1460
16:28:32.237677 IP 129.63.52.111.1664 > 208.65.153.72.80: tcp 0
16:28:32.237765 IP 8.3.209.233.80 > 129.63.56.9.49730: tcp 1448
16:28:32.237768 IP 129.63.56.9.49730 > 8.3.209.233.80: tcp 0
16:28:32.237770 IP 129.63.173.205.2052 > 129.18.32.255.139: tcp 0
16:28:32.237818 IP 8.3.209.233.80 > 129.63.56.9.49730: tcp 1448
16:28:32.237822 IP 99.245.48.126.44759 > 129.63.67.121.61490: tcp 85
16:28:32.237824 IP 72.14.205.147.80 > 129.63.61.40.56035: tcp 0
16:28:32.237861 IP 222.114.52.78.19101 > 129.63.151.47.1077: tcp 1460
16:28:32.237867 IP 80.67.87.31.80 > 129.63.141.138.2919: tcp 0
16:28:32.237958 IP 129.63.59.108.58852 > 67.176.174.86.11624: tcp 1460
16:28:32.237960 IP 129.63.52.111.1664 > 208.65.153.72.80: tcp 0
16:28:32.238012 IP 82.37.232.162.25262 > 129.63.59.108.58603: tcp 0
16:28:32.238015 IP 24.187.34.227.11567 > 129.63.66.50.53318: tcp 0
16:28:32.238184 IP 129.63.52.111.1664 > 208.65.153.72.80: tcp 0
16:28:32.238247 IP 8.12.96.24.80 > 129.63.28.69.49627: tcp 1460
16:28:32.238250 IP 129.63.28.90.50627 > 69.204.195.21.33596: tcp 0
16:28:32.238289 IP 8.12.96.24.80 > 129.63.28.69.49627: tcp 1460
16:28:32.238292 IP 213.248.116.101.80 > 129.63.56.170.4266: tcp 0
16:28:32.238319 IP 129.63.171.147.3472 > 64.233.169.103.80: tcp 0
16:28:32.238391 IP 129.63.52.111.1664 > 208.65.153.72.80: tcp 0
16:28:32.238424 IP 71.184.159.133.63026 > 129.63.30.63.64880: tcp 1448
16:28:32.238505 IP 129.63.53.132.51200 > 216.35.19.150.80: tcp 0
16:28:32.238613 IP 129.63.53.132.51200 > 216.35.19.150.80: tcp 0
16:28:32.238616 IP 129.63.69.48.1347 > 72.166.185.154.80: tcp 0
16:28:32.238619 IP 129.63.56.9.49730 > 8.3.209.233.80: tcp 0
16:28:32.238621 IP 129.63.62.53.57782 > 208.111.160.107.80: tcp 0
16:28:32.238731 IP 70.162.248.237.51918 > 129.63.69.75.63669: tcp 149
16:28:32.238790 IP 129.63.59.108.58852 > 67.176.174.86.11624: tcp 1460
16:28:32.238793 IP 146.189.117.246.443 > 129.63.49.202.2126: tcp 0
16:28:32.238853 IP 129.63.33.167.4380 > 72.38.214.133.3724: tcp 1460
16:28:32.238989 IP 129.63.151.80.1029 > 24.178.43.72.42589: tcp 1460
16:28:32.239018 IP 129.63.36.117.56318 > 66.152.88.153.80: tcp 0
16:28:32.239260 IP 38.116.147.101.80 > 129.63.16.48.60654: tcp 1460
16:28:32.239263 IP 38.116.147.101.80 > 129.63.16.48.60654: tcp 1460
16:28:32.239265 IP 38.116.147.101.80 > 129.63.16.48.60654: tcp 1460
16:28:32.239268 IP 38.116.147.101.80 > 129.63.16.48.60654: tcp 369
16:28:32.239270 IP 129.63.68.84.1678 > 209.17.66.11.80: tcp 484
16:28:32.239524 IP 129.63.222.55.50726 > 216.52.148.4.12550: tcp 0
16:28:32.239563 IP 129.63.56.78.63125 > 75.11.172.6.31767: tcp 0
16:28:32.239618 IP 129.63.59.108.58852 > 67.176.174.86.11624: tcp 1460
16:28:32.239673 IP 209.17.66.11.80 > 129.63.68.84.1677: tcp 1460
16:28:32.239809 IP 68.142.90.154.80 > 129.63.227.141.64924: tcp 1460
16:28:32.239812 IP 218.34.5.147.2731 > 129.63.96.117.80: tcp 1456
16:28:32.239814 IP 87.223.185.240.6669 > 129.63.65.74.60386: tcp 0
16:28:32.239829 IP 68.142.90.154.80 > 129.63.227.141.64924: tcp 1460
16:28:32.239854 IP 68.142.90.154.80 > 129.63.227.141.64924: tcp 1460
16:28:32.239858 IP 129.63.33.19.1180 > 206.16.23.113.3724: tcp 34
16:28:32.239904 IP 68.142.90.154.80 > 129.63.227.141.64924: tcp 1460
16:28:32.239907 IP 209.17.66.11.80 > 129.63.68.84.1677: tcp 1460
16:28:32.239909 IP 212.48.110.68.8045 > 129.63.140.83.54932: tcp 1448
16:28:32.239912 IP 209.17.66.11.80 > 129.63.68.84.1677: tcp 1460
16:28:32.239914 IP 129.63.53.109.2385 > 205.188.248.154.5190: tcp 6
16:28:32.239949 IP 212.48.110.68.8045 > 129.63.140.83.54932: tcp 1448
16:28:32.239953 IP 208.53.158.11.80 > 129.63.65.179.1828: tcp 730
16:28:32.239955 IP 60.242.100.160.65432 > 129.63.29.118.1336: tcp 640
16:28:32.239958 IP 208.53.158.11.80 > 129.63.65.179.1828: tcp 730
16:28:32.239960 IP 208.53.158.11.80 > 129.63.65.179.1828: tcp 730
16:28:32.239981 IP 209.170.113.9.80 > 129.63.163.30.4764: tcp 905
16:28:32.240212 IP 209.17.66.11.80 > 129.63.68.84.1677: tcp 1451
16:28:32.240215 IP 206.16.23.78.3724 > 129.63.222.198.1539: tcp 0
16:28:32.240218 IP 206.16.23.78.3724 > 129.63.222.198.1539: tcp 46
16:28:32.240350 IP 129.63.70.157.54057 > 76.16.210.115.41881: tcp 17
16:28:32.240452 IP 129.63.59.108.58852 > 67.176.174.86.11624: tcp 1460
16:28:32.240680 IP 129.63.65.179.1828 > 208.53.158.11.80: tcp 0
16:28:32.240727 IP 8.12.96.24.80 > 129.63.28.69.49629: tcp 1460
16:28:32.240747 IP 8.12.96.24.80 > 129.63.28.69.49629: tcp 1460
16:28:32.240782 IP 129.63.151.80.1029 > 24.178.43.72.42589: tcp 1460
16:28:32.240879 IP 129.63.29.96.2837 > 204.2.192.16.80: tcp 0
16:28:32.241037 IP 71.184.159.133.63026 > 129.63.30.63.64880: tcp 1448
16:28:32.241040 IP 24.178.43.72.42589 > 129.63.151.80.1029: tcp 0
16:28:32.241066 IP 129.63.28.69.49627 > 8.12.96.24.80: tcp 0
16:28:32.241221 IP 129.63.57.175.49815 > 204.111.134.85.40025: tcp 1448
16:28:32.241396 IP 24.6.124.108.41614 > 129.63.66.169.3342: tcp 1460
16:28:32.241477 IP 222.114.52.78.19101 > 129.63.151.47.1077: tcp 1460
16:28:32.241522 IP 12.182.252.65.80 > 129.63.166.129.4649: tcp 0
16:28:32.241608 IP 129.63.29.96.2837 > 204.2.192.16.80: tcp 639
16:28:32.241612 IP 12.182.252.65.80 > 129.63.166.129.4648: tcp 0
16:28:32.241614 IP 72.21.202.37.80 > 129.63.57.162.52313: tcp 0
16:28:32.241723 IP 66.216.26.124.80 > 129.63.227.142.53057: tcp 1460
16:28:32.241727 IP 76.30.151.246.54289 > 129.63.151.26.1651: tcp 78
16:28:32.241755 IP 129.63.30.63.64880 > 71.184.159.133.63026: tcp 0
16:28:32.241856 IP 66.216.26.124.80 > 129.63.227.142.53057: tcp 1460
16:28:32.241859 IP 129.63.36.117.56318 > 66.152.88.153.80: tcp 0
16:28:32.241861 IP 129.63.166.129.4649 > 12.182.252.65.80: tcp 0
16:28:32.241864 IP 129.63.166.129.4648 > 12.182.252.65.80: tcp 0
16:28:32.242028 IP 24.60.224.6.4359 > 129.63.8.53.22: tcp 52
16:28:32.242032 IP 129.63.27.12.3779 > 70.181.203.243.62893: tcp 0
16:28:32.242034 IP 129.63.57.175.39583 > 82.158.38.1.50032: tcp 0
16:28:32.242119 IP 129.63.27.163.3266 > 68.151.65.187.12010: tcp 1456
16:28:32.242122 IP 129.63.166.129.4649 > 12.182.252.65.80: tcp 429
16:28:32.242241 IP 129.63.166.129.4648 > 12.182.252.65.80: tcp 430
16:28:32.242472 IP 76.105.112.143.22429 > 129.63.54.49.4386: tcp 133
16:28:32.242574 IP 129.63.151.80.1029 > 24.178.43.72.42589: tcp 1460
16:28:32.242577 IP 129.63.8.53.22 > 24.60.224.6.4359: tcp 52
16:28:32.242664 IP 129.63.68.84.1677 > 209.17.66.11.80: tcp 0
16:28:32.242729 IP 206.16.21.31.80 > 129.63.29.96.3936: tcp 0
16:28:32.242732 IP 129.63.29.96.2819 > 204.2.192.14.80: tcp 0
16:28:32.242769 IP 152.2.66.69.20567 > 129.63.141.92.4264: tcp 14
16:28:32.242799 IP 129.63.16.48.60654 > 38.116.147.101.80: tcp 0
16:28:32.242889 IP 80.67.87.118.80 > 129.63.227.207.60209: tcp 1460
16:28:32.242909 IP 80.67.87.118.80 > 129.63.227.207.60209: tcp 1460
16:28:32.242913 IP 218.34.5.147.2731 > 129.63.96.117.80: tcp 80
16:28:32.242948 IP 129.63.27.163.3266 > 68.151.65.187.12010: tcp 1456
16:28:32.243054 IP 66.102.1.164.80 > 129.63.56.75.1111: tcp 1119
16:28:32.243058 IP 213.239.192.46.80 > 129.63.115.154.1868: tcp 0
16:28:32.243305 IP 71.184.159.133.63026 > 129.63.30.63.64880: tcp 1448
16:28:32.243382 IP 129.63.115.154.1868 > 213.239.192.46.80: tcp 0
16:28:32.243578 IP 129.63.115.154.1868 > 213.239.192.46.80: tcp 255
16:28:32.243641 IP 208.111.129.46.80 > 129.63.137.96.2653: tcp 1460
16:28:32.243661 IP 208.111.129.46.80 > 129.63.137.96.2653: tcp 1460
16:28:32.243711 IP 218.61.9.24.80 > 129.63.223.138.4956: tcp 1460
16:28:32.243731 IP 218.61.9.24.80 > 129.63.223.138.4956: tcp 1460
16:28:32.243734 IP 24.186.86.35.35634 > 129.63.56.66.55359: tcp 0
16:28:32.243928 IP 129.63.37.100.3862 > 86.125.48.41.22839: tcp 0
16:28:32.243931 IP 129.63.28.69.49629 > 8.12.96.24.80: tcp 0
16:28:32.243954 IP 129.63.27.163.3266 > 68.151.65.187.12010: tcp 587
16:28:32.243958 IP 129.63.16.48.60654 > 38.116.147.101.80: tcp 0
16:28:32.244085 IP 24.214.120.30.28564 > 129.63.59.165.53189: tcp 1448
16:28:32.244194 IP 129.63.203.43.2391 > 220.67.124.116.9915: tcp 0
16:28:32.244229 IP 129.63.27.163.3266 > 68.151.65.187.12010: tcp 1456
16:28:32.244258 IP 129.63.141.47.62169 > 65.93.15.187.45765: tcp 0
16:28:32.244347 IP 129.63.68.84.1677 > 209.17.66.11.80: tcp 487
16:28:32.244469 IP 129.63.153.203.27569 > 149.166.112.192.57561: tcp 1460
16:28:32.244472 IP 129.63.96.117.80 > 218.34.5.147.2731: tcp 0
16:28:32.244539 IP 24.126.7.126.16776 > 129.63.27.12.4253: tcp 508
16:28:32.244750 IP 129.63.151.80.1029 > 24.178.43.72.42589: tcp 1460
16:28:32.244777 IP 129.63.36.117.56318 > 66.152.88.153.80: tcp 0
16:28:32.244910 IP 222.114.52.78.19101 > 129.63.151.47.1077: tcp 1460
16:28:32.244913 IP 24.63.144.63.1042 > 129.63.1.23.443: tcp 599
16:28:32.244916 IP 63.210.246.222.8129 > 129.63.58.84.1932: tcp 591
16:28:32.244918 IP 163.11.83.10.80 > 129.63.172.53.2400: tcp 0
16:28:32.245020 IP 129.63.27.163.3266 > 68.151.65.187.12010: tcp 125
16:28:32.245023 IP 129.63.57.40.56866 > 142.163.71.135.39740: tcp 0
16:28:32.245188 IP 129.63.65.54.1756 > 72.186.67.235.44088: tcp 1460
16:28:32.245219 IP 75.126.246.4.80 > 129.63.223.119.4205: tcp 1460
16:28:32.245222 IP 24.178.43.72.42589 > 129.63.151.80.1029: tcp 20
16:28:32.245272 IP 129.63.64.178.2541 > 69.28.153.108.27030: tcp 0
16:28:32.245300 IP 129.63.172.53.2400 > 163.11.83.10.80: tcp 0
16:28:32.245370 IP 75.126.246.4.80 > 129.63.223.119.4205: tcp 1460
16:28:32.245373 IP 204.111.134.85.40025 > 129.63.57.175.49815: tcp 0
16:28:32.245376 IP 129.63.29.96.3936 > 206.16.21.31.80: tcp 0
16:28:32.245426 IP 83.157.141.218.25966 > 129.63.27.152.49431: tcp 0
16:28:32.245429 IP 129.63.223.138.4956 > 218.61.9.24.80: tcp 0
16:28:32.245453 IP 59.92.36.230.3231 > 129.63.51.91.1322: tcp 0
16:28:32.245515 IP 129.63.172.53.2400 > 163.11.83.10.80: tcp 640
16:28:32.245593 IP 129.63.58.84.1932 > 63.210.246.222.8129: tcp 0
16:28:32.245870 IP 68.150.150.106.26079 > 129.63.71.37.2938: tcp 1460
16:28:32.245873 IP 129.63.137.96.2653 > 208.111.129.46.80: tcp 0
16:28:32.245913 IP 71.184.159.133.63026 > 129.63.30.63.64880: tcp 1448
16:28:32.245916 IP 129.63.27.127.4043 > 71.199.240.201.43918: tcp 0
16:28:32.246020 IP 129.63.55.18.4659 > 84.43.95.167.8972: tcp 1460
16:28:32.246169 IP 116.37.163.131.9913 > 129.63.203.43.2392: tcp 1460
16:28:32.246173 IP 142.162.63.172.25986 > 129.63.65.54.4830: tcp 0
16:28:32.246239 IP 72.14.205.147.80 > 129.63.61.40.56035: tcp 728
16:28:32.246389 IP 116.37.163.131.9913 > 129.63.203.43.2392: tcp 1460
16:28:32.246391 IP 72.14.205.147.80 > 129.63.61.40.56035: tcp 728
16:28:32.246494 IP 125.90.207.4.80 > 129.63.70.86.1265: tcp 1460
16:28:32.246531 IP 125.90.207.4.80 > 129.63.70.86.1265: tcp 1460
16:28:32.246534 IP 125.90.207.4.80 > 129.63.70.86.1265: tcp 1460
16:28:32.246536 IP 82.37.232.162.25262 > 129.63.59.108.58603: tcp 0
16:28:32.246559 IP 129.63.151.80.2367 > 88.104.21.244.60515: tcp 0
16:28:32.246616 IP 129.63.151.80.1029 > 24.178.43.72.42589: tcp 1460
16:28:32.246686 IP 129.63.30.63.64880 > 71.184.159.133.63026: tcp 0
16:28:32.246729 IP 24.214.120.30.28564 > 129.63.59.165.53189: tcp 1448
16:28:32.246768 IP 129.63.151.80.2368 > 88.2.250.130.13276: tcp 0
16:28:32.246812 IP 129.63.66.169.3789 > 24.23.50.123.51425: tcp 0
16:28:32.246818 IP 129.63.27.12.4257 > 209.161.239.30.13100: tcp 0
16:28:32.246852 IP 24.63.144.63.1043 > 129.63.1.23.443: tcp 0
16:28:32.246950 IP 72.197.246.58.34749 > 129.63.54.49.1038: tcp 0
16:28:32.246953 IP 129.63.151.80.2369 > 70.172.192.171.47982: tcp 0
16:28:32.246980 IP 129.63.70.157.52638 > 24.232.133.165.16631: tcp 1460
16:28:32.247271 IP 129.63.70.86.1265 > 125.90.207.4.80: tcp 0
16:28:32.247350 IP 129.63.227.207.60209 > 80.67.87.118.80: tcp 0
16:28:32.247408 IP 216.178.36.90.80 > 129.63.57.172.63286: tcp 730
16:28:32.247411 IP 216.178.36.90.80 > 129.63.57.172.63286: tcp 730
16:28:32.247413 IP 216.178.36.90.80 > 129.63.57.172.63286: tcp 730
16:28:32.247465 IP 129.63.70.86.1265 > 125.90.207.4.80: tcp 0
16:28:32.247698 IP 201.1.3.150.49235 > 129.63.65.74.61835: tcp 1452
16:28:32.247748 IP 129.63.70.157.52638 > 24.232.133.165.16631: tcp 1460
16:28:32.247751 IP 129.63.36.117.56318 > 66.152.88.153.80: tcp 0
16:28:32.247956 IP 71.59.67.125.2819 > 129.63.71.80.3366: tcp 623
16:28:32.247959 IP 90.229.167.180.59612 > 129.63.57.175.40349: tcp 463
16:28:32.248006 IP 129.63.223.119.4205 > 75.126.246.4.80: tcp 0
16:28:32.248179 IP 8.3.209.233.80 > 129.63.56.9.49730: tcp 1448
16:28:32.248182 IP 74.72.205.81.8444 > 129.63.151.26.1840: tcp 1460
16:28:32.248184 IP 87.194.192.47.9090 > 129.63.71.37.1822: tcp 0
16:28:32.248187 IP 8.3.209.233.80 > 129.63.56.9.49730: tcp 1448
16:28:32.248189 IP 129.63.227.207.60209 > 80.67.87.118.80: tcp 0
16:28:32.248217 IP 8.3.209.233.80 > 129.63.56.9.49730: tcp 1448
16:28:32.248279 IP 8.3.209.233.80 > 129.63.56.9.49730: tcp 1448
16:28:32.248282 IP 8.3.209.233.80 > 129.63.56.9.49730: tcp 1448
16:28:32.248284 IP 71.184.159.133.63026 > 129.63.30.63.64880: tcp 1448
16:28:32.248300 IP 8.12.96.24.80 > 129.63.28.69.49627: tcp 1460
16:28:32.248320 IP 8.12.96.24.80 > 129.63.28.69.49627: tcp 1460
16:28:32.248414 IP 129.63.151.80.2370 > 84.71.254.105.2882: tcp 0
16:28:32.248479 IP 222.114.52.78.19101 > 129.63.151.47.1077: tcp 1460
16:28:32.248532 IP 129.63.151.26.1621 > 71.230.167.44.8700: tcp 0
16:28:32.248535 IP 129.63.203.43.2391 > 220.67.124.116.9915: tcp 0
16:28:32.248537 IP 129.63.216.93.49608 > 58.177.180.175.23408: tcp 0
16:28:32.248540 IP 129.63.216.93.49608 > 58.177.180.175.23408: tcp 0
16:28:32.248542 IP 129.63.151.26.1621 > 71.230.167.44.8700: tcp 0
16:28:32.248584 IP 129.63.70.157.52638 > 24.232.133.165.16631: tcp 1460
16:28:32.248587 IP 129.63.223.119.4205 > 75.126.246.4.80: tcp 0
16:28:32.248590 IP 129.63.117.71.3091 > 69.147.112.160.443: tcp 0
16:28:32.248665 IP 142.162.63.172.25986 > 129.63.65.54.4830: tcp 0
16:28:32.248734 IP 129.63.96.117.80 > 222.45.168.185.16159: tcp 1440
16:28:32.248848 IP 8.3.209.233.80 > 129.63.56.9.49730: tcp 1448
16:28:32.248874 IP 8.3.209.233.80 > 129.63.56.9.49730: tcp 1448
16:28:32.248877 IP 61.231.184.245.9927 > 129.63.27.163.3672: tcp 0
16:28:32.248894 IP 8.3.209.233.80 > 129.63.56.9.49730: tcp 1448
16:28:32.249045 IP 8.3.209.233.80 > 129.63.56.9.49730: tcp 1448
16:28:32.249102 IP 8.3.209.233.80 > 129.63.56.9.49730: tcp 1448
16:28:32.249104 IP 8.3.209.233.80 > 129.63.56.9.49730: tcp 1448
16:28:32.249107 IP 8.3.209.233.80 > 129.63.56.9.49730: tcp 1448
16:28:32.249124 IP 129.63.152.55.3974 > 129.63.35.252.22: tcp 0
16:28:32.249181 IP 208.111.128.80.80 > 129.63.57.49.51805: tcp 1460
16:28:32.249230 IP 208.111.128.80.80 > 129.63.57.49.51805: tcp 1460
16:28:32.249233 IP 129.63.152.55.3974 > 129.63.35.252.22: tcp 0
16:28:32.249236 IP 208.111.128.80.80 > 129.63.57.49.51805: tcp 1460
16:28:32.249276 IP 208.111.128.80.80 > 129.63.57.49.51805: tcp 1460
16:28:32.249279 IP 208.111.128.80.80 > 129.63.57.49.51805: tcp 1460
16:28:32.249282 IP 129.63.29.96.2837 > 204.2.192.16.80: tcp 0
16:28:32.249284 IP 129.63.61.40.56035 > 72.14.205.147.80: tcp 0
16:28:32.249328 IP 8.3.209.233.80 > 129.63.56.9.49730: tcp 1448
16:28:32.249362 IP 8.3.209.233.80 > 129.63.56.9.49730: tcp 1448
16:28:32.249412 IP 129.63.70.157.52638 > 24.232.133.165.16631: tcp 1460
16:28:32.249415 IP 129.63.56.9.49730 > 8.3.209.233.80: tcp 0
16:28:32.249515 IP 129.63.56.9.49730 > 8.3.209.233.80: tcp 0
16:28:32.249619 IP 24.6.124.108.41614 > 129.63.66.169.3342: tcp 1460
16:28:32.249721 IP 8.3.209.233.80 > 129.63.56.9.49730: tcp 1448
16:28:32.249760 IP 8.3.209.233.80 > 129.63.56.9.49730: tcp 1448
16:28:32.249843 IP 68.150.150.106.26079 > 129.63.71.37.2938: tcp 1460
16:28:32.249890 IP 8.3.209.233.80 > 129.63.56.9.49730: tcp 1448
16:28:32.249893 IP 12.182.252.65.80 > 129.63.166.129.4649: tcp 0
16:28:32.249956 IP 211.207.181.240.9900 > 129.63.203.43.2388: tcp 1460
16:28:32.249959 IP 129.63.27.152.49433 > 124.107.252.97.24869: tcp 348
16:28:32.250043 IP 87.194.221.52.47135 > 129.63.54.9.4622: tcp 1352
16:28:32.250083 IP 66.162.107.141.80 > 129.63.134.56.1151: tcp 1460
16:28:32.250085 IP 211.207.181.240.9900 > 129.63.203.43.2388: tcp 1460
16:28:32.250088 IP 12.182.252.65.80 > 129.63.166.129.4648: tcp 0
16:28:32.250090 IP 12.182.252.65.80 > 129.63.166.129.4649: tcp 730
16:28:32.250093 IP 12.182.252.65.80 > 129.63.166.129.4649: tcp 730
16:28:32.250138 IP 129.63.27.163.3672 > 61.231.184.245.9927: tcp 0
16:28:32.250204 IP 66.162.107.141.80 > 129.63.134.56.1151: tcp 1460
16:28:32.250207 IP 66.162.107.141.80 > 129.63.134.56.1151: tcp 468
16:28:32.250212 IP 12.182.252.65.80 > 129.63.166.129.4648: tcp 299
16:28:32.250257 IP 129.63.70.157.52638 > 24.232.133.165.16631: tcp 1460
16:28:32.250260 IP 129.63.56.9.49730 > 8.3.209.233.80: tcp 0
16:28:32.250262 IP 72.21.202.37.80 > 129.63.57.162.52312: tcp 1460
16:28:32.250264 IP 64.233.185.19.80 > 129.63.35.152.54268: tcp 221
16:28:32.250267 IP 72.21.202.37.80 > 129.63.57.162.52312: tcp 1460
16:28:32.250296 IP 72.21.202.37.80 > 129.63.57.162.52312: tcp 1460
16:28:32.250403 IP 8.3.209.233.80 > 129.63.56.9.49730: tcp 1448
16:28:32.250406 IP 8.3.209.233.80 > 129.63.56.9.49730: tcp 1448
16:28:32.250409 IP 8.3.209.233.80 > 129.63.56.9.49730: tcp 1448
16:28:32.250413 IP 129.63.56.9.49730 > 8.3.209.233.80: tcp 0
16:28:32.250455 IP 129.63.96.117.80 > 222.45.168.185.16159: tcp 1367
16:28:32.250595 IP 8.3.209.233.80 > 129.63.56.9.49730: tcp 1448
16:28:32.250636 IP 8.3.209.233.80 > 129.63.56.9.49730: tcp 1448
16:28:32.250638 IP 8.3.209.233.80 > 129.63.56.9.49730: tcp 1448
16:28:32.250641 IP 68.52.76.14.44740 > 129.63.71.37.3023: tcp 536
16:28:32.250670 IP 129.63.36.117.56318 > 66.152.88.153.80: tcp 0
16:28:32.250764 IP 83.100.187.113.54091 > 129.63.54.50.3505: tcp 1460
16:28:32.250767 IP 129.63.56.9.49730 > 8.3.209.233.80: tcp 0
16:28:32.250769 IP 80.67.87.118.80 > 129.63.227.207.60209: tcp 1460
16:28:32.250772 IP 80.67.87.118.80 > 129.63.227.207.60209: tcp 1460
16:28:32.250774 IP 209.6.223.148.1340 > 129.63.1.24.443: tcp 0
16:28:32.250872 IP 71.184.159.133.63026 > 129.63.30.63.64880: tcp 1448
16:28:32.250875 IP 64.12.24.141.443 > 129.63.53.85.1947: tcp 0
16:28:32.250897 IP 129.63.166.129.4648 > 12.182.252.65.80: tcp 431
16:28:32.250900 IP 129.63.166.129.4649 > 12.182.252.65.80: tcp 0
16:28:32.251014 IP 129.63.70.157.52638 > 24.232.133.165.16631: tcp 1460
16:28:32.251017 IP 129.63.57.49.51805 > 208.111.128.80.80: tcp 0
16:28:32.251019 IP 129.63.56.9.49730 > 8.3.209.233.80: tcp 0
16:28:32.251051 IP 129.63.64.178.2541 > 69.28.153.108.27030: tcp 0
16:28:32.251054 IP 129.63.57.49.51805 > 208.111.128.80.80: tcp 0
16:28:32.251119 IP 129.63.57.162.52312 > 72.21.202.37.80: tcp 0
16:28:32.251122 IP 129.63.134.56.1151 > 66.162.107.141.80: tcp 0
16:28:32.251196 IP 66.74.181.44.20147 > 129.63.151.26.1692: tcp 1460
16:28:32.251237 IP 8.12.96.24.80 > 129.63.28.69.49629: tcp 1460
16:28:32.251240 IP 87.194.192.47.9090 > 129.63.71.37.1822: tcp 0
16:28:32.251309 IP 129.63.56.9.49730 > 8.3.209.233.80: tcp 0
16:28:32.251375 IP 8.12.96.24.80 > 129.63.28.69.49629: tcp 1460
16:28:32.251378 IP 222.35.122.145.3733 > 129.63.96.117.80: tcp 0
16:28:32.251380 IP 129.63.134.56.1151 > 66.162.107.141.80: tcp 0
16:28:32.251562 IP 129.63.56.9.49730 > 8.3.209.233.80: tcp 0
16:28:32.251610 IP 129.63.30.63.64880 > 71.184.159.133.63026: tcp 0
16:28:32.251674 IP 24.23.50.123.51425 > 129.63.66.169.3789: tcp 1192
16:28:32.251677 IP 129.63.1.24.443 > 209.6.223.148.1340: tcp 0
16:28:32.251800 IP 68.126.151.112.30001 > 129.63.27.127.1178: tcp 1420
16:28:32.251848 IP 129.63.70.157.52638 > 24.232.133.165.16631: tcp 1460
16:28:32.251851 IP 129.63.56.9.49730 > 8.3.209.233.80: tcp 0
16:28:32.251854 IP 129.63.134.56.1151 > 66.162.107.141.80: tcp 0
16:28:32.251869 IP 58.136.93.49.63845 > 129.63.57.8.55731: tcp 1420
16:28:32.251873 IP 60.52.21.112.1158 > 129.63.145.89.80: tcp 0
16:28:32.252011 IP 83.100.187.113.54091 > 129.63.54.50.3505: tcp 0
16:28:32.252014 IP 129.63.151.26.1866 > 83.191.234.154.20542: tcp 0
16:28:32.252016 IP 129.63.56.9.49730 > 8.3.209.233.80: tcp 0
16:28:32.252069 IP 129.63.151.26.1866 > 83.191.234.154.20542: tcp 0
16:28:32.252072 IP 129.63.216.93.49608 > 58.177.180.175.23408: tcp 0
16:28:32.252169 IP 222.114.52.78.19101 > 129.63.151.47.1077: tcp 1460
16:28:32.252210 IP 129.63.151.26.1866 > 83.191.234.154.20542: tcp 0
16:28:32.252213 IP 129.63.151.26.1866 > 83.191.234.154.20542: tcp 0
